story_id	edition	human	claude	gemini	agreement	claude_reasoning	gemini_reasoning
Shivhei-Habesht_0079	Shivhei-Habesht	minor	minor	minor	all-agree	R' Aharon's widow appears briefly at the end of the story: she is told to search the chest for two thalers, expresses skepticism, then finds both the coins and the wrapped hairs, corroborating the dream's veracity. She serves as a narrative verification device rather than a driver of the plot, which centers on the post-mortem dream visions and spiritual struggles of the male characters.	A widow is mentioned as being left without money, and she is the recipient of a miraculous gift. However, she remains a passive figure in the narrative, which focuses on the deceased Rabbi Aaron and the events surrounding his death and afterlife.
Shivhei-Habesht_0080	Shivhei-Habesht	minor	major	major	models-agree/human-differs	The sick wife is the central subject of the entire story: the Besht's refusal to heal her, his anger at her husband, and his final revelation all pivot on her identity as a tzadekones whose illness spiritually protects the town. Without her suffering and righteousness, there is no story.	The story revolves around a woman's illness and her role as a protector of the town through her righteousness. The Baal Shem Tov's actions are dictated by her condition, making her central to the narrative's spiritual meaning.
Shivhei-Habesht_0081	Shivhei-Habesht	no-women	no-women	minor	human=claude/gemini-differs	No woman appears as a character in the narrative; the wife is referenced only obliquely through a Rambam legal ruling cited by the Besht, but she has no presence or role in the story's action. The mention of adultery (ניאוף) likewise implies no specific female character.	The story mentions a man who 'as if' forbade his wife to himself, according to the Rambam. The wife is present in the legal/halachic discussion but has no active role.
Shivhei-Habesht_0082	Shivhei-Habesht	no-women	minor	minor	models-agree/human-differs	A woman (the wife, 'אשתקל מלולי'') is briefly mentioned in passing as present in the household, but she plays no active role in the story, which centers on the Besht's miraculous healing intervention for the sick man R' Yosef.	A woman is mentioned as the wife of a sick man. However, she has no direct role in the narrative, which focuses on the Baal Shem Tov and the doctor.
Shivhei-Habesht_0083	Shivhei-Habesht	no-women	no-women	no-women	all-agree	The story revolves entirely around male characters: the Besht, Reb Yosef the melamed, and a doctor; no women appear in any role.	This story focuses on the Ba'al Shem Tov, Rabbi Yosef, and a doctor. No women are mentioned in the narrative.
Shivhei-Habesht_0084	Shivhei-Habesht	no-women	minor	minor	models-agree/human-differs	Women are mentioned once in passing as part of the crowd that followed the funeral procession ('אנשים ונשים'), but they play no individual role and are not characters in any meaningful sense. The story centers entirely on the preacher, the informer, and the parable he delivers.	The story describes a Beshtian figure delivering a eulogy for a deceased informer. While women are mentioned as being part of the crowd, they do not have a specific role in the plot or contribute to the story's meaning.
Shivhei-Habesht_0085	Shivhei-Habesht	no-women	no-women	no-women	all-agree	The story contains no women characters, named or unnamed; it concerns a conversation about a informer and wicked people of the generation, involving only male figures (the rabbi, the preacher, the Hasidim).	This story discusses a rabbi's views on the state of the generation and makes no mention of any women.
Shivhei-Habesht_0086	Shivhei-Habesht	no-women	minor	minor	models-agree/human-differs	A female orphan (יתומה) is mentioned as having been raised in the Besht's home and is the bride in the arranged match, but she plays no active role in the narrative. The story's plot centers entirely on the Besht's miraculous resolution of a financial debt involving R' Zeev, R' Leib Kreminer, and a Polish nobleman.	A woman is mentioned as the orphaned bride who marries an orphaned groom. However, she has no active role in the story's plot, which focuses on the Baal Shem Tov and the financial arrangements for the wedding.
Shivhei-Habesht_0087	Shivhei-Habesht	no-women	no-women	minor	human=claude/gemini-differs	The story features only male characters throughout: Rabbi Pinchas of Koritz, the Besht, the rabbi of Ravne, and Rabbi Avraham Abba. No women appear or are mentioned in any capacity.	While not the focus, the story mentions how the people of Kaminetz are aware of the father's argumentative nature and invite him to sit with the Baal Shem Tov so that he does not interrupt or contradict him. The story also mentions that the people gave him dishes of honey.
Shivhei-Habesht_0088	Shivhei-Habesht	no-women	no-women	no-women	all-agree	The story concerns the Besht's spiritual battle against a hostile priest (komer) and involves only male characters — the Besht, townsmen, the priest, and R' Leib of Sinamai. No women appear in any role.	This story focuses on the conflict between the Baal Shem Tov and a priest, with no mention of any women characters.
Shivhei-Habesht_0089	Shivhei-Habesht	no-women	no-women	no-women	all-agree	The story involves a merchant, a thief, the Baal Shem Tov, and Rabbi Tzvi the scribe — no women appear in any capacity, even in passing.	This story involves a merchant whose goods are stolen, the Ba'al Shem Tov, and a thief. No women are present in the narrative.
Shivhei-Habesht_0090	Shivhei-Habesht	no-women	no-women	no-women	all-agree	The story involves only male figures — R' Nachman of Horodenka and R' Ze'ev Kutsis — at the funeral of the Baal Shem Tov. No women appear in any capacity.	This story describes the thoughts and actions of male rabbis and does not mention any women.
Shivhei-Habesht_0091	Shivhei-Habesht	no-women	no-women	no-women	all-agree	The story revolves entirely around male figures — R' Nachman, R' Yosef of Kamenka, the Baal Shem Tov, the Mokhiakh, and R' Mendele of Premishlan — with no women appearing in any capacity, named or unnamed.	This story is about the travels and death of Reb Nachman, with mentions of other rabbis and scholars. There are no women present or mentioned.
Shivhei-Habesht_0092	Shivhei-Habesht	no-women	no-women	minor	human=claude/gemini-differs	The story revolves entirely around male figures — R' Mendli, the Rav, R' David, R' Fridel, and R' Pinchas — and their prayer practices and interactions. No women appear or are mentioned in any capacity.	The story mentions a woman named Fridel who prays before the ark. While she is mentioned by name, her role is still minor and does not drive the plot or spiritual meaning of the story.
Shivhei-Habesht_0093	Shivhei-Habesht	no-women	no-women	no-women	all-agree	The story features only male characters — R' Mendeli and the Rav — discussing honor and humility. No women appear in any capacity.	This story is about the Baal Shem Tov and Rabbi Mendel complaining about the honor given to the rabbi; no women are mentioned.
Shivhei-Habesht_0094	Shivhei-Habesht	no-women	no-women	no-women	all-agree	The story is entirely about R. Nachman of Horodenka's personal spiritual struggle with foreign thoughts and his immersion in cold and hot mikvehs. No women appear in any capacity.	This story focuses on a male protagonist and his spiritual struggles. No women are mentioned.
Shivhei-Habesht_0095	Shivhei-Habesht	no-women	no-women	no-women	all-agree	The story is a first-person spiritual reflection by R' Mendel of Bar about intrusive thoughts during prayer and eating, with no women appearing in any capacity.	This story focuses solely on the narrator's internal thoughts and feelings during prayer. No women are mentioned or appear in the narrative.
Shivhei-Habesht_0096A	Shivhei-Habesht	no-women	no-women	minor	human=claude/gemini-differs	No women appear as characters in this story, which centers on the preacher (מוכיח), the Besht, the Parnas HaChodesh, the Nagid, and the Rabbi of Hamburg. The sole mention of a woman is the phrase 'בן המילדת' (son of the midwife), used purely as an identifying epithet for the Besht — the midwife herself plays no role in the narrative action.	The story centers around a preacher and his travels, with no significant female characters influencing the plot. Women are not mentioned in the narrative.
Shivhei-Habesht_0096B	Shivhei-Habesht	no-women	no-women	minor	human=claude/gemini-differs	No women appear as characters in this story; the only reference is 'בית הכנסת של נשים' (the women's synagogue), which is used merely as a location where the apparently dead man is laid, not as an indication of any female character's presence or action.	The story involves a man bringing his son, who pretends to be dead, to a synagogue for women. Although the women are present, they are quickly asked to leave and don't play a significant role in the plot.
Shivhei-Habesht_0097	Shivhei-Habesht	minor	minor	minor	all-agree	The Besht's wife appears twice — she comes to tell him the candles are going out and the guests are waiting, and she is present lying on her bed when the holy souls visit, at which point the Besht tells her to cover her face. She has brief actions and one line of dialogue, but the story's central drama — the Besht's grief over the Pavlitsh martyrs, the mystical visitation of Rabbi Akiva and other holy souls, and the theological debate over revenge and reincarnation — does not depend on her.	The Besht's wife is mentioned briefly when she alerts him that the candles are going out. She otherwise does not contribute to the plot or meaning of the story.
Shivhei-Habesht_0098	Shivhei-Habesht	minor	major	major	models-agree/human-differs	The agunah is the central figure around whom the entire narrative revolves: her transgression triggers the brothers' murder plot, the Besht's miraculous vision of the two candles is directly about saving her life, and her ultimate repentance (becoming a בת גמורה) is the story's spiritual resolution. Without her, there is no story.	The story revolves around an *agunah* (abandoned wife) whose actions (infidelity) and potential fate (execution) are central to the plot. The Baal Shem Tov intervenes to save her, making her a key figure in the narrative's development and spiritual message.
Shivhei-Habesht_0099	Shivhei-Habesht	minor	minor	minor	all-agree	Two women appear — the anxious mother who urges her husband to consult the Besht about their son, and the wife who advises her husband to travel with the Besht for safety — but both function solely as catalysts who prompt male action; the narrative centers entirely on the Besht's clairvoyance and miraculous protection.	The shopkeeper's wife appears twice: first, she urges her husband to seek the Baal Shem Tov's help in locating their son, and later suggests traveling with the Baal Shem Tov for safety. While her actions influence the plot, she remains a supporting character, and the story focuses on the shopkeeper and the Baal Shem Tov.
Shivhei-Habesht_0100	Shivhei-Habesht	no-women	no-women	no-women	all-agree	The story revolves entirely around the Baal Shem Tov, the shochet (ritual slaughterer), and R' Baruch, with no women appearing in any capacity. The narrative concerns a question of ritual fitness (kashrut) of an animal and the dismissal of the shochet.	This story focuses on the actions and interactions of male characters (the Baal Shem Tov, Rabbi Baruch, the shochet). No women are mentioned.
Shivhei-Habesht_0101	Shivhei-Habesht	no-women	no-women	no-women	all-agree	The story features only male characters — Rabbi Nachman of Horodenka, the Baal Shem Tov, the rabbi of Polonoye, and a non-Jewish nobleman — with no women mentioned or appearing in any capacity.	This story focuses on the interactions between Rabbi Nachman, the Baal Shem Tov, and other men. No women are present or mentioned.
Shivhei-Habesht_0102	Shivhei-Habesht	no-women	no-women	no-women	all-agree	The story involves only male characters — the Baal Shem Tov, Rabbi Nachman, and the gabbai — with no women appearing in any capacity. The non-Jewish men (נכרים/ערלים) mentioned are also implicitly male in context.	This story involves the Baal Shem Tov, Rabbi Nachman, and a synagogue in a non-Jewish area. No women are mentioned.
Shivhei-Habesht_0103	Shivhei-Habesht	no-women	no-women	no-women	all-agree	The story describes a rabbi's practice of touching his tefillin during and after prayer, and his habit of looking at the siddur during Shema. No women appear in any capacity.	This story describes the actions of a rabbi regarding tefillin and prayer. No women are mentioned or implied.
Shivhei-Habesht_0104	Shivhei-Habesht	no-women	no-women	no-women	all-agree	The Shechina is mentioned only as a rhetorical/devotional frame ('as if the Shechina is praying'), not as an active character in the story's events. No woman appears in any capacity.	This story discusses prayer and humility and does not mention any women.
Shivhei-Habesht_0105	Shivhei-Habesht	no-women	minor	minor	models-agree/human-differs	The Besht's wife is mentioned only in passing as the assumed (but incorrect) reason for his grief — she has already died and plays no active role in the story. The narrative centers entirely on the Besht's spiritual longing to ascend like Elijah.	The Ba'al Shem Tov's wife is mentioned as having died, and the disciples assume this is why he is upset. Her death is background to the real reason for his sorrow.
Shivhei-Habesht_0106	Shivhei-Habesht	no-women	no-women	no-women	all-agree	The passage contains only a first-person declaration about the coming of the righteous redeemer (גואל צדק) and the speaker's obligation to enter the world; no women appear in any capacity.	This brief quote doesn't contain any female characters.
Shivhei-Habesht_0107	Shivhei-Habesht	no-women	no-women	no-women	all-agree	The story concerns the Besht's teachings before his death, transmitted through a chain of male rabbinic figures (the rabbi, his grandfather, R' Aharon of Medzibozh); no women appear in any capacity.	The story involves rabbis and their teachings with no mention of women.
Shivhei-Habesht_0108	Shivhei-Habesht	no-women	no-women	no-women	all-agree	The story concerns a Torah scroll written with money from card games, and the Besht's declaration that it is permanently invalid. No women appear or are mentioned in any capacity.	This story discusses a Torah scroll written with money earned from gambling and the Baal Shem Tov's opinion on it. No women are mentioned.
Shivhei-Habesht_0109	Shivhei-Habesht	no-women	no-women	no-women	all-agree	The story involves only male characters — Rabbi Elimelech and the goldsmith neighbor — with no women present or mentioned in any capacity.	This story involves R. Elimelech and a goldsmith and makes no mention of any women.
Shivhei-Habesht_0110	Shivhei-Habesht	no-women	minor	minor	models-agree/human-differs	The 'שררית' (noblewoman/lady of the estate) appears briefly as the one who sends for R. Matil and rents him the arenda, expressing joy at the arrangement — she is a named actor but plays only a supporting, transactional role in a story centered on the Besht's guidance of R. Matil.	A 'שררית' (noblewoman/female administrator) plays a key role in facilitating the protagonist's lease, impacting his financial trajectory. Although not the central focus, her actions influence the plot significantly. There are also mentions of a wife, but her role is minor.
Shivhei-Habesht_0111	Shivhei-Habesht	no-women	minor	minor	models-agree/human-differs	Rabbi Gershon's wife appears briefly when his son runs to tell her ('לאמו') the news about the factor being arrested in iron chains, but she plays no active role and the story's main focus is on the Besht's prophetic ability to discern the future from Torah study.	A woman appears as the mother of R' Gershon's son and is briefly mentioned relating news. However, she doesn't influence the narrative significantly.
Shivhei-Habesht_0112	Shivhei-Habesht	no-women	no-women	no-women	all-agree	The story centers entirely on the Besht, two male Hasidic disciples (R' Zeev Kotzkes and R' David Purkes), a sick male student, and a hidden boy; no women appear or are referenced in any capacity.	This story focuses on the Besht's interactions with male disciples and a dying student; no women are mentioned or play any role in the narrative.
Shivhei-Habesht_0113	Shivhei-Habesht	no-women	no-women	no-women	all-agree	The story centers entirely on R' Moshe Kedes, a male teacher, and the Baal Shem Tov; no women appear in any capacity, named or unnamed.	This story is about a male scholar and the Baal Shem Tov. No women are mentioned or appear in the narrative.
Shivhei-Habesht_0114	Shivhei-Habesht	no-women	no-women	no-women	all-agree	The story centers entirely on R. Moshe ben R. Yakil and the Besht's warning about the city of Venice, which ultimately comes true. No women appear or are mentioned in any capacity.	The story focuses on a man's journey and death, with no mention of any women.
Shivhei-Habesht_0115	Shivhei-Habesht	no-women	no-women	no-women	all-agree	The story centers entirely on the Baal Shem Tov and R' Moshe the mohel, with no women appearing or mentioned in any capacity. The wedding journey ('נשואין') is referenced only as a destination, not involving any female character.	This story involves the Besht as a mohel, and describes a journey. No women are mentioned.
Shivhei-Habesht_0116	Shivhei-Habesht	no-women	no-women	no-women	all-agree	The story involves only male characters — the Baal Shem Tov, R' Baruch, the rabbi of Ostroy, R' Yosef of Kaminke, and the spirit of the Chacham Tzvi — with no women mentioned or appearing in any capacity.	This story recounts a message from beyond the grave passed by the Baal Shem Tov to a rabbi, without mentioning any women.
Shivhei-Habesht_0117	Shivhei-Habesht	no-women	no-women	no-women	all-agree	The story involves a sick male patient, a Jewish doctor, and the Baal Shem Tov — all male characters. No women appear in any capacity.	This is a story about a sick man healed by the Baal Shem Tov; no women are mentioned.
Shivhei-Habesht_0118	Shivhei-Habesht	no-women	minor	minor	models-agree/human-differs	A wife is briefly mentioned (the servant Reb Aharon married a woman, which prompted him to leave his post), but she plays no active role in the story, which centers on the Besht exposing the servant's theft. Her mention is purely incidental background.	A man is mentioned marrying a woman, but she does not feature in the story itself. The story focuses on the man's actions and his relationship with the Ba'al Shem Tov.
Shivhei-Habesht_0119	Shivhei-Habesht	no-women	no-women	no-women	all-agree	The story involves the Besht, a demon, and a male scribe; no women appear in any capacity.	This story focuses solely on the Baal Shem Tov and his interactions with a scribe and a demon, with no mention of any female characters.
Shivhei-Habesht_0120	Shivhei-Habesht	no-women	no-women	no-women	all-agree	The story involves only the Besht, his son R' Tzvi, and the town's rabbi; no women appear or are referenced at all.	This story involves the Besht and his son and does not mention any women.
Shivhei-Habesht_0121	Shivhei-Habesht	no-women	no-women	no-women	all-agree	No women are mentioned or implied; the narrative focuses entirely on the rabbi's financial piety.	This story discusses financial matters and charity, but there is no mention of any women characters being involved.
Shivhei-Habesht_0122	Shivhei-Habesht	major	minor	major	human=gemini/claude-differs	The wife appears briefly as a character who takes some of the money and returns it when confronted, but she is a supporting figure in a story centered on the Besht's spiritual practice and charitable distribution of funds.	The story revolves around the wife taking money and her interaction with her husband, which is central to the narrative's development and resolution. Her actions directly influence the plot and the Rebbe's subsequent actions.
Shivhei-Habesht_0123	Shivhei-Habesht	minor	minor	minor	all-agree	The daughter-in-law (כלתו) and the gentile sorceresses (נכריות כשפניות) are mentioned only as backstory explaining how the poltergeist/spirit (לץ) came to inhabit the house; the narrative's main action centers entirely on the Mokhiach and the Besht confronting and expelling the spirit, with no further role for any woman.	The story mentions the rabbi's daughter-in-law who is experiencing difficulty raising her children and uses witchcraft. While she is the cause of the problem, the story focuses on the rabbi and the Besht's intervention, so her role is minor.
Shivhei-Habesht_0124	Shivhei-Habesht	no-women	no-women	no-women	all-agree	The story involves only male characters: the Baal Shem Tov, his son R. Tzvi, and a male guest. No women appear in any capacity.	This story involves the Besht, his son, and a guest. No women are mentioned or implied.
Shivhei-Habesht_0125	Shivhei-Habesht	no-women	no-women	no-women	all-agree	The story involves the Besht, a preacher (מוכיח), a householder (בעה״ב), and a malevolent spirit (מזיק) — no women appear in any capacity.	This story involves the Baal Shem Tov, a *mochiach*, and the owner of an impure house. No women are mentioned or appear in the narrative.
Shivhei-Habesht_0126	Shivhei-Habesht	no-women	no-women	no-women	all-agree	The story features only male characters: the Besht, the householder, the gabai, and the visiting preacher. No women appear in any capacity.	This story describes the Besht's anger at a preacher for speaking ill of the Jewish people. No women are mentioned or involved in the narrative.
Shivhei-Habesht_0127	Shivhei-Habesht	no-women	no-women	no-women	all-agree	The story centers entirely on the Besht's dream encounter with a former Canaanite slave and his intercession in the heavenly court on behalf of the slave and a Jewish innkeeper. No women appear or are mentioned in any capacity.	This story focuses on the Ba'al Shem Tov's dream and interaction with a non-Jewish former servant, without mention of women.
Shivhei-Habesht_0128	Shivhei-Habesht	no-women	no-women	no-women	all-agree	The story involves the Baal Shem Tov, his men, and a Canaanite slave who plotted to kill them overnight; no women appear in any capacity.	The story involves the Baal Shem Tov and his servants, and does not mention any women.
Shivhei-Habesht_0129	Shivhei-Habesht	no-women	no-women	no-women	all-agree	The story fragment involves only male characters in a confrontational exchange near Nemirov; no women are mentioned or implied in any capacity.	This story does not contain any female characters; it is about the Baal Shem Tov and another man discussing why the latter wanted to kill the former.
Shivhei-Habesht_0130	Shivhei-Habesht	no-women	no-women	no-women	all-agree	The story concerns R. Yechiel Michel of Zlotchov receiving heavenly commands to accept the Baal Shem Tov and later the Maggid as his rabbi, with a wedding mentioned only as a time marker. No women appear or act in any capacity.	This story discusses the lineage of rabbis and does not include any women characters.
Shivhei-Habesht_0131	Shivhei-Habesht	no-women	no-women	no-women	all-agree	The story involves only male characters — R' Eliezer of Amsterdam, R' Nachman of Horodenka, and R' Shimshon son of R' Nachman — with no women appearing in any capacity.	The story focuses entirely on the actions and interactions of male rabbis; no women are mentioned.
Shivhei-Habesht_0132	Shivhei-Habesht	no-women	minor	no-women	human=gemini/claude-differs	No woman appears as a character in the story; the narrative centers on a childless wealthy man and the Besht's interaction with him regarding the cursed bed and the promise of sons. Women are entirely absent from the action, though a wife is implicitly presupposed by the wish for children — she is not mentioned even in passing.	This story focuses on a wealthy man, the Baal Shem Tov, and the issue of having children. No women are mentioned or play any role.
Shivhei-Habesht_0133	Shivhei-Habesht	no-women	minor	minor	models-agree/human-differs	Three unnamed women appear in the climactic battle episode — captured by the Haidamak bandits and forced to drive wagons of straw toward the fortress — but they are passive instruments of the attackers rather than agents, and the story's central focus is the Besht's spiritual intervention to cancel evil decrees against Israel.	Three unnamed women appear in the story, forced to assist bandits in their attempt to burn down a fortress. Their role is brief and supports the larger narrative of the bandits' attack and subsequent defeat.
Shivhei-Habesht_0134	Shivhei-Habesht	no-women	no-women	no-women	all-agree	No women appear as characters in this story; it centers entirely on the Besht's illness, his tefillin saving him from the accuser, and R' Gershon's intercession at the heavenly court. The מטרוניתא mentioned at the end is cited as a Tikkunei Zohar concept illustrating the commandment of tefillin, not as an active character in the narrative.	This story focuses on the Besht's illness and a vision he has about overcoming accusations through wearing tefillin. No women are present in the narrative.
