story_id	edition	human	claude	gemini	agreement	claude_reasoning	gemini_reasoning
Adat-Zadikim_0001	Adat-Zadikim	major	minor	major	human=gemini/claude-differs	Shabbtai the bookbinder's wife appears in the story—she is called before the Besht, and her husband extracts a promise from her not to accept charity from neighbors—but the narrative centers on Shabbtai's own piety and self-sacrifice, with the wife serving a supporting, contextual role rather than driving the plot or spiritual meaning.	The story revolves around a poor bookbinder and his wife and the lengths they go to in order to uphold the Sabbath, even when they have no money for food or candles. The wife's actions and agreement with her husband are crucial to the story.
Adat-Zadikim_0002	Adat-Zadikim	no-women	no-women	minor	human=claude/gemini-differs	The story revolves entirely around the Baal Shem Tov, his disciple/innkeeper, and the community leaders of Brod; no women appear or are mentioned in any capacity.	While the story primarily revolves around the Ba'al Shem Tov and a male innkeeper, the innkeeper's wife is mentioned in passing. She doesn't play a significant role in the plot or thematic development, but her presence, however brief, places the story in the 'minor' category.
Adat-Zadikim_0003	Adat-Zadikim	minor	minor	minor	all-agree	The Besht's daughter appears repeatedly and has active roles — pressuring her father about Passover provisions and welcoming the guest — but the story's spiritual core (the Besht's oath, losing and regaining his share in the World to Come, his selfless devotion) does not hinge on her character or qualities. The guest's wife is also briefly mentioned as the recipient of the Besht's blessing for a child, but she has no agency or voice.	The story centers on the Baal Shem Tov and his travels, but his daughter and the guest's wife have minor roles. The daughter asks about Passover provisions, and the guest's wife's barrenness is mentioned as part of the miracle, but they are not central to the plot's progression or spiritual meaning.
Adat-Zadikim_0004	Adat-Zadikim	minor	major	minor	human=gemini/claude-differs	The bride (כלה) is the central figure whose mysterious death-like collapse is the entire purpose of the Besht's journey and drives every event in the story — her revival and return to the wedding canopy is the narrative's climax and spiritual focus. Without her, there is no story.	While the story revolves around a wedding and a bride who seemingly dies, she is a passive character. The focus is on the Ba'al Shem Tov's actions and the miracle he performs, not on the bride herself or her agency.
Adat-Zadikim_0005	Adat-Zadikim	no-women	no-women	minor	human=claude/gemini-differs	The story features only male characters: the Besht, his disciples, the innkeeper (זקן), the lord's officer (שוטר), and a passing traveler. No women appear in any capacity.	While the story focuses on the Ba'al Shem Tov and a village elder's faith, the narrative mentions the elder having a household ('b'b'), implying the existence of a wife, though she doesn't appear or play any role.
Adat-Zadikim_0006	Adat-Zadikim	minor	no-women	minor	human=gemini/claude-differs	The story features exclusively male characters — Rabbi Mikhl of Zlotchov, the unnamed man sent to learn bitachon, and the wealthy merchant of Berdichev. No women appear or are mentioned in any capacity.	This story revolves around a man learning about faith from a wealthy man. While the story mentions the wealthy man's household and servants, no specific woman plays a significant role in the narrative. Therefore, the story is categorized as 'minor'.
Adat-Zadikim_0007	Adat-Zadikim	minor	minor	minor	all-agree	The tavern keeper's wife appears briefly in the backstory: she pressures and curses her husband to take a human business partner during their financial crisis, which incidentally spurs him to go to the field and make his vow of partnership with God. While she functions as a narrative catalyst for that pivotal moment, she is not foregrounded as a character and the story's spiritual core — the man's extraordinary bitachon — does not depend on her.	A man's wife is mentioned as pressuring him to take on a partner and cursing him. However, she is a background figure whose actions do not drive the plot or spiritual meaning. The story focuses on the man's faith and actions.
Adat-Zadikim_0008	Adat-Zadikim	minor	no-women	no-women	models-agree/human-differs	The story centers entirely on R' Yaakov (the Besht's servant) and the wealthy Italian patron; no women appear or are mentioned in any capacity throughout the narrative.	This story recounts the travels of a servant of the Besht to earn a living by telling stories. No women appear in the story.
Adat-Zadikim_0009	Adat-Zadikim	minor	no-women	minor	human=gemini/claude-differs	The story focuses entirely on male characters — Rabbi David of Mikliev, the Baal Shem Tov, the parnas, and a visiting preacher — with no women mentioned or appearing in any capacity.	A woman is mentioned as part of a group (townspeople), but she does not play any direct role in the story's plot or spiritual meaning. The story focuses on the actions and spiritual journey of Rabbi David.
Adat-Zadikim_0010	Adat-Zadikim	minor	minor	minor	all-agree	Toyvele (טובעלע), the named wife of the wealthy R' Shmuel, initiates the Besht's visit by pressuring her husband to summon him, and her social standing causes the townspeople to hesitate before acting against the shochet — but the story's main spiritual and narrative thrust centers on the Besht's miraculous detection of non-kosher meat and the exposure of the fraudulent shochet. The Duchess (דוכסית) also appears briefly as a background actor. Both women are supporting figures rather than central ones.	Although the story centers around the Ba'al Shem Tov, Reb Shmuel's wife, Toybele, plays a crucial role in convincing her husband to invite the Ba'al Shem Tov, which initiates the plot. The duchess is also mentioned as becoming involved, but these actions don't make either of them the central focus.
Adat-Zadikim_0011	Adat-Zadikim	no-women	no-women	no-women	all-agree	The story centers entirely on the Besht, his disciples, and a nobleman (Adon), culminating in a revelation that the nobleman was Elijah the Prophet; no women appear or are mentioned in any capacity.	This story focuses on the Ba'al Shem Tov, his students, and the appearance of Elijah the prophet. No women are mentioned or play any role in the narrative.
Adat-Zadikim_0012	Adat-Zadikim	no-women	no-women	minor	human=claude/gemini-differs	The story focuses entirely on male figures — the young Rabbi Menachem Mendel of Vitebsk, the Maggid of Mezeritch, the Baal Shem Tov, and Rabbi Yaakov Yosef of Polonnoye. No women appear in any capacity.	While not the main focus, the story mentions the protagonist's attention to his appearance (hair and clothes) and the reactions of others to his behavior (smoking without a hat). These details, though brief, acknowledge a female presence in the community and social expectations, thus qualifying as a minor role.
Adat-Zadikim_0013	Adat-Zadikim	major+minor	major	major	models-agree/human-differs	The Rebbetzin is the driving force of the narrative: she goes to buy fish, waits persistently, is publicly humiliated and robbed by the wealthy woman, and returns home weeping — her suffering and degradation directly trigger the Rabbi's dramatic intervention. The entire plot hinges on what happens to her.	The story revolves around the הרבנית's efforts to obtain fish for Shabbat and her humiliation by the wealthy woman. Her suffering and the injustice she experiences are central to the plot, driving the הרב's actions and the story's outcome. The wealthy woman is also a key character, as it is her actions that lead to the conflict.
Adat-Zadikim_0014	Adat-Zadikim	minor	major	major	models-agree/human-differs	The duchess (דוכסה) is a central actor who drives the entire plot: her curiosity, her burning desire for the handsome merchant, and her active solicitation—offering to return all the money and give the goods as a gift—directly cause the moral transgression that is the story's crux. Without her initiative and role, the narrative has no conflict.	The duchess is central to the story. Her desire for one of the merchants drives the plot, leading to the immoral act and subsequent regret.
Adat-Zadikim_0015	Adat-Zadikim	major	major	major	all-agree	The man's wife is a driving force throughout the narrative: her repeated weeping, demands, and ultimatums are what propel her husband to seek a rabbinical answer, and her explicit consent to accept poverty is the pivotal decision that advances the plot. Additionally, a second woman—the former betrothed whom the husband wronged—is the spiritual cause of the childlessness and the object of the entire quest, making women central to both the problem and the resolution of the story.	The story revolves around a man's infertility and his wife's distress over it. Her insistence on him seeking a solution from the rabbi is the catalyst for the entire plot, making her indirectly responsible for the events that unfold.
Adat-Zadikim_0016	Adat-Zadikim	minor	minor	minor	all-agree	A woman appears near the end of the story — a Jewish woman found naked and freezing after her horse bolted with her clothes during her immersion night (ליל טבילה) — and she speaks, explaining her plight. However, the story's central spiritual drama is the informer's mid-prayer repentance, and the woman functions as a recipient of his newly demonstrated compassion rather than as a driver of the narrative.	A woman appears as a victim who needs help, but her role is limited to this episode and doesn't drive the overall meaning of the story, which focuses on the man's repentance.
Adat-Zadikim_0017	Adat-Zadikim	no-women	no-women	minor	human=claude/gemini-differs	The story revolves entirely around a male nobleman from Vilna, the Maggid of Mezeritch, the King of Prussia, and various male townspeople and doctors. No women appear or are mentioned in any capacity.	The story revolves around a man from Vilna who falls ill, and doctors are called to heal him. While the sick man's wife is not mentioned, the story focuses on the communal concern and the actions of the doctors, not on any female character specifically.
Adat-Zadikim_0018	Adat-Zadikim	no-women	no-women	minor	human=claude/gemini-differs	The story centers entirely on the encounter between Dov Ber and the Baal Shem Tov, focusing on Dov Ber's spiritual transformation and recognition of the Besht's greatness. No women appear or are mentioned in any capacity.	A story about the Maggid of Mezritch's (Rabbi Dov Ber's) initial skepticism about the Baal Shem Tov. It mentions the Maggid having a servant, but otherwise women play no active role in the narrative.
Adat-Zadikim_0019	Adat-Zadikim	no-women	no-women	no-women	all-agree	The story is a mystical letter from the Baal Shem Tov describing his soul-ascent, visit to the heavenly court, and encounter with the Messiah — no women appear in any capacity. The Shechina is not mentioned as a character in the narrative action.	This is a letter from the Baal Shem Tov describing his soul ascent and teachings. There are no women mentioned.
Adat-Zadikim_0020	Adat-Zadikim	no-women	no-women	no-women	all-agree	The story centers entirely on Rabbi Aaron of Karlin, the Maggid of Mezeritch, and their male disciples. No women appear or are mentioned in any capacity.	This story focuses exclusively on male figures (Rebbe Aharon, the Maggid, and students) and their interactions. No women are mentioned or play any role in the narrative.
Adat-Zadikim_0021	Adat-Zadikim	no-women	minor	minor	models-agree/human-differs	The orphaned daughter of R' Aharon is the subject of the betrothal arrangement that frames the story, but she does not appear, speak, or act in the narrative itself. The story's spiritual drama centers entirely on the male rabbis present at the signing of the tenaim.	A woman is mentioned as a bride in a marriage arrangement, but the focus of the story is on the men involved and their reactions. Therefore, the woman plays a minor role.
Adat-Zadikim_0022	Adat-Zadikim	no-women	no-women	no-women	all-agree	The story focuses entirely on the communal and civic process of appointing Rabbi Moses Isserles (the Rema) as rabbi of Kraków, involving male community leaders and a bishop. No women appear or are mentioned in any capacity.	This story focuses on the selection of a rabbi and interactions with the bishop. There are no women mentioned or involved in the narrative.
Adat-Zadikim_0023	Adat-Zadikim	no-women	minor	minor	models-agree/human-differs	Two women appear: R. Chaim's deceased wife, whose death sets the plot in motion but who is only mentioned in passing, and the baker's daughter who is sought as a bride but never speaks or acts. Neither woman drives or shapes the story's spiritual meaning, which centers on R. Chaim's humility and his friendship with Rabbeinu Moshe.	Although a woman's death (the wife of a rabbi) prompts a significant part of the plot regarding his remarriage prospects, women ultimately serve as objects of marriage arrangements rather than active agents. The story focuses on the relationship between the two rabbis and the secret arrangements made for the second rabbi's remarriage, with the woman remaining a passive figure in the background.
Adat-Zadikim_0024	Adat-Zadikim	minor	minor	minor	all-agree	Two married women appear as the passive objects of the adultery whose sin caused the plague, and their exposure is the story's resolution — but they have no voice, agency, or characterization of their own; the narrative foregrounds the rabbi's spiritual powers and the mystery of the 33 praises throughout.	The story describes the funeral and eulogies for a rabbi. It mentions that men, women and children came to mourn. However, no specific woman plays a role in the story's events or meaning.
Khal-Hasidim_0001	Khal-Hasidim	minor	minor	minor	all-agree	The wife of R' Eliezer (the Besht's father) is briefly mentioned — she escapes captivity and becomes a midwife to survive — but she plays no further role in the narrative, which centers entirely on R' Eliezer's captivity, faithful service, and divinely-guided military counsel.	The story focuses on the father of the Ba'al Shem Tov, but his wife is mentioned in passing as fleeing to another city and working as a midwife. This is a minor mention.
Khal-Hasidim_0002	Khal-Hasidim	minor	minor	major	human=claude/gemini-differs	R' Adam's wife appears briefly in one episode, complaining about their poverty and taking a garment from the magical chamber before returning it at her husband's urging; she is active but peripheral to the story's main narrative, which centers on R' Adam's miraculous deeds and the transmission of the holy writings to the Besht.	A woman, the wife of Reb Adam, is featured in a significant anecdote where her desire for material comfort and Reb Adam's insistence on enduring hardship become central to a moral lesson in the story.
Khal-Hasidim_0003	Khal-Hasidim	minor	minor	minor	all-agree	The Besht's wife (also the rabbi's sister) is briefly mentioned as a travel companion and recipient of her brother's pity, prompting the household arrangement, but she plays no active role in the story's central spiritual narrative about the frog/gilgul and the Besht's powers.	The story mentions the Baal Shem Tov's wife in passing when discussing his travels. She has no active role in the plot; the story focuses on the Baal Shem Tov's spiritual journey and interactions with other men.
Khal-Hasidim_0004	Khal-Hasidim	minor	minor	minor	all-agree	The Besht's wife appears multiple times — managing the household livelihood, hosting guests, baking twelve challahs, and conversing with the stranded traveler — but these appearances serve to illuminate the Besht's hidden saintliness rather than to foreground her own role. She is a recurrent supporting presence, not a driver of the story's spiritual or narrative arc.	The wife is present in the story. She is shown preparing food, and taking care of the house, but she does not drive the narrative forward. The story focuses on the Ba'al Shem Tov and the visiting disciple.
Khal-Hasidim_0005	Khal-Hasidim	no-women	no-women	no-women	all-agree	The story describes the Baal Shem Tov hiding in forests, caves, and mountains for solitary devotion and immersion in a mikveh before his public revelation — no women appear or are referenced in any capacity.	This story discusses the Baal Shem Tov's hiding places and doesn't mention any women.
Khal-Hasidim_0006	Khal-Hasidim	no-women	major	major	models-agree/human-differs	Two women — the wealthy man's daughter and the nobleman's daughter — are both central to the plot: their madness drives all action, and the Besht's miraculous healings of them constitute the story's entire spiritual and narrative content. Without these women and their afflictions, there is no story.	This story prominently features two women: a wealthy man's daughter in Helytsh and the daughter of a nobleman in Pystin. Both women suffer from madness, and the Besht's actions directly address and resolve their conditions. The narrative hinges on their illnesses and the Besht's interventions, making them central to the plot's development and the Besht's miracles.
Khal-Hasidim_0007	Khal-Hasidim	no-women	no-women	error	human=claude/gemini-differs	The story centers entirely on Rabbi Zeev (the av beit din) and the Baal Shem Tov, depicting the rabbi's skepticism, his alarming encounter with the Besht during prolonged prayer, and his subsequent submission. No women appear in any capacity.	429 Resource exhausted. Please try again later. Please refer to https://cloud.google.com/vertex-ai/generative-ai/docs/error-code-429 for more details.
Khal-Hasidim_0008	Khal-Hasidim	no-women	no-women	no-women	all-agree	No women appear anywhere in this narrative, which focuses on the Besht, the narrator's father-in-law (Sender the scribe/shochet), and an incident involving a dybbuk.	The story does not feature any women. It is about the Baal Shem Tov and his interactions with scribes and a man who was frightened while trying to exorcise a spirit.
Khal-Hasidim_0009	Khal-Hasidim	minor	minor	major	human=claude/gemini-differs	Two women appear in the story: the Besht's wife (R' Gershon's sister), who briefly resists pressure to divorce and quietly protects the Besht's secret, and the madwoman (אשה משוגעת) who reveals his heavenly oath and drives a vivid episode. Both women are meaningful to specific scenes, but neither is the central subject — the story's primary focus remains the Besht's own spiritual development and revelation (התגלותו).	The story features the Baal Shem Tov and his interactions with a madwoman who reveals insights about him. Furthermore, the Besht's host's wife refuses to divorce him despite pressure from her brother, recognizing his spiritual worth. These women play significant roles in shaping the narrative and demonstrating the Besht's spiritual power.
Khal-Hasidim_0010	Khal-Hasidim	no-women	minor	minor	models-agree/human-differs	A woman ('נכריות אשת בעל הרחים') appears only at the very end of the story, arriving in tears to report that her husband went home angry and killed two creatures; the narrative's central action — the Besht's exorcism of the evil spirit from the tax-collector's house — does not depend on her in any way.	A woman, the wife of a mill owner, appears at the end of the story. She speaks briefly, but the story focuses on the Baal Shem Tov and the excise collector.
Khal-Hasidim_0011	Khal-Hasidim	no-women	minor	minor	models-agree/human-differs	The tax collector's wife appears briefly at the end of the story — she steps away hoping he might rest, then checks on him and finds him dead — but she is unnamed and her role is incidental to the narrative's main thrust (the Besht's prophetic vision and the tax collector's failure to repent). Two other women are mentioned only in passing: R' Yaakov's deceased wife (implied by 'אלמן מאשתו') and the unnamed woman he is traveling to wed.	The story mentions the wife of the tax collector, but she only appears at the end when he dies. Her presence does not drive the story.
Khal-Hasidim_0012	Khal-Hasidim	minor	minor	major	human=claude/gemini-differs	The Besht's daughter appears several times — pressuring him about Passover provisions, receiving the guest, and being named as one who would be endangered on the sea voyage — but she functions as a supporting presence rather than a driver of the story's main spiritual arc, which centers on the Besht's oath, the loss and restoration of his share in the World to Come, and the failed voyage to the Land of Israel. The guest's wife is also briefly mentioned as the recipient of the Besht's blessing but plays no independent role.	The story features the Baal Shem Tov traveling with his daughter. Her anxiety about Passover and her interaction with the guests are directly referenced, making her a necessary part of the story.
Khal-Hasidim_0013	Khal-Hasidim	major	major	major	all-agree	The Besht's daughter, the named and lauded Marat Adel, is the active agent who drives the story's resolution: her distress at the riverside, her weeping, and her encounter with the wealthy benefactor are what set in motion the Besht's spiritual restoration — without her actions the plot cannot advance. Her emotional state and initiative are explicitly foregrounded and indispensable to the narrative.	Adel, the Ba'al Shem Tov's daughter, plays a crucial role. Her distress and actions lead to the wealthy man's intervention, which in turn restores her father's spiritual state and allows him to properly lead the Passover Seder. The story depends on her actions and emotions, making her a major character.
Khal-Hasidim_0014	Khal-Hasidim	no-women	no-women	minor	human=claude/gemini-differs	No women appear or are mentioned in any capacity in this story; it revolves entirely around the Besht and a series of male rabbis and a doctor. The Shechina is invoked only as an abstract divine presence accompanying the Besht, not as an active character in the narrative.	The story focuses on the Ba'al Shem Tov and various rabbis. Although the Shechina is mentioned, it does not appear as a character. The sick rabbi mentions a feeling of the Shechina's presence with the Ba'al Shem Tov, but this is a fleeting reference rather than a depiction of a female character.
Khal-Hasidim_0015	Khal-Hasidim	no-women	minor	minor	models-agree/human-differs	Women are mentioned in passing within the Besht's prophetic letter as part of a crowd ('אנשים ונשים וטף') that will be found in the courtyard, but they play no individual role and are not characters who shape the story's meaning. The narrative centers on the Besht's letter, his prophetic vision, and the chain of transmission.	Women are mentioned as being part of the 'noise' and chaos that will occur, but they have no specific role in the story's action or meaning. The story focuses on the rabbi and the instructions he receives.
Khal-Hasidim_0016	Khal-Hasidim	no-women	no-women	no-women	all-agree	The story features only male characters — the Besht, R' Gershon, and R' Moshe the Av Beit Din — with no women appearing in any capacity. The narrative centers on the Zohar book, a sigh during prayer, and a defective mezuzah.	This story involves the Baal Shem Tov, Rabbi Gershon, and Rabbi Moshe. No women are present or mentioned.
Khal-Hasidim_0017	Khal-Hasidim	major	major	major	all-agree	The wife is a central, named-quality character whose piety, patience, and — crucially — her initiative in urging her reluctant husband to seek the Besht's help directly drives the plot forward; her speech is quoted at length and her faith (אמונת צדיקים) is foregrounded as the spiritual motor of the narrative.	The story revolves around a scholar and his wife, with the wife's initiative and faith in the Baal Shem Tov being crucial to the plot. Her suggestion to seek the Baal Shem Tov's help drives the narrative forward, making her a key figure.
Khal-Hasidim_0018	Khal-Hasidim	no-women	minor	minor	models-agree/human-differs	Women appear briefly as the cooks (המבשלות) who prepared the Shabbat chicken and noticed a possible kashrut issue, but they play only a passing functional role. The story's central drama revolves around the souls of two men, the ARI's explanation of reincarnation, and the bridegroom's death — none of which depends on the women characters.	The story mentions a woman who is married to the pious man. She has a minor role in the background as the man's wife.
Khal-Hasidim_0019	Khal-Hasidim	minor	minor	minor	all-agree	The wife appears several times — she is told to unload the flour, reports its spoilage to her husband, receives new holiday clothing, and consults her husband about purchasing furs — but she plays a supporting role throughout; the story's central drama concerns R' Gedaliah's struggles, his miraculous encounter with Elijah, and his conflict with the tax farmer.	The story revolves around a man's Passover preparations and the miracles that occur. His wife is only mentioned in passing regarding the flour and later buying clothes.
Khal-Hasidim_0020	Khal-Hasidim	no-women	no-women	no-women	all-agree	The story revolves entirely around male characters: the Baal Shem Tov, R' Gershon Kitover, and a non-Jewish rider; no women are mentioned or implied.	This story focuses on the Baal Shem Tov and a stolen horse. No women are mentioned.
