story_id	edition	human	claude	gemini	agreement	claude_reasoning	gemini_reasoning
Khal-Hasidim_0124	Khal-Hasidim	no-women	minor	minor	models-agree/human-differs	The wife of the Rabbi of Lutsk is mentioned briefly as having given birth to a son ('ותלד אשת הרב מלוצק'), which occasions the circumcision feast that frames the story, but she has no active role and the narrative centers entirely on the dispute between the Besht and the rabbinical authorities over the kashrut of the meat.	A woman (the wife of the man who seeks a child) is mentioned as giving birth, which is necessary to the plot, but she is not a main focus. The story revolves around the Ba'al Shem Tov and the two rabbis.
Khal-Hasidim_0125	Khal-Hasidim	minor	minor	minor	all-agree	The rabbi's wife is actively involved in the story's opening — she prepares the meat, discovers it missing, canvasses neighbors, and alerts the slaughterer — but her role is purely logistical setup for the Besht's miraculous exposure of the corrupt shochet and cantor. The story's spiritual and narrative thrust centers entirely on the Besht, not on her.	The rabbi's wife is mentioned as being concerned about honoring the Baal Shem Tov and trying to find meat, but her actions don't drive the plot. The story focuses on the Baal Shem Tov's interaction with the butcher.
Khal-Hasidim_0126	Khal-Hasidim	minor	minor	major	human=claude/gemini-differs	Rabbi David Pirkus's daughter is the reason for the matchmaking mission — the representatives are sent to find her a groom and a dowry is pledged on her behalf — but she never appears as an active character, has no dialogue or agency, and the narrative focuses entirely on the male emissaries and the prospective grooms they evaluate.	The story revolves around finding a suitable match for Rabbi David Pirkus's daughter. While the daughter herself does not act in the story, the narrative centers on the efforts made to secure her future, highlighting the importance of women in Hasidic family and community life, and the role of the father in securing his daughter's future.
Khal-Hasidim_0127	Khal-Hasidim	no-women	minor	minor	models-agree/human-differs	The Besht's wife is mentioned twice — once as the occasion for a remarriage discussion after her death, and once in passing when the Besht alludes to his conjugal union with her as the context for his son's holy soul — but she never acts, speaks, or shapes the plot. The story centers on the Besht's deathbed scene and transmission of a divine name to his son.	The story mentions the death of the Besht's wife, prompting a discussion about remarriage. The story also mentions the Besht's son was conceived through a mystical union with his wife.
Khal-Hasidim_0128	Khal-Hasidim	no-women	minor	minor	models-agree/human-differs	A young woman ('בתולה אחת בתו של השמש') is briefly mentioned as being harmed by the departing soul the Besht expelled, but she is unnamed, passive, and incidental to the central narrative of the Besht's death. The story's main thrust concerns the Besht's final hours, spiritual preparations, and passing.	A girl, the daughter of the synagogue attendant, is briefly mentioned as being harmed by a spirit that the Baal Shem Tov chases away. This is a very minor incident in a story focused on the Baal Shem Tov's final days.
Khal-Hasidim_0129	Khal-Hasidim	no-women	minor	minor	models-agree/human-differs	An unnamed maiden (the rabbi's niece) is briefly mentioned as the sole person entrusted to bring food and conceal the rabbi's fasting from the household, a supporting logistical role that does not drive the story's spiritual thrust. The narrative centers on the rabbi's extreme fasting practice and the Baal Shem Tov's intervention to stop it.	A young, unnamed female relative of the rabbi brings him food during his fast. While the fast itself is central to the story, her role in it is more as a helpful facilitator than a driver of the narrative or spiritual meaning.
Khal-Hasidim_0130	Khal-Hasidim	no-women	no-women	no-women	all-agree	The story revolves entirely around the Baal Shem Tov, the rabbi of Kahal, and their interactions regarding travel to the Holy Land and intercession for a town; no women appear in any capacity.	This story focuses on the Ba'al Shem Tov and a rabbi, and their interactions regarding a specific city. No women are mentioned or play any role in the narrative.
Khal-Hasidim_0131	Khal-Hasidim	no-women	no-women	no-women	all-agree	The narrative centers entirely on the narrator's interactions with the rabbi of Nemirov and community religious matters (tefillin, psalm-recitation, the Tatar threat). No women appear or are mentioned in any capacity.	This story revolves around the actions and teachings of a rabbi and the anxieties surrounding a military threat. No women are mentioned or play any role in the narrative.
Khal-Hasidim_0132	Khal-Hasidim	no-women	no-women	no-women	all-agree	The story describes the daily Torah study, prayer, and charitable practices of a pious man, with a brief episode involving his son complaining about poverty. No women appear or are mentioned in any capacity.	This story describes the behavior of a Hasid, focusing on his learning, prayer, and charitable acts. No women are mentioned.
Khal-Hasidim_0133	Khal-Hasidim	no-women	no-women	no-women	all-agree	The story concerns a rabbi recounting a spiritual experience of pure prayer while traveling, with all characters being male religious figures (Reb Zushya, Reb Elimelech, the Baal Shem Tov, the author of Toldot Yaakov Yosef). No women appear in any capacity.	This story discusses prayer and lineage, and mentions male figures only.
Khal-Hasidim_0134	Khal-Hasidim	no-women	no-women	no-women	all-agree	The story involves only male characters — the narrator, his father-in-law (חמי), Rabbi Gershon, Rabbi Gedaliah, and Rabbi Tzvi of Kamenitz — recounting a dangerous immersion at sea. No women appear or are mentioned in any capacity.	This story recounts the actions of men, specifically a rabbi's near-drowning experience and rescue at sea, with no women mentioned.
Khal-Hasidim_0135	Khal-Hasidim	no-women	minor	minor	models-agree/human-differs	R' Gershon's wife is mentioned twice — as the subject of his vow of abstinence and as someone he could not persuade to agree to travel to the Land of Israel — but she never speaks, acts, or appears directly in the narrative. The story's spiritual drama centers entirely on the Besht's perception of R' Gershon's sin and his correction of it.	The story centers on Rabbi Gershon and the Baal Shem Tov. While Rabbi Gershon's wife's unwillingness to let him travel to Israel is a key plot point, she is a background figure and does not drive the narrative in a significant way.
Khal-Hasidim_0136	Khal-Hasidim	no-women	no-women	no-women	all-agree	The story centers entirely on male rabbinic figures — Rabbi Shalom, his son Rabbi Leib, and the Rabbi of the Great Synagogue — engaged in communal prayer for rain. No women appear or are mentioned in any capacity.	This is a story about rabbis and their prayers for rain in Jerusalem. No women are mentioned or play any role.
Khal-Hasidim_0137	Khal-Hasidim	no-women	no-women	no-women	all-agree	The story involves only male figures — R' Gershon, the Chakham of Safed, the congregation, the Baal Shem Tov, and R' Lipmman — with no women appearing in any capacity.	This story recounts a dispute between Rabbi Pinchas, a rabbi in Tzfat, and a sage, involving money and an oath. No women are mentioned or play any role in the narrative.
Khal-Hasidim_0138	Khal-Hasidim	no-women	minor	minor	models-agree/human-differs	The Rabbanit (wife of the Or HaChaim) is mentioned once in passing when her husband instructs her to prepare a festive meal for the guest; she plays no further role and is not named or developed. The story centers entirely on R' Gershon Kitover's mission to the Cave of Machpelah on behalf of the Jewish people.	While the story centers on Rabbi Gershon's journey, it mentions the הרבנית (the rebbe's wife) in passing when she is asked to prepare a meal. Her role is purely supportive and does not influence the core narrative, making her a minor character.
Khal-Hasidim_0139	Khal-Hasidim	no-women	no-women	minor	human=claude/gemini-differs	The story recounts exclusively the relationship between Dov Ber of Mezeritch and the Baal Shem Tov, involving only male characters (the two rabbis, their servants, and a non-Jewish wagoner). No women appear in any capacity.	This story focuses on the relationship between Rabbi Dov Ber and the Baal Shem Tov. While a servant is mentioned, no women play a significant role in the narrative.
Khal-Hasidim_0140	Khal-Hasidim	no-women	no-women	minor	human=claude/gemini-differs	The story revolves entirely around male figures — the Maggid, the Baal Shem Tov, R' Mendel, R' Yaakov, R' Eliyahu, and other men. No women appear in any capacity, named or unnamed.	This story primarily focuses on the relationship between the Maggid and the Baal Shem Tov. While there's a brief mention of the Baal Shem Tov's wife in the context of the Maggid staying at their house, she doesn't play an active role in the narrative. A woman from the Maggid's household is mentioned, but she also has no active role in the story.
Khal-Hasidim_0141	Khal-Hasidim	no-women	no-women	no-women	all-agree	The story concerns the Maggid of Mezeritch, Rabbi Menachem Mendel, and Rabbi Levi Yitzchak of Berdichev and the blowing of the shofar on Rosh Hashanah. No women appear or are referenced in any capacity.	This story discusses the customs of blowing the shofar and the reactions of various rabbis; no women are mentioned.
Khal-Hasidim_0142	Khal-Hasidim	no-women	no-women	minor	human=claude/gemini-differs	The story centers entirely on male figures — R' Nachum of Chernobyl, R' Abraham, R' Pilt, the nagid, and various male community members — with no women mentioned or appearing in any capacity.	While no women are central to the plot, a woman is referenced as part of the story, specifically the Reb's wife or a woman involved in serving coffee to someone who is upset.
Khal-Hasidim_0143	Khal-Hasidim	major	major	major	all-agree	The bride (daughter-in-law of the Maggid of Mezeritch) is a central character whose three recurring dreams — in which she pleads before a heavenly court to retain her husband — and whose arguments succeed in extending his life by twelve years form the spiritual climax and main point of the story. Her actions are indispensable to the narrative's meaning.	The story revolves around a woman (the bride) and her mother. The mother negotiates the marriage, and the bride's dream and subsequent actions are crucial to the plot and the rabbi's life.
Khal-Hasidim_0144	Khal-Hasidim	no-women	minor	minor	models-agree/human-differs	Women are mentioned collectively as part of the community scandal—'many men and women defiled by sins' and 'several women need to be divorced'—but they are unnamed, undifferentiated, and entirely passive. The story's plot is driven by the Maggid's instruction, Reb Aharon of Karlin's spiritual perception, and the encounter with the local lord; the women serve only as background context for the moral crisis.	The story involves a rabbi uncovering adultery in a community. Several unnamed women are involved in the adulterous acts, thus playing a minor role in the narrative.
Khal-Hasidim_0145	Khal-Hasidim	no-women	no-women	no-women	all-agree	The story revolves entirely around two male communal emissaries traveling to petition a duke and receiving guidance from a Hasidic rebbe; no women appear or are mentioned in any capacity throughout the narrative.	No women appear in this story. It focuses on two men traveling to a duke, and the obstacles they face on their journey.
Khal-Hasidim_0146	Khal-Hasidim	no-women	no-women	minor	human=claude/gemini-differs	The story features only male characters throughout: the Maggid of Mezeritch, a wealthy man from Vilna, doctors, townspeople, and the Prussian king. No women appear or are mentioned in any capacity.	While the story revolves around a man's illness and search for healing, women are only mentioned as part of the general populace of the city who are concerned about his health. There are no individual women who play a role in the narrative.
Khal-Hasidim_0147	Khal-Hasidim	no-women	no-women	no-women	all-agree	The story centers entirely on the male figures of R. Aharon of Karlin and the Maggid of Mezeritch, along with male disciples; no women appear or are referenced in any capacity.	This story focuses entirely on the relationship between Rabbi Aharon of Karlin and the Maggid of Mezritch, and the interactions between Rabbi Aharon and the Maggid's disciples. No women are mentioned or play any role in the narrative.
Khal-Hasidim_0148	Khal-Hasidim	no-women	minor	minor	models-agree/human-differs	The orphan daughter of Rabbi Aaron is mentioned as the bride in the betrothal arrangement, but she neither acts nor speaks; the story's spiritual focus is entirely on Rabbi Menachem Mendel of Vitebsk's vision of Rabbi Aaron's luminous garments and Rabbi Aaron's humble response.	The story revolves around a wedding arrangement for the daughter of a rabbi; she is mentioned but has no active role, making her a minor character.
Khal-Hasidim_0149	Khal-Hasidim	no-women	no-women	minor	human=claude/gemini-differs	The story focuses entirely on male figures — the Maggid of Mezeritch, the young Menachem Mendel of Vitebsk, the Baal Shem Tov, and Rabbi Yaakov Yosef of Polna. No women appear or are referenced in any capacity.	"Although the story focuses on male figures (the Baal Shem Tov, the Maggid of Mezritch, and Rabbi Menachem Mendel), it does mention that when Rabbi Menachem Mendel became ill in Vitebsk, the whole town wept, ""as if the Holy Ark was being taken from them."" This implies the presence and emotional impact of women in the community, even though they are not central to the plot."
Khal-Hasidim_0150	Khal-Hasidim	minor	minor	minor	all-agree	Two women appear actively — the butcher's wife who brings the complaint to Rabbi Yitzchak, and the tax-farmer's wife who defies his order and is cursed — but they function as catalysts that trigger demonstrations of the rabbi's spiritual power; the story's main thrust is the rabbi's authority and the ensuing communal conflict among male figures.	The story features the wife of a butcher who pleads with the rabbi, and the wife of the Ba'al Taksah who is cursed. Both women play supporting roles in the conflict and resolution, but they are not central to the main narrative about the rabbi and the community's internal strife.
Khal-Hasidim_0151	Khal-Hasidim	no-women	no-women	no-women	all-agree	The story involves two male litigants and Rabbi Yitzchak adjudicating a legal dispute; no women appear or are referenced in any capacity.	This story involves two litigants and the Rabbi. No women are mentioned.
Khal-Hasidim_0152	Khal-Hasidim	no-women	no-women	no-women	all-agree	The story concerns Rabbi Mikhl of Zlotchov receiving heavenly directives to accept the Baal Shem Tov and then the Maggid of Mezeritch as his master; no women appear in any capacity. The mention of his son's wedding (נשואי בנו) implies a bride but she is not referenced even in passing as a character.	The story discusses the lineage of rabbis and their teachings, without mentioning any women characters.
Khal-Hasidim_0153	Khal-Hasidim	no-women	no-women	no-women	all-agree	No women appear in this story; all characters are male rabbis and their male relatives.	The story focuses on the relationship between Rabbi Eliezer and Rabbi Nachman and their journey to Israel. No women are mentioned or play any role in the narrative.
Khal-Hasidim_0154	Khal-Hasidim	minor	no-women	no-women	models-agree/human-differs	The story features only male characters throughout: the holy rabbi R' Yechiel Michel, the unnamed man sent to learn bitachon, and the wealthy merchant of Berdichev, along with his male servants and trustees. No women appear or are mentioned in any capacity.	The story revolves entirely around men: a rabbi, a man seeking to learn trust, and a wealthy man who exemplifies trust in God. No women are mentioned or play any role in the narrative.
Khal-Hasidim_0155	Khal-Hasidim	no-women	no-women	minor	human=claude/gemini-differs	The story involves only male characters: a student, his rabbi, hunters, and the student's deceased father (whose soul is reincarnated in the dog and fish). No women appear in any capacity.	The protagonist's wife is present in the story, preparing the fish and enabling the events of the story. However, her role is secondary to the male protagonist and the rabbi.
Khal-Hasidim_0156	Khal-Hasidim	minor	minor	minor	all-agree	The daughter of R' Mikhl briefly appears as the witness who alerts her brother R' Yitzchak to their father's ecstatic state, enabling the death scene, and R' Yosef's mother and sisters are mentioned in the closing line. These women play supporting roles, but the story's central thrust is R' Yosef's heavenly trial and R' Mikhl's holy death through devekut.	A daughter sees her father in a state of ecstasy and alerts her brother; later, the mother and sisters come to the ill son. They are present, but not central to the plot or meaning, which focuses on the men and their spiritual states.
Khal-Hasidim_0157	Khal-Hasidim	no-women	no-women	minor	human=claude/gemini-differs	The story revolves entirely around male figures: the Rebbe Mikhl of Zlotchov, his ill son, Rabbi Yaakov Yosef of Polna'ah, and the Baal Shem Tov, along with heavenly angels and a divine court. No women appear or are mentioned in any capacity.	Although the story revolves around a sick boy, his mother (or other women) are not mentioned. Women are thus absent from the narrative, except perhaps implicitly as members of the community affected by the burning of the books.
Khal-Hasidim_0158	Khal-Hasidim	no-women	no-women	minor	human=claude/gemini-differs	The story is a parable about two brothers — one rich, one poor — their debt, deaths, heavenly judgment, and reincarnation; no women appear or are mentioned in any capacity throughout the narrative.	Although the story revolves around two brothers, the narrative briefly mentions the poor brother's family (wife and children) who suffer from hunger, but they do not play a significant role in the plot beyond illustrating the consequences of the rich brother's actions. Therefore, the presence of women is minor.
Khal-Hasidim_0159	Khal-Hasidim	major	minor	major	human=gemini/claude-differs	The Rabbanit and the servant girl both appear actively — the Rabbanit initiates the quarrel and has dialogue with the rabbi — but they function as a backdrop to showcase the rabbi's humility and commitment to justice for the weak. The story's spiritual meaning centers entirely on the rabbi's character, not on the women's actions or qualities.	The rabbi's wife is a central figure in the story. Her conflict with the maid prompts the rabbi's surprising action, which is the focus of the narrative.
Khal-Hasidim_0160	Khal-Hasidim	no-women	no-women	no-women	all-agree	The story involves only male characters — a man who complains about his business partner and the holy rabbi who responds. No women appear in any capacity.	This story describes a dispute between two men and the rabbi's response, with no mention of any women.
Khal-Hasidim_0161	Khal-Hasidim	no-women	no-women	no-women	all-agree	The story concerns a group of men playing cards, a Hasid who brings a complaint, and the rebbe's defense of them — no women appear or are referenced in any capacity.	This story focuses on a group of men and their religious practices, with no mention of women.
Khal-Hasidim_0162	Khal-Hasidim	no-women	no-women	minor	human=claude/gemini-differs	No women appear or are referenced as characters in this story, which centers entirely on Rabbi Leib Sarahs, a hosting Nagid, and a servant/coachman and their miraculous journey to Vienna. Although Rabbi Leib's epithet 'שרהס' alludes to his mother Sarah, she does not appear as a character in the narrative itself.	No women are mentioned or play any role in the story. The story focuses on a rabbi and a servant's experience of what seems to be teleportation.
Khal-Hasidim_0163	Khal-Hasidim	no-women	no-women	no-women	all-agree	The story centers entirely on a male servant who is revealed to be a wandering soul, his male master, a male rabbi, and male disciples; no women appear in any capacity.	This story focuses on a rabbi who helps a wandering soul find peace. No women are mentioned or play any role in the narrative.
Khal-Hasidim_0164	Khal-Hasidim	no-women	no-women	no-women	all-agree	No women are mentioned or appear at any point in this narrative about hidden tsadikim and their interactions.	The story describes interactions between various Hasidic figures. There are no women mentioned or involved in the narrative.
Khal-Hasidim_0165	Khal-Hasidim	no-women	minor	major	all-differ	The innkeeper's wife is mentioned briefly when she falls ill alongside her sons as divine punishment for her husband's refusal to obey Rabbi Leib; she does not act, speak, or drive the narrative in any way. Her illness serves only as a plot device to compel the innkeeper's compliance.	The story hinges on the illness of the innkeeper's wife and sons, which is directly linked to the rabbi's power and prophecy. The wife's illness is therefore a key element in the narrative.
Khal-Hasidim_0166	Khal-Hasidim	no-women	no-women	no-women	all-agree	The story involves only two male characters — Rabbi Leib and a male merchant (חנוני) — with no women mentioned or appearing in any capacity.	This is a story about a rabbi who borrows money from a shopkeeper; no women are mentioned.
Khal-Hasidim_0167	Khal-Hasidim	major	minor	minor	models-agree/human-differs	Two women appear: the avrech's wife, mentioned only in passing as having died and adding to his misfortune, and the wealthy heiress (בתולה), who is described at length by the matchmaker but does not herself speak or act in the narrative. Neither drives the plot, which centers on the avrech's relationship with the Rebbe and his matchmaking mission.	The story focuses on a man's trials and tribulations. His wife's death is mentioned, but she's not a character actively involved in the plot.
Khal-Hasidim_0168	Khal-Hasidim	minor	major	major	models-agree/human-differs	The wife is a central, active figure whose steadfast refusal of a divorce, prolonged suffering (self-support through sewing and laundry, estrangement from her father, children's illness), and written letter to her husband constitute the narrative's pivotal crisis and drive the entire second half of the story. Her endurance and the hardship she undergoes are foregrounded at length and are indispensable to the plot's development.	The wife's suffering (being cut off from her family and struggling to support her sick children while her husband is away) is a major plot point that drives the husband to seek help from the Rebbes, and ultimately leads to the climax of the story.
Khal-Hasidim_0169	Khal-Hasidim	no-women	no-women	no-women	all-agree	The story centers entirely on Rabbi Leib, his adopted ward, and the Hasidic disciples; no women appear or are mentioned in any capacity.	This story focuses on the relationships between men, specifically a rabbi and the orphan he raised. No women are mentioned or play any role in the narrative.
Khal-Hasidim_0170	Khal-Hasidim	minor	minor	major	human=claude/gemini-differs	Two women appear: the drunk man's wife, who speaks to the messengers and describes her husband's habits (a supporting expository role), and a nobleman's widow who propositions the man in the embedded backstory (a temptress figure). Neither woman drives the story's spiritual core, which centers on the hidden merit of the drunk man and the Rebbe of Mezhibuzh's insight.	A woman, the wife of the drunkard, is essential to the story's plot. Her description of her husband's condition and habits is what allows the messengers to understand how to get him to make the pronouncement that saves the Jewish people.
Khal-Hasidim_0171	Khal-Hasidim	minor	no-women	minor	human=gemini/claude-differs	The story centers entirely on male figures — R. Tzvi of Zidichov, R. Yehuda Gershon, the emissary-Hasid, and the holy rabbi of Mezhbizh — with no women mentioned in any capacity. The Song of Songs is referenced as a liturgical act, but its female voice does not appear as a character in the narrative.	A woman is mentioned as the recipient of charity. This is a minor reference.
Khal-Hasidim_0172	Khal-Hasidim	no-women	minor	minor	models-agree/human-differs	Women are mentioned once in passing as part of the crowd that followed the funeral procession ('כל העיר אנשים ונשים'), but play no role in the plot or spiritual message. The story centers entirely on the mokhiakh, R' Meir, and the deceased informer.	Women are present as part of the crowd, but they do not have a significant impact on the story's plot or message. The narrative focuses on the Besht's actions and teachings regarding the informer's death and the metaphor of the dog.
