story_id	edition	human	claude	gemini	agreement	claude_reasoning	gemini_reasoning
Mifalot-HaZadikim_0005	Mifalot-HaZadikim	no-women	no-women	no-women	all-agree	The story focuses entirely on Rabbi Shalom's powerful voice and his reading of the Megillah, heard from a great distance. No women appear or are mentioned in any capacity.	This story focuses on the voice of a rabbi and does not mention any women.
Mifalot-HaZadikim_0006	Mifalot-HaZadikim	minor	minor	minor	all-agree	The brother's only daughter (בת יחידה) reaching marriageable age is the financial catalyst that drives the brothers' separation, but she never speaks or acts in the narrative. Women are referenced collectively in passing ('all women give importance to their clothing'), but no woman functions as an active or foregrounded character.	A man has a daughter who is getting married; the story discusses the financial strain it places on the family. Although the daughter's wedding is a plot point, she has no agency or actions of her own.
Mifalot-HaZadikim_0007	Mifalot-HaZadikim	no-women	no-women	minor	human=claude/gemini-differs	The story revolves entirely around male characters — a young shochet, R' Yehoshua the Maggid, and R' Mordechai of Chernobyl — with no women mentioned or appearing in any capacity.	While no women appear as characters, the story refers to the potential kashrut of meat prepared according to Jewish Law and the implied women who keep kosher, cook, and serve food. Although it is a minor detail, this implicates their role in the consumption of kosher meat and indirectly acknowledges their participation in religious observance.
Mifalot-HaZadikim_0008	Mifalot-HaZadikim	minor	minor	minor	all-agree	The sick man's wife appears actively in one episode — she controls the household income, refuses and then relents in giving him money for the pidyon — but once that scene ends she disappears entirely from the narrative. The story's main spiritual thrust concerns the tzaddik's promise, the man's death, and the posthumous dream-vision centered on Kabbalat Shabbat, none of which involve her.	A man asks his wife for money to seek spiritual help, and she is initially reluctant. She plays a role in him receiving help, but the story focuses on the man and the rabbi.
Mifalot-HaZadikim_0009	Mifalot-HaZadikim	no-women	no-women	no-women	all-agree	The story features only male characters throughout: the rabbi, his attendant, and the male disciples gathered in the study house. No women are mentioned or appear in any capacity.	This story describes the actions of male Hasidim and their Rebbe. No women are mentioned.
Mifalot-HaZadikim_0010	Mifalot-HaZadikim	no-women	no-women	no-women	all-agree	The story concerns a dispute between two male rabbinic figures (the Rebbe of Ruzhin and the Rebbe of Savran) and involves only male characters throughout. No women appear in any capacity.	This story discusses a dispute between two rabbis and doesn't mention any women.
Mifalot-HaZadikim_0011	Mifalot-HaZadikim	no-women	no-women	no-women	all-agree	The story involves only male characters — Rabbi Zalminah, the Hasid, and Rabbi Shalom — with no women mentioned or referenced in any capacity. The narrative centers on a dispute between the Hasid and his rebbe about judging a tsadik's spiritual fervor.	This story focuses on the relationship between two rabbis and a hasid, with no mention of women.
Mifalot-HaZadikim_0012	Mifalot-HaZadikim	no-women	no-women	no-women	all-agree	The story features Rabbi Moshe of Savran and a tale about Rabbi Menachem Nachum of Chernobyl; the only other figure mentioned is a non-Jewish male servant (הנכרי) who relit the candle. No women appear in any capacity.	This story recounts a tale of a rabbi and a light being extinguished; no women are present or mentioned.
Mifalot-HaZadikim_0013	Mifalot-HaZadikim	minor	minor	minor	all-agree	An unnamed woman briefly enters the rabbi's room and triggers his flight, but she has no agency, speech, or characterization of her own — she functions solely as a catalyst to illustrate the rabbi's extreme piety. The story's focus is entirely on his behavior and reasoning.	A woman comes to the rabbi's room, causing him to flee in fear. While her presence initiates the rabbi's actions, she is unnamed and plays a passive role, making her a minor character in a story focused on the rabbi's piety.
Mifalot-HaZadikim_0014	Mifalot-HaZadikim	no-women	minor	minor	models-agree/human-differs	The householder's wife is mentioned briefly as sitting with her husband in worry over their distillery problem (אשתו יושבים בדאגה וביגון), but she has no independent role or speech and is not essential to the story's spiritual meaning, which centers on the hidden tzaddik's miraculous powers.	The story mentions the wife of the host, who is worried about the craftsman leaving, but she has no active role in the narrative. The host and the craftsman are the focus.
Mifalot-HaZadikim_0015	Mifalot-HaZadikim	minor	minor	minor	all-agree	The Rabbanit (rabbi's wife) appears briefly in the story when Levi Yitzchak questions her about the cooking, and her piety and humility are noted in passing, but the narrative's main thrust concerns the recognition of Levi Yitzchak's hidden spiritual greatness by Rabbi Shmelke and the lesson about concealed divine intentions in mundane speech. Her role, while providing a key scene, is supporting rather than central to the story's spiritual meaning.	The story features the הרבנית (rabbi's wife) who is asked questions about the cooking. While she answers, her role is minor; she does not drive the narrative, which centers on the visiting Rabbi Levi Yitzchak and the host Rabbi Shmelke's perception of holiness.
Mifalot-HaZadikim_0016	Mifalot-HaZadikim	no-women	no-women	no-women	all-agree	The story centers entirely on the Baal Shem Tov, Rabbi Mikhl of Zlotshev, and a man who desecrated the Sabbath; no women appear or are mentioned in any capacity.	This story describes a man who accidentally desecrated the Sabbath, and the advice he received from two rabbis. No women are mentioned in the story.
Mifalot-HaZadikim_0017	Mifalot-HaZadikim	minor	minor	major	human=claude/gemini-differs	The wife appears actively and her household management (selling milk, rationing food for five children) is described in some detail, providing the narrative's economic context and crisis. However, the story's spiritual center is the Rabbi's miraculous act of reviving the cow, and the wife functions as a backdrop to his hidden piety and wonder-working rather than as a character who drives or shapes the story's meaning herself.	The wife's actions are central to the story. She provides for her family, and her piety and sacrifice are highlighted as essential to the narrative, so she's more than a minor figure.
Mifalot-HaZadikim_0018	Mifalot-HaZadikim	no-women	no-women	minor	human=claude/gemini-differs	No woman appears as a character in this story; the 'עזרת נשים' (women's court) is merely the physical setting for the confrontation with the Samael, and 'תמרוקי נשים' (women's cosmetics) is simply the Samael's disguise prop — neither constitutes a female character with any narrative role.	A woman is mentioned as a cosmetics seller, who is actually the devil in disguise. The story also mentions the ezrat nashim (women's section) of a synagogue, so women are present in the context of the narrative, even though they are not central to the plot.
Mifalot-HaZadikim_0019	Mifalot-HaZadikim	no-women	no-women	minor	human=claude/gemini-differs	No women appear as characters in this story, which centers entirely on the rivalry and eventual reconciliation between Rabbi Yitzchak of Drabitsh and the Baal Shem Tov. The only female reference is 'שרה' in the Besht's name 'ישראל בן שרה,' which is a patronymic identifier, not a character appearance.	A woman, Sarah, is mentioned as part of the Ba'al Shem Tov's name written on amulets, but she doesn't play any role in the story itself. The story focuses on the interaction between Rabbi Yitzchak and the Ba'al Shem Tov.
Mifalot-HaZadikim_0020	Mifalot-HaZadikim	no-women	no-women	minor	human=claude/gemini-differs	The story centers entirely on the rabbi of Chernobyl arranging funds to build a mikveh by selling his share in the World to Come to a wealthy man; no women appear or are mentioned in any capacity.	The story references women needing a mikvah, implying their presence in the community, but no women are characters in the story.
Mifalot-HaZadikim_0021	Mifalot-HaZadikim	no-women	no-women	no-women	all-agree	The story centers entirely on male figures — the Rebbe of Lubavitch, R' Baruch of Medzhibozh, R' Avraham of Khmilnyk, and an unnamed male Hasid — with no women appearing in any capacity.	This story recounts an anecdote about a Hasid who abandons his goods due to a spiritual crisis, and the rebbe who publicly shames him to save his business. No women are present or mentioned in the story.
Mifalot-HaZadikim_0022	Mifalot-HaZadikim	no-women	no-women	no-women	all-agree	The story centers entirely on two male figures — Rabbi Yaakov Shimshon of Shepetivka and an elderly sage — and their encounter, discussion of Torah, and three-day spiritual communion. No women appear or are mentioned in any capacity.	This story focuses on the travels and encounters of Rabbi Yaakov Shimshon and a wise old scholar. No women are present or mentioned in the narrative.
Mifalot-HaZadikim_0023	Mifalot-HaZadikim	minor	minor	major	human=claude/gemini-differs	The rabbi's wife (באבע) appears in two anecdotes — gathering onion peels for the sukkah and going into labor in a ruin — but she functions as a supporting element illustrating R' Leib's extreme poverty rather than as a character whose own qualities or actions drive the story's spiritual meaning. The narrative centers on the exchange between the two rabbis about who suffered greater destitution.	The story focuses on the poverty and suffering of a Hasidic leader and his wife, Baube. Her actions (collecting vegetable ties, raising geese, getting pregnant, giving birth) and his concern for her well-being are central to the narrative.
Mifalot-HaZadikim_0024	Mifalot-HaZadikim	minor	minor	minor	all-agree	A woman appears briefly in the story when she brings her son to be blessed and explains why he was not circumcised, but her role is secondary and instrumental — the narrative centers on the clairvoyant powers of Rabbi Aharon Moshe and his dialogue with the Rabbi of Apta.	A woman (the mother of the uncircumcised boy) speaks and asks for a blessing, but she is a minor figure in a story about two rabbis and their prophetic abilities.
Mifalot-HaZadikim_0025	Mifalot-HaZadikim	no-women	minor	minor	models-agree/human-differs	Two women are referenced in the dead man's confession — his hated wife whom he abandoned, and the non-Jewish woman he sinned with (whose soul became 'bound' to him) — but neither appears as an active character in the story's main action; they serve as background figures explaining the man's spiritual downfall.	The story involves a man who leaves his wife because he hates her. Although the wife is the reason for the man's actions, she does not appear in the story, and it focuses entirely on the man's actions and spiritual state.
Mifalot-HaZadikim_0026	Mifalot-HaZadikim	no-women	no-women	minor	human=claude/gemini-differs	The story involves exclusively male characters: the Rizhiner Rebbe, a poor man who delivers Torah teachings, a hidden observer, the Maggid of Kozhnitz (mentioned), and Moshe Shtagel. No women appear or are referenced in any capacity.	There is a brief mention of the rebbe's mother and a reference to students who are presumably male, but women do not play a significant role in the story's plot or meaning.
Mifalot-HaZadikim_0027	Mifalot-HaZadikim	minor	no-women	minor	human=gemini/claude-differs	The story features only male characters throughout: the Baal Shem Tov, his three disciples, the coachman Alexa, and the crude man at the forest house. No women appear or are mentioned in any capacity.	While there is no in-depth focus on women, the story mentions that the innkeeper has a wife, though she isn't present or directly involved in the narrative. Therefore it has been categorized as minor.
Mifalot-HaZadikim_0028	Mifalot-HaZadikim	major	major	major	all-agree	The noblewoman (מטרוניתא) is the central driver of the plot: she notices the rabbi, orders her servants to seize him, places him in her carriage, and actively tests/tempts him for hours before casting him out. The entire narrative arc depends on her actions and cannot exist without her.	A beautiful noblewoman (metronita) is central to the plot, as she attempts to seduce the rabbi, leading to his spiritual trial and eventual escape. Her actions drive the story's conflict and resolution.
Mifalot-HaZadikim_0029	Mifalot-HaZadikim	major	major	major	all-agree	The innkeeper (פונדקית) is the central figure who drives the entire narrative: she appears adorned and naked to seduce the rabbi, and her supernatural death by the curse of the Sotah portion is the story's dramatic climax and moral lesson. The plot cannot exist without her.	The story revolves around the innkeeper, a woman, who tempts the rabbi and whose fate is central to the narrative's dramatic and moral outcome. The story focuses on her actions and their consequences.
Mifalot-HaZadikim_0030	Mifalot-HaZadikim	no-women	no-women	no-women	all-agree	The story centers entirely on Rabbi Zusha of Hanipol and his male disciples during the Days of Repentance; no women appear or are referenced in any capacity.	This story focuses exclusively on Rabbi Zusia and his male disciples; no women are mentioned or appear in any capacity.
Mifalot-HaZadikim_0031	Mifalot-HaZadikim	no-women	no-women	no-women	all-agree	The story is entirely a mystical-kabbalistic teaching about letter permutations of divine names (YHWH, MH) and the name of Moses, with no women appearing in any capacity. All figures mentioned are male (the Apter Rav, Moses/Moshe).	The story is a discussion of kabbalistic interpretations of the name of God and the language used by Moses. There are no women mentioned or present in the story.
Mifalot-HaZadikim_0032	Mifalot-HaZadikim	no-women	no-women	no-women	all-agree	The passage is a purely exegetical homily involving wordplay on Hebrew letters and acronyms, with no female characters of any kind present.	This story is about religious and kabbalistic concepts with no mention of any women characters.
Mifalot-HaZadikim_0033	Mifalot-HaZadikim	no-women	no-women	no-women	all-agree	The story is an entirely male-focused legal-theological exposition interpreting a Mishnaic passage (Bava Metzia) and a midrash about the Temple's rebuilding, God, and Israel, with no women appearing in any capacity.	There are no women mentioned in the story. It discusses the rebuilding of the Temple and Jewish repentance.
Mifalot-HaZadikim_0034	Mifalot-HaZadikim	no-women	no-women	no-women	all-agree	The story is a Torah teaching by R' Baruch of Mezhybizh interpreting Rashi's comment on Balaam's blessing, centered entirely on male figures (Balaam, God, Israel). No women appear in any capacity.	This story is a commentary on a biblical verse and does not mention any women.
Mifalot-HaZadikim_0035	Mifalot-HaZadikim	no-women	no-women	no-women	all-agree	The story is a homiletical exposition on a verse from Psalms about prayer and Temple sacrifice, with no women characters appearing in any capacity.	This is a theological discussion about the Temple sacrifices and the power of prayer, with no women mentioned or present.
Mifalot-HaZadikim_0036	Mifalot-HaZadikim	no-women	no-women	no-women	all-agree	This text is a homiletical interpretation (derush) of a psalm verse, exploring wordplay around God's throne and human livelihood obligations; no women appear in any capacity, and the passing reference to 'בני ביתו' (household members) is abstract and incidental, not a characterization of any woman.	This story contains no mention of women. It discusses the Kabbalistic meanings of a verse.
Mifalot-HaZadikim_0037	Mifalot-HaZadikim	no-women	no-women	no-women	all-agree	The text is an entirely homiletical teaching by Rabbi Menachem Nachum of Makarov on morning devotion and cleaving to God, using a creative reading of the frog verse (Exodus 8). No women appear in any capacity, named or unnamed.	This is a homiletical teaching referencing a verse. It does not contain any characters, male or female.
Mifalot-HaZadikim_0038	Mifalot-HaZadikim	no-women	no-women	no-women	all-agree	The story is a homiletical interpretation of the verse about separating challah (חלה), reinterpreting it as instructions for morning worship; no women appear as characters in the narrative. The verse's original agricultural/domestic context is entirely allegorized away, with no female figure mentioned or implied.	The text is about prayer and waking up for divine service, without mention of any women.
Mifalot-HaZadikim_0039	Mifalot-HaZadikim	no-women	no-women	no-women	all-agree	The story is a homiletical interpretation of a biblical verse about the evil inclination and Israel at Sinai, with no women appearing in any capacity. All characters and references are abstract or male (Israel, God, the evil inclination).	This text does not feature any women; it is a religious interpretation of a verse from Deuteronomy.
Mifalot-HaZadikim_0040	Mifalot-HaZadikim	no-women	no-women	no-women	all-agree	The passage is entirely a spiritual teaching (Torah) on prayer and the creation of worlds through devotion, attributed to R. Uri of Strelisk. No women appear in any capacity.	This text discusses prayer and the creation of new worlds through devotion; there are no women mentioned.
Mifalot-HaZadikim_0041	Mifalot-HaZadikim	no-women	no-women	no-women	all-agree	The story is an entirely theosophical/linguistic discussion about the Aramaic translation of the word 'echad' and its relation to Shabbat, with no women characters, named or unnamed, appearing in any capacity.	This story is about the mystical meaning of the Hebrew letters and the word 'Shabbat' in relation to God. No women are mentioned.
Mifalot-HaZadikim_0042	Mifalot-HaZadikim	no-women	no-women	no-women	all-agree	No women appear as characters in this story, which centers entirely on Rabbi Aaron of Karlin and two male Chabad disciples during a Shabbat meal. The phrase 'אוי לאם שלכם' (woe to your mother) is a rhetorical exclamation, not a woman character participating in the narrative.	No women appear as characters in this story about Rabbi Aharon of Karlin and two students.
Mifalot-HaZadikim_0043	Mifalot-HaZadikim	no-women	no-women	no-women	all-agree	The story is entirely about male figures — the Rabbi of Karlin delivering a eulogy for his master, with an extended homiletical discussion of Chanoch/Enoch, Rashi, and the Metatron concept. No women appear in any capacity.	This story discusses the death of a rabbi and an interpretation of a passage from Rashi. No women are mentioned.
Mifalot-HaZadikim_0044	Mifalot-HaZadikim	no-women	no-women	no-women	all-agree	The story revolves entirely around a male student's nighttime encounter with Rabbi Aharon of Karlin, with no women present or mentioned.	This story focuses on the interaction between two male rabbis and a student. No women are mentioned or play any role in the narrative.
Mifalot-HaZadikim_0045	Mifalot-HaZadikim	no-women	no-women	minor	human=claude/gemini-differs	The story features only male characters — the villager father-in-law, his learned son-in-law, and Rabbi Elimelech of Lizhensk. No women appear or are referenced in any capacity.	Though unnamed, a man's wife is mentioned in the story as the mother of the scholar. Her presence or actions do not influence the plot.
Mifalot-HaZadikim_0046	Mifalot-HaZadikim	no-women	no-women	minor	human=claude/gemini-differs	The story centers entirely on the father-in-law (חותן) and his son-in-law (חתן) and their dispute over Hasidic practice, culminating in a visit to the Rebbe. No women appear as characters; the widow (אלמנה) and divorcee (גרושה) mentioned are legal categories cited in the Rebbe's halakhic analogy, not characters in the narrative.	The story focuses on the conflict between a Hasidic man and his non-Hasidic father-in-law. The man's wife is not a character in the story.
Mifalot-HaZadikim_0047	Mifalot-HaZadikim	no-women	no-women	no-women	all-agree	The story centers entirely on Rabbi Menachem Nachum of Mukachevo's illness and his dream/Torah teaching about materialism and divine providence. No women appear or are referenced in any capacity.	This story revolves around a rabbi's illness and his interpretation of a dream; no women are present or mentioned.
Mifalot-HaZadikim_0048	Mifalot-HaZadikim	no-women	no-women	no-women	all-agree	The story is a Talmudic legal-spiritual discussion about suffering, Torah neglect, and prayer, delivered by R. Shalom of Porivtsh. No women appear in any capacity, named or unnamed.	This story is a commentary on a passage from the Talmud and does not feature any women.
Mifalot-HaZadikim_0049	Mifalot-HaZadikim	no-women	no-women	no-women	all-agree	The story centers entirely on a dying rebbe and his male disciples; no women appear or are mentioned in any capacity.	This story focuses on the Rebbe's final words to his students about the nature of future tzadikim, with no mention of women.
Mifalot-HaZadikim_0050	Mifalot-HaZadikim	no-women	no-women	no-women	all-agree	The story features only male characters — Rabbi Ze'ev of Zhitomir and his student/son-in-law Rabbi Shneur. The Shechina is invoked as an abstract theological concept (a sign of holiness), not as an active character in the narrative.	This story speaks of the passing of Rabbi Zev of Zhitomir and his words to his student. No women are mentioned.
Mifalot-HaZadikim_0051	Mifalot-HaZadikim	no-women	no-women	no-women	all-agree	The story is a teaching from R. Pinchas of Korets about not cutting the Shabbat eve bread (challah) with a knife, based on gematria and halachic reasoning. No women appear in any capacity.	This text discusses religious laws about cutting bread on the Sabbath and does not mention any women.
Mifalot-HaZadikim_0052	Mifalot-HaZadikim	no-women	no-women	no-women	all-agree	The story involves a man seeking advice from a rebbe about mockers who distract him from divine service; no women appear in any capacity.	This story focuses on a man's complaint about being mocked and the rabbi's response, with no mention of women.
Mifalot-HaZadikim_0053	Mifalot-HaZadikim	no-women	no-women	minor	human=claude/gemini-differs	The only female figure in the story is the Shunamite woman from 2 Kings, who appears solely within Rabbi Ze'ev's embedded midrashic interpretation as a biblical exemplar — not as a character in the story's own narrative action, which centers entirely on two male rabbis and their interaction.	The story references a woman in the Talmudic passage. Although she is essential to interpreting the meaning of holiness, her role is as an example and not a character in the story itself.
Mifalot-HaZadikim_0054	Mifalot-HaZadikim	no-women	no-women	minor	human=claude/gemini-differs	The story features only male characters throughout: the traveling preacher (בעל דרשן), the wealthy householder, his sons and sons-in-law, and the Tzadik R' Menachem Nachum of Chernobyl. No women are mentioned or referenced in any capacity.	While the story primarily focuses on the interactions between a visiting preacher and a rabbi, the host's wife and other women are mentioned as part of the household preparing for the rabbi's visit, indicating their presence though not as central figures.
Peer-MiKdoshim_0001	PeerMikdoshim	minor	minor	major	human=claude/gemini-differs	A woman appears vividly at the opening — she weeps bitterly before the assembled tzaddikim over her lost 800 gulden — and her plight directly triggers the Rebbe of Kaminke's telling of the main Besht story. However, she functions as a framing catalyst rather than a central character; the bulk of the narrative centers on two male friends whose spiritual fate constitutes the story's core meaning.	A woman approaches the tzaddikim lamenting the loss of money she gave to a man for a business venture. While the focus shifts to a story about two wealthy friends, the initial scenario highlights the woman's agency and financial plight, making her a significant character.
Peer-MiKdoshim_0002	PeerMikdoshim	no-women	no-women	minor	human=claude/gemini-differs	The story centers entirely on a male avrech, the rabbi, the emperor, and the community leaders of Kraków; no women appear or are mentioned in any capacity throughout the narrative.	While there are no named women, the story mentions a wife (חתן לגביר) of the wealthy scholar. Her role is minimal, and she doesn't drive the plot or meaning, so the story is categorized as minor.
Peer-MiKdoshim_0003	PeerMikdoshim	no-women	no-women	no-women	all-agree	The story centers entirely on a poor man, the nobleman, and the rabbi R' Yeshaya Pinto — no women appear in any capacity, named or unnamed.	This story revolves around a man who finds a source of wealth from an idol. No women are mentioned in the story.
