story_id	edition	human	claude	gemini	claude_reasoning	gemini_reasoning	your_decision	notes	story_text
Khal-Hasidim_0244	Khal-Hasidim	minor	major	major	The accused wife (sotah) is the central figure around whom the entire narrative turns: she is summoned, confronted with the Torah reading, and dramatically dies on the steps — her guilt and punishment are the climax and spiritual proof-point of the story. Without her active presence the narrative has no plot.	The story revolves around a woman accused of adultery, and her public humiliation and death are central to the narrative. The story highlights her transgression and miraculous punishment, making her a major character.			"Khal-Hasidim_0244 תיוגים מעשה נוראה מהגאון המובהק חסידא קדישא מורינו ורבינו חיים יוסף דוד אזולאי זצ""ל נעתק מס' שם הגדולים החדש וז""ל שם : ושמעתי ממנו מעשה נוראה ונפלאה. שלעת זקנתו כאשר היה חכם העיר דק""ק לוורני בא אליו אדם חשוב אחד והוא כהן בקובלנא על אשתו לאשר כי נסתרה עם איש אחד. והגאון הנ""ל גם דייני העיר המובהקים ישבו שם ויאמר הגאון לו אשר כפי מצות התורה מוכרח הוא לגרשה ולא יכלו הדיינים להתאפק ובפרט כי היו קרובים להאשה הנ""ל ורצו לחפות עליה ויאמרו לו ילמדינו רבינו מאין לו מקור דין זה לשפוט בלא עדים אין זה אלא דברי נביאות. ולא בשמים היא ואם נעשה דין ומשפט עפ""י רוה""ק יצא ח""ו משפט מעוקל כי בעוה״ר איו לנו בזמה״ז לא כהן ונביא אלא דברי חז""ל עפ""י ד""ת הקדושה. והגאון הנ""ל לא השיב להם מאומה אך אמר פעם שנית להאיש בעל האשה שמע בקולי וגרש את האשה הזאת. וכראותם כי לא ענה אותם דבר וילכו לקרובי האשה אשר היו נכבדי העיר הזאת ויספרו להם את כל ונוכחת וילינו עליו את כל העדה וכשמוע הגאון הנ""ל את דברי ריבות האלה ותהי עליו רוח ה' וישלח ויקרא את האשה ותבא אליו לבית העלי' אשר שם הי' חדר למודו ובית תפלתו וכראותו אותה ויקם מכסאו וילך להארגז אשר בו היו מונחים ספרי תורות ויקח ספר תורה ויקרא באזניה פרשת הסוטה בטעמי הנגינות. ויהי כהפנותה שכמה ללכת ויקרא עליה הגאון אזולאי בקול אם לא שטית וגו' ואת כי שטית וגו' וכאשר שמה רגלה על המעלה הראשונה לא הפסיקה לרדת עד שפניה נהפכו לירקון ועיניה ועינה בלטו וכל הכתוב בהפרשה נתקיים עליה. ולקול הזעקה אשר צעקה בקול באו הדיינים והרבה מאנשי העיר לראות את המחזה הנוראה הזאת ויבהלו מאוד ויקראו הוציאו את הארורה הזאת ושמטוה שלא תטמא את בית רבינו. ויאמר איש אל רעהו עתה ידענו כי איש אלקים קדוש הוא ודיבר ה' אשר בפיו אמת ומעת הזאת יראו לגשת אליו ויקר שמו מאוד לאיש מופת. ולמען יהי׳ לזכר עולם ציוו צווי נדיבי העיר לצפות את המעלות אשר מתה עליהם בזהב להיות לזכרון מעשה האיש הנורא הזה :"
Shivhei-Habesht_0031	Shivhei-Habesht	minor	major	major	The story revolves entirely around a 13-year-old married girl whose mysterious illness drives all the action: her father's consultations, the Besht's interventions and prayers, the sending of letters, and the dramatic resolution when she is revealed to be pregnant and recovers after giving birth. Without her, there is no story.	A young, sick, and pregnant woman is central to the plot. Her illness and eventual recovery drive the narrative, and the Besht's involvement revolves around her fate, making her pivotal to the story's development and spiritual meaning.			"Shivhei-Habesht_0031 תיוגים* שמעתי מבני מ׳ ליב שיחיה שפ""א שבת אצלינו ר׳ הירש חתן אב""ד דק""ק אוסטרה המא""ג ר' דוד ור׳ אייזיק הי' גיסו של ר' הירץ בנו של הרב הנ""ל ובמוצאי שבת סיפר בנו הנ""ל מעשה ששמע ממנו שהיה למהורר אייזיק בנו של הרב בת קטנה בת י""ג שנה ונשואה היתה והיתה חולה וכשהיה הבעש״ט בק""ק זאסלאב הראו לו החולנית וצוה למחר לקרוא לה אשת רופא שתעמיד לה עלוקית ואמר לפתוח לה מרידין והנגיד מ׳ אייזיק הי' ירא לסמוך על הבעש״ט ושאל להדאקטער של הדוכסה דק""ק הנ""ל ואמר כי אפילו בקטנה שכיח מרידין ובא לביתו ושלח אחר אשת רופא והאכסניא של הבעש״ט הי' אצל ר' דוד שהיה מקודם אב""ד בק""ק אוסטרה : ור' הירש חתן הרב הלך עם הבעש״ט לבית ר' אייזיק דרך פרוזדור הבית ועמדו שם כמה סוסי' והלך מסוס לסוס וראה אותם והכה אותם והוטב בעיניו סוס אחד ואמר לר׳ הירץ אם אפשר שימכור לי הסוס הלז והשיב ר׳ הירץ אינו יודע ונכנסו לבית ואמר לרבי אייזיק מכור לי סוס זה והשיב לו רבינו כתיב לא תחמוד אמר לו שוטה אעפ״כ חומד אני ולא רצה למכור ואח״כ ראה אשת הרופא ואמר אין אחרת בעיר כי קראת׳ אותה הבולעת הזה והאשה הזאת היתה חשובה בעיר ופתחה לה מרידין ואעפ""כ לא הבריא׳ והבע״שט נסע לביתו ור' אייזיק נסע עם בתו לקידר שבק' קאסטאנטין ושמע הבעש״ט מזה ונסע בעצמו לקאסטאנטין ורגז עליו ואמר הגם אתם תעשו לי כן והבטיח לו ר' איזיק שיסע לביתו אבל דעתו לא היה כן וכשראה ר׳ אייזיק שהקידר לא מעלה ולא מוריד נסע עם בתו לביתו פ""א נחלשה מאד סמוך לשבת ועשה הרב מ׳ דוד רעש וקבץ מלמדי׳ לומר תהילים וברכו אותה בשם אחר ושלח אגרת ביד נכרי למזבוז' עם שליח בכדי שיוכל לילך בשבת ל הבעש״ט שיתפלל בעדה ובא הנכרי ביום ש""ק אחר קה""ת קודם תפילות מוסף ובמוצאי שבת צוה לכתוב אגרת ליתן ליד נכרי וכתוב בתוכו גי""ק קודם מוסף קבלתי והתפללתי עבורה תפלה גדולה ולא נענתי לא דבר ולא חצי דבר ואין יודע מה אידן בי' אם לא שברכו אותה בשם אחר ותיכף תודיעו לי השם ובסוף נודע שהקטנה הזאת היתה מעוברת וכשילדה הבריאה ואח""ז הי' הבעש״ט בק""ק זאסלב אמרו אשת רופא הכרתם ומשם חדש ג״כ ידעתם ולמה לא הכרת' שהיא מעובר׳ והשיב לו סבור אתה שבאמת הית' מעוברת מתפלתי ומתפילת אביך נתעברה והאגרת ששל' הבעש״ט היה כ""י ר׳ יעקב מיאמפאלי"
Shivhei-Habesht_0050B	Shivhei-Habesht	minor	major	major	The Rabbanit (rabbi's wife) is the central figure driving the plot: her difficult labor is the crisis that sets the entire action in motion, she actively negotiates with R' Yosef (granting him access to her money box), and her miraculous survival and successful delivery of children is the story's climactic resolution.	The story revolves around the pregnant Rebbetzin's difficult labor and Rabbi Yosef's actions to help her, which he undertakes only after receiving her explicit consent and access to her money. Her life is the central concern, and her agency shapes the plot, thus making her a major character.			"Shivhei-Habesht_0050B תיוגים This story is grouped with the previous one according to Scholem's numbering on the manuscript. החסיד ר׳ יוסף מזורניץ הנקרא 49 50 ר' שבחי הבעש״ט יג 51 ר׳ יוסף מלמד היה בעירנו בק""ק ליניץ ואני לא הייתי בקו הבריאה בעיר ההיא ולא יכולתי לישב עמו רק שנתתי לו שלום ולא שמעתי ממנו בעצמו וחבירי שמעו ממנו וסיפרו לפני וביד מ׳ יוסף הי' מונח תמיד מעות שלישית של שית והמעות של הרב הנ""ל היו ג״כ אצל מ׳ יוסף הנ""ל ובעת הזאת היה פיסול מטבעות והיה מריבות ע""י זה ואמר ר׳ יוסף נלך להרב המגיד ויעשה פשרה בינינו והלכו להרב המגיד ועשה פשרה ביניהם והלכה הרבנית לביתה ור׳ יוסף נשאר עדיין אצל המגיד אמר המגיד לר' יוסף הרבנית הלז היא לאחר יאוש ולמחר הרגישה בעצמה חבלי לידה והבינה שהיא מקשה לילד ושלחה אחר ר׳ יוסף ואמרה לו בבקשה שימחול רומע""ל ע״כ לילך אל המגיד שיעשה בשבילי פ""נ והיא שמעה מן המגיד כנ""ל אמר לה אם תתן לי המפתח מן התיבה שאקח מעות כל מה שאחפוץ אלך ואם לאו לא אלך ונתנה לו המפתח ונתנה לו פאטשילע ולקח ק""ס זהובים ובא אל המגיד אמר לו המגיד למה באת הלא אמרתי לך המעמד שלה אמר ר׳ יוסף היא נתנה לי המפתח ונתנה לי רשות על כל המעות שיש לה ותיכף שלח המגיד אחר ר' מיכל ז""ל ואחר רבי ליב כהן ז""ל ור׳ יוסף הנ""ל שילכו למקוה והמגיד עדיין הי׳ יכול לילך ברגליו אלא שלא יכול לילך למים והלכו הם שלשה וגם המגיד הלך עמהם ונכנסו השלשה למקוה והמגיד עומד עליהם ושהו תחת המים וכשעלו מן המים אמר המגיד עדיין לא פעלתם וטבלו כן כמה פעמים ואמר ר׳ יוסף ז""ל שהמגיד רצה ללמוד אותי הכוונות אבל יותר טוב אלך בתמימות שלי ושהו במקוה עד בוש ונתקרר ר׳ יוסף כי הי׳ זקן ואמר רבש״ע הבא לי במתנה את הרבנית ואם לאו אני בסכנה ואח״כ צוה להם שילכו מן המקוה ויעלו כי ת""ל פעלתם שתחי' הרבנית ותלד שלשה בנים ואמר כמה זכרים וכמה נקבות ואין אני זוכר והמגיד צוה מקודם שהלכו למקוה שיבשלו תבשיל עם הרבה בשמים כדי שיתחמם אחר המקוה ולאחר אכילתו אמר המגיד שיטמין א״ע שלא ימצאוהו כי יהי' רעש גדול גם סגר הדלת בעדו ולא הניח שום אדם לכנוס עד שילדה הבנים וחי׳:"
Shivhei-Habesht_0077	Shivhei-Habesht	minor	major	major	The Besht's daughter Adel plays a pivotal role in the story's turning point: her interruption to call her father to eat causes the departure of the supernatural visitors (Elijah and Rabbi), making her action central to the spiritual drama. The Besht's closing remark that her soul derives from the verse 'esh dat lamo' (whose acronym spells her name) further foregrounds her as spiritually significant to the narrative.	The story revolves around the Besht, but his daughter, Adel, directly affects the narrative by interrupting a mystical encounter, leading to the Besht's pronouncements about her role and fate. Her appearance and action are crucial to the story's meaning.			"Shivhei-Habesht_0077 תיוגים* שמעתי מהרב דקהילתינו בהיות הבעש״ט חולה קודם פטירתו לא שכב במשכב רק שנעש' כחוש וקולו נלקה והי יושב בבית התבודדותו התבדדותו ולא הי׳ בו כח לקרוא להמשרת שלו כשהיה צריך לו ותלה פעמן בבית גדול וחוט נמשך אליו לבית קטן שלו ו הבעש״ט מושך בחוט ונשמע קול הפעמן ובא אליו המשר' פ""א נכנס אליו רבי 75 76 77 דוד שבחי הבעש״ט 78 79 דוד פורקעס ז""ל מ״מ דק""ק מעזיבוז ושאל אותו איזה דבר ומאיש אחד מק""ק באר שמעתי שהשאלה היה האיך להתפלל בעד החולה עם סיפורי מעשיות והתחיל לומר לו ובאמרו נתלהב מאוד ופניו היו בוערות כלפידים ונפל פחד על ר׳ דוד הנ""ל ורצה לברוח רק מחמת ש הבעש״ט דיבר עמו פא״פ לא יכול לצאת ובתוך כך באה בתו מ' אדיל תי' ואמרה אל אביה עת לאכול כי פנה היום ומיד אזל סומקא ואתא חיורא ושכב על מטתו לנוח ואמר לה בתי בתי מה עשית לי ואמר ר' דוד הדין עמה כי עת הוא לאכול אמר הבעש״ט לא ידעת מי הי' כאן מצד אחד עמד אליהו ז""ל ומצד השני עמד רבי והם אמרו לי ואני אמרתי לך וכשבאה ובילבלה אותי הלכו ואמר הבעש״ט כי לקח נשמת בתו מן התורה מן הפסוק אש דת למו ר""ת אדל."
Shivhei-Habesht_0080	Shivhei-Habesht	minor	major	major	The sick wife is the central subject of the entire story: the Besht's refusal to heal her, his anger at her husband, and his final revelation all pivot on her identity as a tzadekones whose illness spiritually protects the town. Without her suffering and righteousness, there is no story.	The story revolves around a woman's illness and her role as a protector of the town through her righteousness. The Baal Shem Tov's actions are dictated by her condition, making her central to the narrative's spiritual meaning.			"Shivhei-Habesht_0080 תיוגים* שמעתי מחבירי ששמעו מר׳ נחום מטשארנאביל פ""א הי' הבע״שט בק""ק חמעלניק ושם הי׳ בעל מגיה אחד ואשתו הי׳ חולה ואכסני׳ של הבעש״ט הי' סמוך אצל הרב אב""ד חתן הפ""ח ובא הבע״מ לבעש״ט לבקש ממנו שיתן רפואה לאשתו ולא רצה ולא עוד אף שרגז עליו ודיבר אליו דברים לא טובים והוקשה הדבר להרב אב""ד הנ""ל ולערב כשהלכו כולם שאל הרב את הבעש״ט מפני מה לא רצה לרפאות את האשה הנ""ל והשיב כי היא צדקניות ומחמת חולשתה מגינה על העיר מן הלסטים שביער וכשיכלו הלסטים מיער ממילא יוחזרה לבריאותה ושאל אותו מפני מה רגז על בה""מג והשיב שראיתי ששורה עליו דינים ובזה הרוגז בטלתי הדינים ממנו:"
Shivhei-Habesht_0098	Shivhei-Habesht	minor	major	major	The agunah is the central figure around whom the entire narrative revolves: her transgression triggers the brothers' murder plot, the Besht's miraculous vision of the two candles is directly about saving her life, and her ultimate repentance (becoming a בת גמורה) is the story's spiritual resolution. Without her, there is no story.	The story revolves around an *agunah* (abandoned wife) whose actions (infidelity) and potential fate (execution) are central to the plot. The Baal Shem Tov intervenes to save her, making her a key figure in the narrative's development and spiritual message.			"Shivhei-Habesht_0098 תיוגים* שמעתי מרבי אהרן דקהלתינו ששמע מהרב הגאון דק""ק סיפטיפקע שהי' בסביבם עגונה אחת שהיתה מחזקת ארענדי' וראה הבעש״ט שפ""א הית' מנאפת עם עבד כנעני שלה והי' לה שני אחי' בשני כפרי' ונתגלה הדבר לאחים והיה להם בושה וסברו שתצא ח""ו מן הכלל ויעצו עצה שכל או״א יבקש אותה לכפר שלו ולעת ערב ילכו שניהם ויבערו אותה מן העול' וכ״ע ובאותה לילה ישב הבעש״ט ושני נרות דולקים 98 לפניו שבחי הבעש״ט כא 99 לפניו ופתאום כבה נר א׳ והדליק אותה מנר שני וברגע נכבה נר שני והדליק כנ""ל ושמע קול אומר אליו רוצח איך אתה בא לשני נרות והבין הדבר ולקח סוס ורכב עליו במרוצה והגיע לשם ולא המיתו עדיין אותה והציל אותה מידם ונעשית ב""ת גמורה ואח""ז מצאו אותה עומדת במקוה בחצי הלילה :"
Shivhei-Habesht_0146	Shivhei-Habesht	minor	major	major	The unnamed mother (יולדת) is the pivotal figure around whom the entire story turns: the crisis (the mamzer accusation) exists because of what happened to her, and it is resolved only through her forced confession that she was raped. Without her testimony and her experience, there is no story.	The story revolves around a woman who was raped and gave birth to a child; her testimony, extracted under duress, is crucial to the plot's resolution.			"Shivhei-Habesht_0146 תיוגים* מעשה שהיה אב""ד בק""ק הוראדנע והי׳ ברית מילה ולא רצה להיות סנדק והפצירו בו מאוד עד שאמר שהילד ממזר והוא היה בעל משפחה וכששמעו המשפחה את דבריו התחילו לצעוק והיתה צעקה גדולה בבה״כ ואמר הרב לשמש לך וקח המטה שלי בידך ולך אל היולדת והראה לה את המטה ותיכף תודה ואם לא תמות והיא הודה ואמרה כי אנוסה היא שהלכה למרתף להביא יין ורץ אחריה אדון א׳ ואנסה אותה ונשתקו כל בני משפחת׳ ."
Shivhei-Habesht_0192	Shivhei-Habesht	minor	major	major	The sick wife is the narrative engine of the entire story: her paralyzed hands prompt all travel and seeking of cures, and the climactic miracle — the Besht commanding her to raise her hands, restoring her and simultaneously afflicting the nobleman — revolves entirely around her condition and healing.	The story revolves around a woman whose illness leads her and her husband to seek help from the Baal Shem Tov. Her miraculous healing at a crucial moment is the climax of the story and directly causes the downfall of the antagonist, making her actions central to the narrative's resolution.			"Shivhei-Habesht_0192 תיוגים* במדינות וואלחייא הי' איש אש א׳ גביר מפורסם ופתאום חלתה אשתו על שתי ידי' שלא יכלה להרים אותם בשום אופן והלך עמה אצל כל הרופאים 191 192 יז ולא שבחי הבעש״ט ולא הועילו כלום ונתייאשו מרפואתה וגם שאל בקדרים בקדריים ולא עלתה ארוכה למכתה והסכימה דעתו לנסוע עמה מעיר לעיר אולי תעלה ארוכה למכתה ע״י בע""ש או רופאים ויהי בנסיעתו וישמע את שמע הבעש״ט מרחוק ויסע לק""ק מעזיבוז ובבואם לק""ק הנ""ל הלכו ל הבעש״ט וצוה עליו שתשב בק""ק הנ""ל ותשב שם ימים רבים ובתוך משך הזמן באו כמה פעמים להרב וצוה לישב עוד ויהי ברבות הימים פעם א׳ ציוה ציה להכין העגלה עם הסוסים וצוה להאיש הנ""ל שיסע עם אשתו החולה ג״כ אחריהם ויהי בנסיעתם באו לאיזה כפר ושם היה דר א׳ מאנשי הבעש״ט ויהי בבואם לשם שאל הרב את המוכסן אם יתן לו אכסניא ויפלא מאד בעיני המוכסן ע""ז השאלה כי באמת הי' לו זכי' רבה שיתאכסן הרב אצלו. והשיב לו הרב כי כאשר יתאכסן אצלו אזי יסגרו החלונות והשערים והדלתות שלא לפתוח לשום אדם יהי' מי שיהי' אפי' איזה שר גדול ובאם שידחוק א״ע מאד אזי להשיב כי בכאן הרב בעש״ט והבטיח המוכסן לעשות כן ועמדו אצלו בקרעצים ותיכף ומיד עשו כדבר הרב והכינו א״ע לסעודת הערב ואחרי הסעודה ישנו כולם מלבר הבעש״ט ישב אצל השולחן ולמד באיזה ספר והאשה החולנית ישבה בירכתי הבית והנה באותו היום בא אחיו של השר מהקרעצים ההוא אשר לא ראו איש את אחיו זה יותר משתים עשרה שנה ותהי השמחה גדולה ביניהם ואכלו ושתו ונשתכרו ובאמצע הדברים התחיל השר להתפאר א״ע איך על מקום הידוע בנה קרעצים טובה ומהודרת עד מאד ויהלל אותה עד מאד וביקש האורח אותו שיתנו לו סוס א׳ שיסע לשם. ונתנו לו סוס טוב ומובחר ובהיות שהמקום הי׳ קרוב מהמבצר נסע רק בבגד א׳, ותיכף כשנסע מיד התחיל רוח סערה עם שלג הנק' מיטעלניצע ונתעכב בנסיעתו כמה שעות עד שבא להקרעצים ודפק על הדלת שיפתחו לו והשיבו לו שא""א לפתוח לו מפני שבכאן הרב הבעש""ט וביקש כמה פעמים בתחנונים גדולים לפתוח לו היות שנתקרר מאד והשיבו לו כנ""ל עד שבפעם האחרון רמז הבעש״ט שיפתחו לו וכאשר נכנס השר לבית הלך אנה ואנה עד שנתחמם מעט וכאשר שב לאיתנו שאל מי הוא זה הבעש״ט והראו לו את הרב ומיד התחיל לבער בו אש הכעס והלך עוד כפעם בפעם ושאל עוד מי הוא זה ואיזהו הבעש״ט אשר עבורו לא פתחו לי את הדלת עד שהיה באפשרי ממש למות מגודל הקרירות והראו לו את הרב עד שבפע׳ שלישית בערה בו אש הכעס לגמרי וכשהראו לו את הרב שלף חרבו מתערה והניף את ידו על הרב להרגו מיד צעק הרב להאשה החולנית הגביהי את שתי ידיך וכן עשתה ומיד נעשה חילופין להאשה חזרו ידי' לבריאותה כבראשנה והשר לא יכול להשיב ידו ותיבש ידיו והתחנן מאד להרב ואמר שלא אוכל להועיל לך כי מכבר נעשה החילופין וא""א לשנות עוד :"
