story_id	tag	old_source	opus_applies	opus_confidence	verdict	opus_reasoning
Khal-Hasidim_0126	social:marital_relationship	propagated	False	high	REJECT	The sick wife sends her husband to the Baal Shem Tov, a brief functional exchange, not a depicted marital relationship.
Khal-Hasidim_0154	social:marital_relationship	propagated	False	high	REJECT	Story focuses on trust in God; no marital relationship is depicted (wives mentioned only as captives whose husbands fled).
Khal-Hasidim_0167	social:marital_relationship	direct	True	high	CONFIRM	The story depicts the couple's marriage and includes a scene where husband and wife converse and reveal to each other how the Rebbe orchestrated their union.
Khal-Hasidim_0237	social:marital_relationship	propagated	True	high	CONFIRM	The story depicts the marital relationship between the childless husband and his wife, including her pleading, his consulting her on decisions, and joint resolve to seek children.
Maase-Zadikim_0001	social:marital_relationship	propagated	True	high	CONFIRM	The story depicts the wife approaching her scholar husband about their children's marriages and advising him to seek the Baal Shem Tov's help, showing their marital interaction.
Mifalot-HaZadikim_0006	social:marital_relationship	propagated	True	medium	CONFIRM	The story mentions the elderly host and his wife being blessed with a child, and references the rabbi's wife, but marital relationship is incidental rather than depicted in depth.
Peer-MiKdoshim_0006	social:marital_relationship	propagated	False	high	REJECT	Story centers on a rabbi's daughter's matchmaking and a merchant's vow; the merchant's wife appears only as ill and prompting him to seek the Besht, not depicting a marital relationship.
Peer-MiKdoshim_0010	social:marital_relationship	direct	True	high	CONFIRM	The story centrally depicts the marital relationship between R. Shimshon and his first wife, including separation, testing her faithfulness, and reunion.
Peer-MiKdoshim_0016	social:marital_relationship	propagated	True	high	CONFIRM	The story depicts interaction between R' Yeshaya and his wife regarding hosting the in-laws and choosing which daughter to marry off.
Shivhei-Habesht_0001	social:marital_relationship	direct	True	high	CONFIRM	The story depicts the Baal Shem Tov's father and his wife (their separation, his marriage to the minister's daughter whom he refuses to touch, and reunion with his original wife).
Shivhei-Habesht_0071	social:marital_relationship	direct	True	high	CONFIRM	The story depicts R' Shmeril and his wife seeking a child together, with the Besht addressing the wife directly about childbirth.
Shivhei-Habesht_0086	social:marital_relationship	direct	False	high	REJECT	Story concerns arranging a wedding and financial dealings, not depicting a marital relationship between a couple.
Shivhei-Habesht_0172	social:marital_relationship	direct	True	high	CONFIRM	The story depicts interactions between Reb Tuvele and his wife, including her urging him to send for the Besht and his attempt to test the Besht based on their bedroom conversation.
Shivhei-Habesht_0198	social:marital_relationship	propagated	False	medium	REJECT	Marriages are mentioned (deceased husband, proposed remarriages) but no actual marital relationship between a couple is depicted.
Sipurei-Zadikim_0004	social:marital_relationship	direct	True	high	CONFIRM	The story depicts the formation and married life of the couple, including their conversation revealing how each was guided by the rebbe into the marriage.
Adat-Zadikim_0008	social:marriage	propagated	False	high	REJECT	The story concerns storytelling, repentance, and a converted bishop; marriage is not depicted.
Adat-Zadikim_0024	social:marriage	direct	False	high	REJECT	Marriage is not the subject; a remarried agunah is mentioned only incidentally to explain the husband's death.
Khal-Hasidim_0001	social:marriage	direct	False	high	REJECT	Although the Besht's father is given the vizier's daughter as a wife, marriage is incidental to the narrative of his captivity and the Besht's birth, not the subject.
Khal-Hasidim_0009	social:marriage	direct	False	high	REJECT	Marriage is not depicted; brief mention of a brother-in-law urging his sister to divorce is incidental, not the subject.
Khal-Hasidim_0036	social:marriage	propagated	False	high	REJECT	Story concerns the Baal Shem Tov, a repentant bishop, and storytelling as livelihood; no marriage event or institution depicted.
Khal-Hasidim_0115	social:marriage	propagated	False	high	REJECT	Marriage is not depicted as event or subject; brief mention of past betrothals is incidental.
Khal-Hasidim_0174	social:marriage	propagated	False	high	REJECT	Marriage is only mentioned in passing (a wealthy man took him as a son-in-law); the story centers on Schneur Zalman's imprisonment, not marriage.
Khal-Hasidim_0178	social:marriage	propagated	True	high	CONFIRM	The story centers on a marital crisis—a wife unable to become ritually pure for her husband, threatened divorce, and the rabbi's resolution preserving the marriage.
Khal-Hasidim_0210	social:marriage	direct	True	high	CONFIRM	The story centers on an agunah whose husband returns, restoring the marriage — marriage as institution is central.
Khal-Hasidim_0217	social:marriage	direct	False	high	REJECT	Marriage is background; the story centers on sin, exile, and repentance, not marriage as event or institution.
Khal-Hasidim_0218	social:marriage	propagated	False	high	REJECT	Marriage is only mentioned incidentally (R. Yisrael became a son-in-law); the story focuses on the path to Hasidism, not marriage as event or institution.
Khal-Hasidim_0254	social:marriage	direct	False	high	REJECT	Story concerns the death of the rabbi and an adultery incident; an agunah is permitted to remarry but marriage is not the subject.
Maase-Zadikim_0008	social:marriage	propagated	False	high	REJECT	Story is a parable about devotion to God via the two brothers; no marriage content.
Peer-MiKdoshim_0014	social:marriage	propagated	False	medium	REJECT	Though a bride and groom seek a blessing before their wedding, the story centers on the tzadik's miraculous rescue and confession, not on marriage as event or institution.
Peer-MiKdoshim_0015	social:marriage	propagated	True	high	CONFIRM	The son's marriage to the antisemitic noblewoman and his ultimatum to her ('be my wife or leave') are central plot drivers.
Shivhei-Habesht_0001	social:marriage	direct	True	high	CONFIRM	The story explicitly depicts the Besht's father being given the vizier's daughter as wife, and his refusal to consummate the marriage is a central plot element.
Shivhei-Habesht_0005B	social:marriage	propagated	True	medium	CONFIRM	The story mentions the brother-in-law pressuring his sister to divorce the Besht, touching on the marriage as a point of contention, though it's incidental.
Shivhei-Habesht_0184	social:marriage	propagated	False	high	REJECT	Story centers on childlessness, a problematic son, and miraculous commerce; marriage itself is not depicted or thematized.
Shivhei-Harav_0012	social:marriage	direct	True	high	CONFIRM	The story centers on a marriage crisis: a wife unable to purify herself for her husband, threat of divorce, and the rabbi's ruling restoring her to her husband.
Shivhei-Harav_0014	social:marriage	propagated	False	high	REJECT	The story concerns the Alter Rebbe's discipleship, leadership, and disputes with mitnagdim; no marriage event or institution.
Shivhei-Harav_0019	social:marriage	propagated	True	high	CONFIRM	The story contains a marriage-arrangement (shidduch) proposal by the Rebbe for his daughter Fridke, and references the narrator being newly married living at his father-in-law's home.
Sipurei-Zadikim_0001	social:marriage	propagated	False	high	REJECT	Story concerns hidden tzaddikim and miraculous travel; no marriage event or institution is depicted.
Sipurei-Zadikim_0010	social:marriage	direct	False	medium	REJECT	Story centers on an agunah reunited with her long-absent husband via the tzaddik's intervention; marriage as institution/event is not the subject, only the reunion.
Sipurei-Zadikim_0011	social:marriage	direct	False	high	REJECT	Marriage is mentioned only incidentally (the protagonist became a wealthy man's son-in-law); the story's subject is the discovery of the Maggid and Hasidic path, not marriage.
Adat-Zadikim_0004	social:poverty	propagated	False	high	REJECT	The Besht refuses half the host's wealth but only requests a small pidyon; this is incidental, not a depiction of poverty as virtue.
Adat-Zadikim_0006	social:poverty	propagated	False	high	REJECT	Story is about bitachon (trust in God), not about embracing poverty as a virtue or a tzaddik refusing wealth.
Adat-Zadikim_0007	social:poverty	direct	False	high	REJECT	Story is about bitachon and partnership with God in business; no embrace of poverty as virtue.
Adat-Zadikim_0008	social:poverty	propagated	False	high	REJECT	Story is about storytelling, repentance, and a converted bishop; poverty as virtue is not depicted.
Adat-Zadikim_0015	social:poverty	propagated	False	high	REJECT	Poverty appears as a condition for having children, not as a virtue embraced by a tzaddik.
Khal-Hasidim_0001	social:poverty	direct	False	high	REJECT	Poverty is mentioned incidentally (mother becoming a midwife from poverty) but not embraced as a virtue by a tzaddik.
Khal-Hasidim_0036	social:poverty	propagated	False	high	REJECT	Story is about teshuvah and the power of storytelling; no embrace of poverty as virtue—rather the protagonist becomes wealthy.
Khal-Hasidim_0050	social:poverty	direct	True	high	CONFIRM	The mother explicitly prays at her husband's grave that her sons be poor and destitute so they not stray from God's ways, embracing poverty as a spiritual virtue.
Khal-Hasidim_0115	social:poverty	propagated	False	high	REJECT	Story concerns reincarnation, debts, and charity; no embrace of poverty as virtue.
Khal-Hasidim_0126	social:poverty	direct	False	high	REJECT	The tzaddik's poverty is a circumstantial hardship resolved by miraculous wealth, not poverty embraced as a virtue.
Khal-Hasidim_0154	social:poverty	propagated	False	high	REJECT	Story is about bitachon (trust in God), not voluntary poverty or a tzaddik refusing wealth.
Khal-Hasidim_0158	social:poverty	direct	False	high	REJECT	Story is about cruelty, debt, and reincarnation justice — not about a tzaddik embracing voluntary poverty.
Khal-Hasidim_0167	social:poverty	direct	False	high	REJECT	The story involves a tzaddik orchestrating a match via wealth manipulation, not poverty embraced as virtue.
Khal-Hasidim_0217	social:poverty	propagated	False	high	REJECT	Story is about a tzaddik's miraculous justice against a wicked nobleman; no embrace of poverty as virtue.
Khal-Hasidim_0237	social:poverty	propagated	False	high	REJECT	Story is about childlessness, appeasing a dead fiancée, and tzaddikim's intervention; poverty is not embraced as virtue.
Khal-Hasidim_0243	social:poverty	direct	False	high	REJECT	Story is about trust in God (bitachon) by an innkeeper, not about embracing poverty as virtue or a tzaddik refusing wealth.
Maase-Zadikim_0008	social:poverty	propagated	False	high	REJECT	The story is about devotion and serving the king (God) through proper intent; the merchant gives away wealth for love of the king, not poverty as virtue per se, and no tzaddik refuses wealth.
Maase-Zadikim_0018	social:poverty	direct	False	high	REJECT	Story is about trust in God (bitachon) and charity from earnings, not about voluntary poverty or refusing wealth as virtue.
Peer-MiKdoshim_0001	social:poverty	direct	False	high	REJECT	Story concerns reincarnation, debts, and charity refused — not voluntary poverty embraced as virtue.
Peer-MiKdoshim_0005	social:poverty	propagated	False	high	REJECT	Story is about rescuing a prodigy from idolaters via the tzaddik's prayer; no theme of embraced/voluntary poverty.
Peer-MiKdoshim_0006	social:poverty	propagated	False	high	REJECT	Story concerns trust in God, the tzaddik's foresight, and fulfilling a vow of charity; poverty is incidental, not embraced as virtue.
Peer-MiKdoshim_0009	social:poverty	direct	False	high	REJECT	Story concerns a fraudulent divorce/marriage scheme exposed by the tzaddik; no theme of voluntary poverty or refusing wealth.
Peer-MiKdoshim_0010	social:poverty	propagated	False	high	REJECT	Story is about a lost wife reunited via charity to the poor; no embrace of poverty as virtue by a tzaddik.
Peer-MiKdoshim_0015	social:poverty	propagated	False	high	REJECT	Story concerns a wealthy lessee's expulsion, an aristocrat's punishment and restoration; no voluntary poverty or refusal of wealth by the tzaddik.
Shivhei-Habesht_0001	social:poverty	direct	False	high	REJECT	Poverty is mentioned incidentally (mother becoming midwife from poverty) but not embraced as a virtue by a tzaddik.
Shivhei-Habesht_0005B	social:poverty	direct	True	medium	CONFIRM	The story explicitly describes the Besht living in extreme poverty (toes poking through shoe holes, fasting for years), framed as part of his hidden saintly virtue before revelation.
Shivhei-Habesht_0060	social:poverty	direct	True	high	CONFIRM	The mother explicitly prays at her husband's grave that their sons be poor and destitute so they not stray from God's ways — poverty embraced as a spiritual virtue.
Shivhei-Habesht_0184	social:poverty	propagated	False	high	REJECT	Story is about a wealthy merchant seeking a child; no embrace of poverty as virtue.
Sipurei-Zadikim_0004	social:poverty	direct	False	high	REJECT	Story is about a tzaddik orchestrating a match via financial manipulation; poverty appears incidentally but is not embraced as a virtue.
Adat-Zadikim_0003	social:relations_with_non_hasidim	propagated	False	high	REJECT	Story involves the Besht's journey, a childless Jewish guest, and bandits—no mitnagdim or maskilim depicted.
Adat-Zadikim_0004	social:relations_with_non_hasidim	propagated	False	high	REJECT	Story involves the Besht with a gentile sorcerer-lord and a Jewish innkeeper/wealthy man, not mitnagdim or maskilim.
Adat-Zadikim_0008	social:relations_with_non_hasidim	propagated	False	high	REJECT	Story involves the Baal Shem Tov and a converted bishop/apostate, not mitnagdim or maskilim.
Adat-Zadikim_0013	social:relations_with_non_hasidim	propagated	False	high	REJECT	Story is an internal Hasidic tale about the rebbe, his community, and a wealthy sinner; no depiction of mitnagdim or maskilim.
Adat-Zadikim_0014	social:relations_with_non_hasidim	propagated	False	high	REJECT	Story involves a Jewish protagonist and a non-Jewish duchess; no mitnagdim/maskilim or non-Hasidic Jews are depicted.
Adat-Zadikim_0015	social:relations_with_non_hasidim	propagated	False	high	REJECT	Story involves only Hasidic figures and Jews; no interaction with mitnagdim or maskilim depicted.
Adat-Zadikim_0023	social:relations_with_non_hasidim	propagated	False	high	REJECT	Story is set in 16th-century Krakow about Rema and R. Chaim; no interaction with mitnagdim or maskilim.
Khal-Hasidim_0001	social:relations_with_non_hasidim	propagated	False	high	REJECT	Story depicts Besht's father among non-Jews/gentiles (kidnappers, king), not interactions with mitnagdim or maskilim.
Khal-Hasidim_0002	social:relations_with_non_hasidim	direct	False	high	REJECT	Story involves emperor, antisemitic noble, and robbers—not mitnagdim or maskilim or non-Hasidic Jews specifically.
Khal-Hasidim_0004	social:relations_with_non_hasidim	propagated	False	medium	REJECT	Story involves the Baal Shem Tov, R. Gershon, and a rabbi/community — all within a Jewish/proto-Hasidic frame; no mitnagdim or maskilim depicted.
Khal-Hasidim_0009	social:relations_with_non_hasidim	direct	False	high	REJECT	Story involves the Besht, family, possessed woman, and gentiles (idol-worshippers), but no mitnagdim or maskilim are depicted.
Khal-Hasidim_0036	social:relations_with_non_hasidim	propagated	False	high	REJECT	Story involves the Baal Shem Tov and an apostate-turned-bishop (a Christian context), not interaction with mitnagdim or maskilim.
Khal-Hasidim_0115	social:relations_with_non_hasidim	propagated	False	high	REJECT	Story involves Hasidic tzaddikim and a Besht tale; no interaction with mitnagdim or maskilim depicted.
Khal-Hasidim_0117	social:relations_with_non_hasidim	propagated	False	high	REJECT	Story involves the Besht rescuing a Jewish woman from converting to marry a non-Jewish nobleman; no mitnagdim or maskilim appear.
Khal-Hasidim_0120	social:relations_with_non_hasidim	propagated	False	high	REJECT	Interaction is with a Christian priest, not mitnagdim/maskilim or non-Hasidic Jews.
Khal-Hasidim_0126	social:relations_with_non_hasidim	propagated	False	high	REJECT	Story involves the Besht, his disciple, and a merchant; no mitnagdim or maskilim appear.
Khal-Hasidim_0138	social:relations_with_non_hasidim	propagated	False	high	REJECT	Story involves Baal Shem Tov, R. Gershon, Or HaChaim, and Muslims—no mitnagdim or maskilim depicted.
Khal-Hasidim_0170	social:relations_with_non_hasidim	propagated	False	high	REJECT	Story involves a tzaddik, a drunkard Jew, and gentile nobility—no mitnagdim or maskilim depicted.
Khal-Hasidim_0191	social:relations_with_non_hasidim	direct	False	high	REJECT	Mentions a gentile landlord honoring the rebbe, but no interaction with mitnagdim, maskilim, or non-Hasidic Jews.
Khal-Hasidim_0222	social:relations_with_non_hasidim	direct	False	high	REJECT	The story involves Hasidim and a sinful Jew who repents; no mitnagdim or maskilim appear.
Khal-Hasidim_0242	social:relations_with_non_hasidim	propagated	False	high	REJECT	Story involves a rabbi, his wife, and a wealthy community member; no mitnagdim, maskilim, or non-Hasidic opponents are depicted.
Khal-Hasidim_0253	social:relations_with_non_hasidim	propagated	False	high	REJECT	Story is internal to rabbinic/early-modern Jewish world (Rema, Maharal); no mitnagdim or maskilim appear.
Maase-Zadikim_0006	social:relations_with_non_hasidim	direct	False	high	REJECT	Story involves a tzaddik, a drunkard Jew, and gentile nobles; no mitnagdim or maskilim appear.
Maase-Zadikim_0015	social:relations_with_non_hasidim	direct	False	high	REJECT	Story involves Hasidim and a sinner who repents; no mitnagdim or maskilim appear.
Mifalot-HaZadikim_0001	social:relations_with_non_hasidim	propagated	False	high	REJECT	Story involves a tzaddik, an apostate king, and Turks — no mitnagdim, maskilim, or non-Hasidic Jewish opponents depicted.
Mifalot-HaZadikim_0006	social:relations_with_non_hasidim	propagated	False	high	REJECT	Story involves a hospitable elder, a scholar-brother, and a foolish son; no interaction with mitnagdim, maskilim, or non-Hasidic Jews depicted.
Mifalot-HaZadikim_0027	social:relations_with_non_hasidim	propagated	False	high	REJECT	Story involves Besht and a hidden tzaddik couple; no mitnagdim or maskilim appear.
Peer-MiKdoshim_0001	social:relations_with_non_hasidim	propagated	False	high	REJECT	Story concerns Besht, a wealthy man visiting him, and reincarnation themes; no interaction with mitnagdim or maskilim depicted.
Peer-MiKdoshim_0006	social:relations_with_non_hasidim	propagated	False	high	REJECT	Story concerns a tzaddik, his disciple, and merchants; no interaction with mitnagdim or maskilim depicted.
Peer-MiKdoshim_0009	social:relations_with_non_hasidim	propagated	False	high	REJECT	Story involves internal Hasidic/Jewish actors (rabbi, gevir, fraudulent emissary); no depiction of mitnagdim, maskilim, or non-Hasidic Jewish opponents.
Shivhei-Habesht_0001	social:relations_with_non_hasidim	propagated	False	high	REJECT	Story involves non-Jews (gentile masters, king) but no mitnagdim or non-Hasidic Jewish opponents.
Shivhei-Habesht_0002	social:relations_with_non_hasidim	direct	False	high	REJECT	Story involves emperor, antisemitic noble, and robbers, but no mitnagdim or maskilim/non-Hasidic Jewish opponents.
Shivhei-Habesht_0004	social:relations_with_non_hasidim	propagated	False	medium	REJECT	Story depicts Besht's interactions with other Hasidic/traditional rabbis and disciples, not with mitnagdim or maskilim.
Shivhei-Habesht_0005B	social:relations_with_non_hasidim	propagated	False	high	REJECT	Story depicts the Besht's revelation, encounters with Jews and a gentile mocker, but no interaction with mitnagdim or maskilim.
Shivhei-Habesht_0043	social:relations_with_non_hasidim	propagated	False	high	REJECT	Story is entirely internal to Hasidic figures; no mitnagdim, maskilim, or non-Hasidic Jews appear.
Shivhei-Habesht_0199	social:relations_with_non_hasidim	direct	False	high	REJECT	The story involves a Christian priest, not mitnagdim or non-Hasidic Jews.
Shivhei-Harav_0019	social:relations_with_non_hasidim	propagated	False	high	REJECT	Story concerns Hasidic succession, a disciple's spiritual rescue from demonic forces, and the rebbe's death; no interaction with mitnagdim or maskilim is depicted.
Adat-Zadikim_0003	social:relations_with_non_jews	propagated	True	high	CONFIRM	Story depicts encounter with non-Jewish bandits (heydamakes) who capture the Besht and Reb Tzvi on an island.
Adat-Zadikim_0004	social:relations_with_non_jews	direct	True	high	CONFIRM	The story depicts a confrontation with a non-Jewish nobleman (האדון) who is a sorcerer, including a magical duel between him and the Baal Shem Tov.
Khal-Hasidim_0001	social:relations_with_non_jews	direct	True	high	CONFIRM	Story depicts extensive interaction with non-Jews: captors, gentile master, the king, the viceroy, gentile sorcerer, and life in a land forbidden to Jews.
Khal-Hasidim_0012	social:relations_with_non_jews	direct	True	high	CONFIRM	The story depicts non-Jewish robbers (heidamakes) attacking the Baal Shem Tov and a non-Jewish captain rescuing them.
Khal-Hasidim_0023	social:relations_with_non_jews	propagated	False	high	REJECT	Story is entirely intra-Jewish (Besht, tax collector, wealthy Jew, bride); no non-Jews depicted.
Khal-Hasidim_0052	social:relations_with_non_jews	propagated	True	high	CONFIRM	Story depicts the Baal Shem Tov's conflict with a non-Jewish witch (גויה) who sends a demon against him.
Khal-Hasidim_0075	social:relations_with_non_jews	direct	True	high	CONFIRM	Story features interaction with a non-Jewish nobleman (אדון) and a Komissar regarding a debt and threats of imprisonment.
Khal-Hasidim_0162	social:relations_with_non_jews	propagated	True	high	CONFIRM	The story depicts Rabbi Leib Sarah's secretly visiting and interacting with the Duke (non-Jewish noble) in Vienna.
Khal-Hasidim_0177	social:relations_with_non_jews	direct	True	high	CONFIRM	Story depicts informing to non-Jewish authorities (Gubernator), interactions with gentile women, and court proceedings with non-Jews.
Khal-Hasidim_0185	social:relations_with_non_jews	direct	True	high	CONFIRM	Story centrally depicts non-Jewish youths luring a Jewish boy to convert, imprisoning him in their house of worship.
Maase-Zadikim_0008	social:relations_with_non_jews	propagated	False	high	REJECT	The king/servant tale is a parable about serving God; no actual interaction with non-Jews is depicted.
Mifalot-HaZadikim_0006	social:relations_with_non_jews	propagated	False	high	REJECT	Story involves only Jewish characters; no interaction with non-Jews depicted.
Mifalot-HaZadikim_0027	social:relations_with_non_jews	propagated	True	high	CONFIRM	Story features the gentile Alexei the coachman and repeated references to ערלים (peasants/gentiles) in the inn context.
Shivhei-Habesht_0001	social:relations_with_non_jews	propagated	True	high	CONFIRM	Story extensively depicts the Besht's father enslaved by non-Jews, serving a gentile master, the king's viceroy, the king, marriage to gentile woman, and gentile sorcerer.
Shivhei-Habesht_0005B	social:relations_with_non_jews	direct	True	high	CONFIRM	The story explicitly depicts non-Jews (נכרים) with their idols circling the village for rain, and a dialogue between the Besht/innkeeper and a mocking non-Jew about prayer for rain.
Shivhei-Habesht_0062	social:relations_with_non_jews	direct	True	high	CONFIRM	Story involves a non-Jewish witch (גוי'/מכשפה) interacting antagonistically with the Besht.
Shivhei-Habesht_0086	social:relations_with_non_jews	direct	True	high	CONFIRM	Story features interaction with a non-Jewish nobleman (אדון) and the Kamisar regarding debt collection.
Shivhei-Habesht_0171	social:relations_with_non_jews	direct	False	medium	REJECT	Bandits/raiders are mentioned but only as an offstage threat the Jews flee from; no actual depicted interaction with non-Jews.
Shivhei-Harav_0011	social:relations_with_non_jews	propagated	True	high	CONFIRM	Story extensively depicts interactions with non-Jews: Tsar Pavel, Tsar Alexander, governor Khovansky, the adjutant, and gentile women in the marketplace.
Shivhei-Harav_0016	social:relations_with_non_jews	propagated	True	high	CONFIRM	Story centrally involves gentile youths luring a Jewish boy to convert at their church.
Sipurei-Zadikim_0001	social:relations_with_non_jews	direct	True	high	CONFIRM	The story explicitly depicts R. Leib Sarah's visiting the Duke (דוכס) in Vienna and interacting with him, a clear interaction with a non-Jewish noble.
Sipurei-Zadikim_0011	social:relations_with_non_jews	propagated	False	high	REJECT	Story concerns Hasidic masters and disciples; no depiction of interactions with non-Jews.
Adat-Zadikim_0004	social:relations_with_sinners	propagated	False	high	REJECT	Story involves a sorcerer (non-Jewish lord) and a vow-breaking situation, but no depiction of the tzaddik interacting with Jewish sinners (averyianim).
Adat-Zadikim_0016	social:relations_with_sinners	propagated	True	high	CONFIRM	Story centers on a Jewish informer (sinner) who repents; the tzaddik-rabbi protects him from posthumous disgrace and investigates his status, directly depicting relations with a Jewish sinner.
Khal-Hasidim_0009	social:relations_with_sinners	propagated	False	high	REJECT	Story describes Besht's hidden righteousness, encounter with a possessed woman, and healings — no interaction with Jewish sinners as such.
