story_id	tag	old_source	opus_applies	opus_confidence	verdict	opus_reasoning
Khal-Hasidim_0002	experience:visions	propagated	False	medium	REJECT	Story features magical/supernatural events (palace materialization, summoning Prince of Torah/Fire) but no character experiences a waking vision in the sense of seeing supernatural sights revealed to them.
Khal-Hasidim_0040	experience:visions	propagated	True	high	CONFIRM	Characters visibly see two demons/imps in waking state in the synagogue and at the Besht's lodging.
Khal-Hasidim_0047	experience:visions	propagated	True	high	CONFIRM	R. Yitzchak repeatedly sees the deceased man appearing to him in waking visions to discuss Torah and the afterlife.
Khal-Hasidim_0054	experience:visions	propagated	True	high	CONFIRM	R. Yosef sees the deceased Maggid entering in waking state, dressed in Shabbat clothes — an explicit waking vision.
Khal-Hasidim_0089	experience:visions	propagated	True	medium	CONFIRM	The Baal Shem Tov states he saw the Shekhinah resting upon the Kloiz, a waking supernatural vision.
Khal-Hasidim_0116	experience:visions	propagated	True	high	CONFIRM	The Maggid sees the Baal Shem Tov sitting with his face burning like torches while performing yichudim — a supernatural waking vision.
Khal-Hasidim_0128	experience:visions	propagated	True	high	CONFIRM	R. Pinchas sees in prayer that the Besht is decreed to die; R. Leib Kessler sees the soul depart as a blue flame — waking supernatural visions.
Khal-Hasidim_0157	experience:visions	propagated	True	high	CONFIRM	While the child's soul-journey occurs during a coma-like state, the story depicts an explicit otherworldly vision of the heavenly court, books of merits/sins, and the Baal Shem Tov's arrival.
Mifalot-HaZadikim_0027	experience:visions	propagated	False	high	REJECT	No waking visions depicted; the story involves loss/return of mochin and a hidden tzadik, but no supernatural sights are seen.
Shivhei-Habesht_0004	experience:visions	propagated	True	high	CONFIRM	The rabbi sees a great light emanating from the Baal Shem Tov's face, and the guest sees a great fire/light on the oven — supernatural visions in waking state.
Shivhei-Habesht_0015	experience:visions	propagated	True	high	CONFIRM	The Besht describes seeing Samael on the path where prayers ascend — a supernatural waking vision.
Shivhei-Habesht_0087	experience:visions	propagated	False	medium	REJECT	The supernatural sight (Torah-angel in Gan Eden) is described as a dream, not a waking vision.
Adat-Zadikim_0003	folkloristics:story_type_advent	propagated	False	high	REJECT	Story is about Besht's journey to Constantinople and aborted trip to Israel, not a neutral character's first discovery of a tzaddik.
Adat-Zadikim_0004	folkloristics:story_type_advent	propagated	False	high	REJECT	The story features the Besht performing miracles, but does not depict a neutral character's first discovery/finding of him as its narrative frame.
Adat-Zadikim_0008	folkloristics:story_type_advent	propagated	False	high	REJECT	This is a tale of teshuva and a storyteller's encounter with a former bishop, not a neutral character's first discovery of a tzaddik.
Adat-Zadikim_0013	folkloristics:story_type_advent	propagated	False	high	REJECT	Story depicts a tzaddik exposing adultery via a dead witness; not a neutral discovery/first-encounter narrative.
Adat-Zadikim_0014	folkloristics:story_type_advent	propagated	False	high	REJECT	Story is about a sin, posthumous trial, and the Maharsha's ruling—not about a neutral character discovering a tzaddik.
Adat-Zadikim_0015	folkloristics:story_type_advent	propagated	False	high	REJECT	Story features established tzaddikim helping a longtime hasid; no discovery/first-encounter narrative.
Adat-Zadikim_0017	folkloristics:story_type_advent	propagated	True	high	CONFIRM	A Vilna notable and later the doctor Garde both come to test/discover the Maggid of Mezeritch, fitting the advent/first-encounter story type.
Khal-Hasidim_0001	folkloristics:story_type_advent	propagated	False	medium	REJECT	This is the birth/childhood origin story of the Besht himself, not a neutral character's discovery/first encounter with an already-established tzaddik.
Khal-Hasidim_0036	folkloristics:story_type_advent	propagated	False	high	REJECT	This is about a baal teshuva bishop and a disciple retelling a Besht story, not a neutral character's first discovery of a tzaddik.
Khal-Hasidim_0102	folkloristics:story_type_advent	propagated	False	high	REJECT	The story involves a man seeking the Besht for children, not a neutral character's first discovery/finding of a tzaddik.
Khal-Hasidim_0106	folkloristics:story_type_advent	propagated	False	high	REJECT	This is an encounter between two rabbis testing each other, not a neutral character's first discovery of a tzaddik.
Khal-Hasidim_0115	folkloristics:story_type_advent	propagated	False	high	REJECT	The Rishe magnate seeks out the Besht intentionally having heard of his fame; this is not a neutral discovery/first-encounter advent narrative.
Khal-Hasidim_0117	folkloristics:story_type_advent	propagated	False	high	REJECT	The story depicts the Besht rescuing a woman's soul, not a neutral character's first discovery of a tzaddik.
Khal-Hasidim_0126	folkloristics:story_type_advent	propagated	False	high	REJECT	Story is about Besht teaching disciple bitachon through a merchant's vow, not a neutral character's first discovery of a tzaddik.
Khal-Hasidim_0138	folkloristics:story_type_advent	propagated	False	high	REJECT	Story is about R. Gershon's mission to Hebron and meeting the Or HaChaim, not a neutral character's first discovery of a tzaddik.
Khal-Hasidim_0170	folkloristics:story_type_advent	propagated	False	high	REJECT	The emissaries find a drunkard, not a tzaddik being discovered; no neutral-character-finds-tzaddik narrative.
Khal-Hasidim_0174	folkloristics:story_type_advent	propagated	False	high	REJECT	Biographical narrative of R. Shneur Zalman's life and imprisonment; no neutral character's discovery/finding of a tzaddik.
Khal-Hasidim_0242	folkloristics:story_type_advent	propagated	False	high	REJECT	The story reveals the rabbi's hidden powers through a scandal/judgment episode, not a neutral character's first discovery/finding of the tzaddik.
Mifalot-HaZadikim_0001	folkloristics:story_type_advent	propagated	False	high	REJECT	The tzaddik is already famous; the woman seeks him out for help — not a discovery/first-encounter narrative.
Mifalot-HaZadikim_0006	folkloristics:story_type_advent	propagated	False	high	REJECT	This is a hachnasat orchim tale, not a discovery/first-encounter with a tzaddik narrative.
Peer-MiKdoshim_0006	folkloristics:story_type_advent	propagated	False	high	REJECT	Story is about trust in a tzaddik and fulfilling a vow, not a neutral character's first discovery of a tzaddik.
Peer-MiKdoshim_0009	folkloristics:story_type_advent	propagated	False	high	REJECT	Story is about a tzaddik exposing a fraudulent get; not a discovery/first-encounter narrative.
Shivhei-Habesht_0001	folkloristics:story_type_advent	propagated	False	high	REJECT	This is a birth/childhood narrative of the Besht, not a neutral character's first discovery of an established tzaddik.
Shivhei-Habesht_0043	folkloristics:story_type_advent	propagated	False	high	REJECT	Story is about a tzaddik's son's marriage and posthumous dream visits, not a neutral character's first discovery of a tzaddik.
Shivhei-Habesht_0184	folkloristics:story_type_advent	propagated	False	high	REJECT	The story involves a man seeking the Besht for children and later wonders, not a neutral character's first discovery of a tzaddik.
Shivhei-Harav_0011	folkloristics:story_type_advent	propagated	False	high	REJECT	Story recounts imprisonment, redemption, and informers — not a neutral character's first discovery of a tzaddik.
Shivhei-Harav_0019	folkloristics:story_type_advent	propagated	False	high	REJECT	The story includes a discovery-of-the-child episode but the discoverer is the tzaddik himself encountering the future disciple, not a neutral character finding a tzaddik.
Khal-Hasidim_0068	folkloristics:story_type_death_of_the_tsaddik	propagated	True	high	CONFIRM	Story explicitly describes the Baal Shem Tov's illness before his death and a scene during that final period.
Khal-Hasidim_0174	folkloristics:story_type_death_of_the_tsaddik	propagated	False	high	REJECT	Story narrates Shneur Zalman's biography and arrest, not his death or succession.
Shivhei-Harav_0011	folkloristics:story_type_death_of_the_tsaddik	propagated	False	high	REJECT	Story concerns the Rav's imprisonment and release (19 Kislev) and informers' fates, not the death of a tsaddik.
Shivhei-Harav_0019	folkloristics:story_type_death_of_the_tsaddik	propagated	True	high	CONFIRM	The story explicitly narrates the death of R. Aharon HaLevi Horowitz on Hoshana Rabbah 5589, including his final Torah teaching, instructing R. Avraham to finish it, and his soul's ascent.
Khal-Hasidim_0252	folkloristics:story_type_inauguration	propagated	True	high	CONFIRM	The story centrally depicts the Rema's inauguration as rabbi of Krakow, including the selection, formal acceptance, and ceremonial installation.
Khal-Hasidim_0172	folkloristics:story_type_parable	propagated	True	high	CONFIRM	The Mokhiach explicitly tells a mashal (about the dog Britan) with an explicit nimshal, fitting parable told by a tzaddik.
Adat-Zadikim_0015	folkloristics:story_type_prognostication	propagated	True	high	CONFIRM	The tzaddikim of Kozhnitz and Lublin predict/promise the childless man will find his deceased former fiancée at the Balta fair and have sons if he appeases her, and this prophecy is fulfilled.
Adat-Zadikim_0023	folkloristics:story_type_prognostication	propagated	False	high	REJECT	The story is about humility and Elijah's revelation, not a tzaddik's prophecy that comes true.
Khal-Hasidim_0001	folkloristics:story_type_prognostication	propagated	True	high	CONFIRM	Elijah's prediction that a son will be born who will illuminate Israel's eyes is fulfilled with the Besht's birth; also the father's deathbed prediction shapes the arc.
Khal-Hasidim_0059	folkloristics:story_type_prognostication	propagated	False	high	REJECT	Story is about miraculous healing via oath/prayer, not a prophecy that comes true.
Khal-Hasidim_0061	folkloristics:story_type_prognostication	propagated	True	high	CONFIRM	The Besht predicts the woman will bear a son and that the father will lose his money in exchange — both predictions come true.
Khal-Hasidim_0102	folkloristics:story_type_prognostication	propagated	True	high	CONFIRM	The Baal Shem Tov predicts the birth of a son and later the son's transformation, both of which come true as foretold.
Khal-Hasidim_0115	folkloristics:story_type_prognostication	propagated	False	medium	REJECT	The story centers on reincarnation/karmic debt and the Besht's revelation of past-life sins, not on a prediction by a tzaddik that comes true.
Khal-Hasidim_0126	folkloristics:story_type_prognostication	propagated	True	high	CONFIRM	The Baal Shem Tov's repeated assurance 'Hashem will help you' functions as a prediction that is fulfilled when the wealthy merchant arrives with the needed funds.
Khal-Hasidim_0145	folkloristics:story_type_prognostication	propagated	True	high	CONFIRM	The Maggid's instruction to take an alternate route is a prophetic direction whose providential outcome (meeting the Duke) fulfills the implicit prediction.
Khal-Hasidim_0170	folkloristics:story_type_prognostication	propagated	True	high	CONFIRM	The tzaddik predicts the plague will cease when the drunkard decrees it, and this prediction comes true exactly as foretold.
Khal-Hasidim_0174	folkloristics:story_type_prognostication	propagated	False	high	REJECT	Biographical/persecution narrative about R. Shneur Zalman's arrest; no tzaddik prediction-fulfillment arc.
Khal-Hasidim_0193	folkloristics:story_type_prognostication	propagated	False	high	REJECT	Story depicts a tzaddik's protective intervention/exorcism against demons, not a prediction or prophecy that comes true.
Khal-Hasidim_0217	folkloristics:story_type_prognostication	propagated	False	medium	REJECT	The tzaddik prescribes a remedy (bathing in the sea) and orchestrates a swap, but the arc is not centered on a prediction/prophecy coming true.
Khal-Hasidim_0222	folkloristics:story_type_prognostication	propagated	True	high	CONFIRM	The tzaddik's blessing/prediction that God will prepare a place and livelihood for the avrekh drives the plot and is fulfilled through the innkeeper episode.
Khal-Hasidim_0237	folkloristics:story_type_prognostication	propagated	True	high	CONFIRM	The tzaddikim (Maggid of Kozhnitz and Seer of Lublin) predict the man will have sons if he appeases his deceased betrothed, and the prophecy is fulfilled.
Khal-Hasidim_0253	folkloristics:story_type_prognostication	propagated	False	high	REJECT	The story is about a tzaddik's friend hiding his humility and Elijah's revelation, not about a prediction/prophecy that comes true.
Maase-Zadikim_0015	folkloristics:story_type_prognostication	propagated	True	high	CONFIRM	The tzaddik's blessing/prediction that God will prepare a place and livelihood for the avrekh drives the narrative and is fulfilled through the events at the innkeeper's house.
Maase-Zadikim_0016	folkloristics:story_type_prognostication	propagated	True	high	CONFIRM	The tzaddik of Shpole swears the Hasid will have no children, and R. Pinchas of Koretz swears he will—both prophecies' fulfillment (and the descendant's betrayal) drive the narrative arc.
Mifalot-HaZadikim_0027	folkloristics:story_type_prognostication	propagated	False	high	REJECT	Story centers on a hidden tzaddik causing the Besht to desecrate Shabbat as atonement, not on a fulfilled prediction/prophecy.
Peer-MiKdoshim_0001	folkloristics:story_type_prognostication	propagated	False	high	REJECT	The story centers on reincarnation/debt-repayment and the Besht's clairvoyant revelation of a past life, not on a prophecy that comes true.
Peer-MiKdoshim_0005	folkloristics:story_type_prognostication	propagated	False	high	REJECT	The story centers on a tzaddik's prayer rescuing a youth from idolaters, not on a prediction/prophecy coming true.
Peer-MiKdoshim_0006	folkloristics:story_type_prognostication	propagated	True	high	CONFIRM	The Baal Shem Tov's prediction/instruction about finding the proper groom and his assurance 'Hashem will help you' come true through the miraculous arrival of the wealthy merchant who pays the dowry.
Peer-MiKdoshim_0009	folkloristics:story_type_prognostication	propagated	True	high	CONFIRM	The tzaddik predicts the marriage/get won't hold ('the get will not light up to be a writ of divorce'), and his prophecy is fulfilled when the true husband appears and the fraud is exposed.
Peer-MiKdoshim_0015	folkloristics:story_type_prognostication	propagated	True	high	CONFIRM	The tzaddik Elimelech directs the sick nobleman to bathe in the sea, predicts his replacement and eventual return, and instructs precisely how to enthrone the beggar-noble — all of which comes to pass.
Peer-MiKdoshim_0016	folkloristics:story_type_prognostication	propagated	False	high	REJECT	Story is about miraculous providence/faith enabling a marriage, not a tzaddik's prediction coming true.
Shivhei-Habesht_0001	folkloristics:story_type_prognostication	propagated	True	medium	CONFIRM	Contains Elijah's prediction that a son will be born who will enlighten Israel, and the father's deathbed prophecy that the child will illuminate — both fulfilled in the Besht.
Shivhei-Habesht_0002	folkloristics:story_type_prognostication	propagated	False	high	REJECT	The story is an origin/biographical tale of the Besht receiving R. Adam's writings; it contains miracles but not a tzaddik's prediction whose fulfillment forms the narrative arc.
Shivhei-Habesht_0043	folkloristics:story_type_prognostication	propagated	False	high	REJECT	Contains dreams and visions but no central prophecy by a tzaddik that comes true as the narrative arc.
Shivhei-Habesht_0112	folkloristics:story_type_prognostication	propagated	False	high	REJECT	The story involves a tzaddik's knowledge of the afterlife and a deceased disciple's revelation, not a prophecy/prediction that comes true.
Shivhei-Habesht_0184	folkloristics:story_type_prognostication	propagated	True	high	CONFIRM	The Besht predicts the man will have a son within a year and later predicts his son will transform—both prophecies come true.
Shivhei-Harav_0019	folkloristics:story_type_prognostication	propagated	False	high	REJECT	No prediction/prophecy that comes true as the narrative arc; the tzaddik's attempted match is refused, and the main miracle is rescue from demons, not fulfilled prognostication.
Adat-Zadikim_0008	folkloristics:story_type_protection	propagated	False	medium	REJECT	Central narrative is the storytelling-redemption of a Bishop (former Jew) via tale-telling; the Besht's intervention years earlier rescued a soul spiritually, not a protection-from-danger plot driving the story.
Adat-Zadikim_0013	folkloristics:story_type_protection	propagated	False	high	REJECT	The story is about the tzaddik exposing an adulteress and defending his wife's honor, not protecting someone from danger.
Adat-Zadikim_0023	folkloristics:story_type_protection	propagated	False	high	REJECT	Story is about humility and Elijah's revelation to a hidden scholar, not about a tzaddik protecting someone from danger.
Khal-Hasidim_0001	folkloristics:story_type_protection	propagated	True	high	CONFIRM	The young Besht protects the children from the werewolf-sorcerer, killing it — a clear protection narrative (and his father earlier protects the king's army).
Khal-Hasidim_0023	folkloristics:story_type_protection	propagated	True	high	CONFIRM	The Baal Shem Tov travels to Berlin specifically to save the bride from death caused by the deceased wife's spirit, central protection narrative.
Khal-Hasidim_0024	folkloristics:story_type_protection	propagated	True	high	CONFIRM	The Baal Shem Tov protects the infant from death and later defeats the sorcerer-lord, central protection narrative.
Khal-Hasidim_0052	folkloristics:story_type_protection	propagated	False	medium	REJECT	The Baal Shem Tov confronts and defeats a witch/demon attacking him personally, not protecting another person from danger.
Khal-Hasidim_0117	folkloristics:story_type_protection	propagated	True	high	CONFIRM	The Besht travels via kefitzat haderech to rescue a woman's soul from apostasy and spiritual danger, central protection narrative.
Khal-Hasidim_0120	folkloristics:story_type_protection	propagated	True	medium	CONFIRM	The Baal Shem Tov protects the community by neutralizing a heavenly accusation blocking their Yom Kippur prayers.
Khal-Hasidim_0174	folkloristics:story_type_protection	propagated	False	high	REJECT	Story is a biographical/historical account of R. Shneur Zalman's arrest and interrogation, not a tzaddik-protects-another narrative.
Khal-Hasidim_0253	folkloristics:story_type_protection	propagated	False	high	REJECT	Story is about humility and Elijah's revelation to a hidden scholar, not about a tzaddik protecting someone from danger.
Maase-Zadikim_0006	folkloristics:story_type_protection	propagated	True	high	CONFIRM	The tzaddik of Mezhibuzh acts to protect the Jewish community from a deadly epidemic by directing emissaries to the hidden tzaddik who decrees its cessation.
Mifalot-HaZadikim_0006	folkloristics:story_type_protection	propagated	False	high	REJECT	Story is about hospitality (hachnasat orchim) and a blessing for a child, not about a tzaddik protecting someone from danger.
Peer-MiKdoshim_0006	folkloristics:story_type_protection	propagated	False	medium	REJECT	Central theme is bitachon, fulfilling vows, and faith in the tzaddik; the tzaddik facilitates aid rather than protecting someone from a specific danger.
Shivhei-Habesht_0002	folkloristics:story_type_protection	propagated	False	medium	REJECT	The story is a long origin/biographical narrative about R. Adam, the manuscripts, and the Besht's early life; protection is not the central theme.
Shivhei-Habesht_0192	folkloristics:story_type_protection	propagated	True	high	CONFIRM	The Besht protects himself from the officer's sword by transferring the paralysis to the attacker, simultaneously healing the sick woman—central act of protection.
Shivhei-Habesht_0198	folkloristics:story_type_protection	propagated	True	high	CONFIRM	The Besht travels via kfitzat haderech to rescue a woman from converting/being taken by a hostile noble, protecting her soul and body from danger.
Shivhei-Harav_0011	folkloristics:story_type_protection	propagated	True	high	CONFIRM	Central narrative is the tzaddik (and his son/disciple) being protected/redeemed from imprisonment by hostile authorities through divine intervention.
Shivhei-Harav_0014	folkloristics:story_type_protection	propagated	False	high	REJECT	Biographical/hagiographic account of R. Shneur Zalman's life, studies, and disputes; no narrative of tzaddik protecting someone from danger.
Shivhei-Harav_0018	folkloristics:story_type_protection	propagated	True	medium	CONFIRM	The Rebbe prays for Russian victory to protect Jews from French heresy, advises the Russian commander, and predicts Napoleon's downfall — central narrative involves protection from a hostile force.
Sipurei-Zadikim_0011	folkloristics:story_type_protection	propagated	False	high	REJECT	Story is about discovering hidden tzaddikim and the path to the Maggid of Mezritch, not about a tzaddik protecting someone from danger.
Adat-Zadikim_0004	folkloristics:story_type_rapprochement	propagated	True	high	CONFIRM	The skeptical innkeeper/moykhsn doubts the Besht's claims, travels with him, witnesses the miraculous arrival and revival of the bride, becoming drawn close — a clear rapprochement arc.
Adat-Zadikim_0008	folkloristics:story_type_rapprochement	propagated	True	high	CONFIRM	The bishop, a former Jew fallen into apostasy, is drawn back through the Besht's intervention and the retelling of his story — a clear rapprochement arc.
Adat-Zadikim_0013	folkloristics:story_type_rapprochement	propagated	False	high	REJECT	The townspeople fear/respect the rabbi after the miracle but the arc centers on exposing adultery and justice, not an outsider/skeptic being drawn close to Hasidism.
Khal-Hasidim_0001	folkloristics:story_type_rapprochement	propagated	False	high	REJECT	This is an origin/birth legend of the Baal Shem Tov, not a story of an outsider/skeptic being drawn to a tzaddik.
Khal-Hasidim_0002	folkloristics:story_type_rapprochement	propagated	False	medium	REJECT	The story is an origin/legend about the Baal Shem Tov receiving R. Adam's writings and his early life; it does not depict an outsider/skeptic being drawn near to a tzaddik.
Khal-Hasidim_0103	folkloristics:story_type_rapprochement	propagated	True	high	CONFIRM	The third brother, a mitnaged opposed to the Baal Shem Tov, is healed by him and brought close, exemplifying rapprochement.
Khal-Hasidim_0193	folkloristics:story_type_rapprochement	propagated	True	high	CONFIRM	A simple/outsider man tormented by demons is drawn to the tzaddik of Strashelye, who saves him; he becomes a devotee testifying to the rebbe's power.
Maase-Zadikim_0005	folkloristics:story_type_rapprochement	propagated	False	high	REJECT	Story is about the Besht's journey, spiritual fall, and annulling a decree—no skeptic/outsider drawn close to a tzaddik.
Shivhei-Habesht_0002	folkloristics:story_type_rapprochement	propagated	True	medium	CONFIRM	The bandits, after witnessing the Besht's miracle, become his disciples and swear off harming Jews — a rapprochement of outsiders to the tzaddik.
Khal-Hasidim_0148	folkloristics:story_type_revelation	propagated	False	high	REJECT	Story describes a vision of a deceased tzaddik's luminous garments at a betrothal, not the revelation of a hidden tzaddik.
Adat-Zadikim_0004	folkloristics:story_type_virtues	propagated	False	medium	REJECT	The story showcases the Besht's miraculous powers and supremacy over a sorcerer, not his virtues like humility or charity.
Adat-Zadikim_0008	folkloristics:story_type_virtues	propagated	False	medium	REJECT	The story centers on the power of telling Baal Shem Tov stories and repentance of a former apostate, not on illustrating specific virtues of the tzaddik.
Adat-Zadikim_0013	folkloristics:story_type_virtues	propagated	False	medium	REJECT	The story showcases the tzaddik's miraculous powers and authority (raising the dead, exposing sin) rather than illustrating a specific virtue like humility or charity.
Adat-Zadikim_0015	folkloristics:story_type_virtues	propagated	False	high	REJECT	Story illustrates the power/insight of tzaddikim and the gravity of breaking engagements, not the personal virtues of the tzaddik.
Khal-Hasidim_0002	folkloristics:story_type_virtues	propagated	True	medium	CONFIRM	The story illustrates virtues of the Baal Shem Tov including humility (hiding his greatness, living in poverty), piety (fasting, seclusion), and righteousness (making robbers swear not to harm Jews).
Khal-Hasidim_0009	folkloristics:story_type_virtues	propagated	False	medium	REJECT	Story narrates the Baal Shem Tov's hidden years and revelation/miracles, not primarily illustrating a specific virtue.
Khal-Hasidim_0115	folkloristics:story_type_virtues	propagated	False	high	REJECT	The story illustrates reincarnation/debt and divine justice, not the virtues of a tzaddik.
Khal-Hasidim_0126	folkloristics:story_type_virtues	propagated	False	medium	REJECT	Story illustrates the Besht's miraculous knowledge and teaches R' David bitachon, but the focus is on faith/trust dynamics and a miracle tale rather than depicting a tzaddik's virtues per se.
Khal-Hasidim_0167	folkloristics:story_type_virtues	propagated	True	medium	CONFIRM	The story illustrates the tzaddik R' Leib Sarah's foresight and benevolent matchmaking power, showcasing his virtues in arranging a divinely-ordained match.
