story_id	tag	source	source_story	opus_confidence	opus_reasoning
Khal-Hasidim_0089	spaces:beth_midrash	propagated	Shivhei-Habesht_0138	medium	The kloyz is mentioned and a beit midrash is referenced as a place the two men go, but no scene is actually set there; it is incidental.
Khal-Hasidim_0102	spaces:beth_midrash	propagated	Shivhei-Habesht_0002	high	No beit midrash or yeshiva setting appears; scenes occur in homes, the road, a forest house, and Leipzig market.
Khal-Hasidim_0115	spaces:beth_midrash	propagated	Shivhei-Habesht_0002	high	No beit midrash or yeshiva setting appears; scenes occur in homes, on the road, and at a tzaddik's residence.
Khal-Hasidim_0117	spaces:beth_midrash	propagated	Shivhei-Habesht_0002	high	No study hall setting appears; scenes occur in a house, on the road, and at a wedding.
Khal-Hasidim_0126	spaces:beth_midrash	propagated	Khal-Hasidim_0002	high	No beit midrash or yeshiva setting depicted.
Khal-Hasidim_0136	spaces:beth_midrash	propagated	Shivhei-Habesht_0028	medium	Setting is a synagogue (beit knesset) for prayer, not a study hall; 'בבה״מ שלו' likely refers to his synagogue/place but the scene is communal prayer, not study.
Khal-Hasidim_0138	spaces:beth_midrash	propagated	Khal-Hasidim_0002	high	No study hall setting; story occurs in homes, Hebron, Cave of Machpelah, and prison.
Khal-Hasidim_0170	spaces:beth_midrash	propagated	Shivhei-Habesht_0002	high	No study hall setting; scenes occur in a village home, palace, and the rebbe's place.
Khal-Hasidim_0174	spaces:beth_midrash	propagated	Shivhei-Habesht_0002	high	No beit midrash or yeshiva setting depicted; story involves study at home, travels, prison/fortress, and royal court.
Khal-Hasidim_0242	spaces:beth_midrash	propagated	Shivhei-Habesht_0002	high	Story is set in rabbi's house, fishmongers' street, and community council hall — no beit midrash/yeshiva setting depicted.
Khal-Hasidim_0253	spaces:beth_midrash	propagated	Shivhei-Habesht_0002	medium	Study takes place in a private room in the baker's house, not a beit midrash or yeshiva.
Mifalot-HaZadikim_0001	spaces:beth_midrash	propagated	Shivhei-Habesht_0002	high	No study hall setting; story takes place in homes, streets, palace, and court.
Mifalot-HaZadikim_0006	spaces:beth_midrash	propagated	Shivhei-Habesht_0043	high	While a 'rosh yeshiva' role is mentioned, no scene actually takes place in a beit midrash/yeshiva setting.
Mifalot-HaZadikim_0027	spaces:beth_midrash	propagated	Shivhei-Habesht_0002	high	Setting is a forest hut, not a study hall.
Peer-MiKdoshim_0001	spaces:beth_midrash	propagated	Shivhei-Habesht_0002	high	No study hall setting appears; scenes occur in homes, on roads, and at a tzadik's house.
Peer-MiKdoshim_0006	spaces:beth_midrash	propagated	Shivhei-Habesht_0002	high	No study hall setting depicted; scenes occur in homes, on roads, in a forest, and at the Besht's room.
Peer-MiKdoshim_0009	spaces:beth_midrash	propagated	Shivhei-Habesht_0002	high	No beit midrash or yeshiva setting depicted; scenes occur in the rabbi's home, the wealthy man's house, and a rabbinical court.
Shivhei-Habesht_0004	spaces:beth_midrash	propagated	Shivhei-Habesht_0002	high	Settings include a forest hermitage, home, and the rabbi's house, but no beit midrash or yeshiva is depicted.
Shivhei-Habesht_0184	spaces:beth_midrash	propagated	Shivhei-Habesht_0002	high	No study hall setting; story takes place in homes, market, and forest house.
Shivhei-Habesht_0207	spaces:beth_midrash	propagated	Khal-Hasidim_0128	medium	Brief mention of R. Nachman going to a beit midrash to pray, but action centers on the Besht's home/deathbed, not the study hall as a setting.
Shivhei-Harav_0011	spaces:beth_midrash	propagated	Khal-Hasidim_0002	high	The story concerns imprisonment, release, and informers; no study hall setting appears.
Shivhei-Harav_0019	spaces:beth_midrash	propagated	Shivhei-Habesht_0002	high	No beit midrash or yeshiva setting depicted; scenes occur in a tavern, the Rebbe's room/house, roads, and a grave site.
Adat-Zadikim_0013	spaces:institutions_hassidic_court	propagated	Shivhei-Harav_0019	high	Story is set in the rabbi's home and communal meeting house in Yassi, not a hasidic court (chatzer ha-tzaddik).
Adat-Zadikim_0023	spaces:institutions_hassidic_court	propagated	Shivhei-Harav_0019	high	Story concerns Rabbi Moshe Isserles and R. Chaim, a pre-Hasidic rabbinic setting; no hasidic rebbe's court depicted.
Khal-Hasidim_0002	spaces:institutions_hassidic_court	propagated	Shivhei-Harav_0019	high	No depiction of a rebbe's court; settings are emperor's court, beit midrash, wilderness — pre-Besht biography.
Khal-Hasidim_0174	spaces:institutions_hassidic_court	propagated	Shivhei-Harav_0019	medium	Story focuses on R. Shneur Zalman's biography, conflicts, and imprisonment; no depiction of a hasidic court as a space.
Khal-Hasidim_0253	spaces:institutions_hassidic_court	propagated	Shivhei-Harav_0019	high	Story is about a rabbi/av beit din and his friend, not a hasidic rebbe's court.
Mifalot-HaZadikim_0006	spaces:institutions_hassidic_court	propagated	Shivhei-Harav_0019	high	Story concerns hospitality at a roadside inn and a rabbi/yeshiva head; no hasidic court depicted.
Peer-MiKdoshim_0006	spaces:institutions_hassidic_court	propagated	Shivhei-Harav_0019	high	Story involves visits to the Besht but depicts travel/encounters, not the court space itself.
Shivhei-Habesht_0002	spaces:institutions_hassidic_court	propagated	Shivhei-Harav_0019	high	The story predates the Besht's emergence as a rebbe; 'חצר הקיסר' refers to the emperor's court, not a hasidic court.
Shivhei-Harav_0011	spaces:institutions_hassidic_court	propagated	Shivhei-Harav_0019	high	Story concerns the Rebbe's arrest, imprisonment, and release in Petersburg, not depictions of a hasidic court.
Shivhei-Harav_0014	spaces:institutions_hassidic_court	propagated	Shivhei-Harav_0019	medium	Mentions Maggid's house/beis and tzaddikim's locations incidentally, but does not depict the hasidic court as a setting.
Shivhei-Harav_0018	spaces:institutions_hassidic_court	propagated	Shivhei-Harav_0019	high	Story concerns wartime flight, death, and burial of the rebbe; no depiction of a hasidic court.
Sipurei-Zadikim_0011	spaces:institutions_hassidic_court	propagated	Shivhei-Harav_0019	medium	Maggid of Mezritch is mentioned as destination and disciples gather there, but the story does not actually depict scenes within the rebbe's court/residence space in any developed way.
Shivhei-Habesht_0202	supernatural:miracle	propagated	Khal-Hasidim_0123	medium	The Besht's dispelling of strong wine via fear of God is a wondrous personal act, not a discrete miracle benefiting a recipient with clear before/after change.
Khal-Hasidim_0217	supernatural:perception	propagated	Peer-MiKdoshim_0015	medium	The tzaddik prescribes sea-bathing as a cure and his prayer brings about the punishment, but the story does not explicitly depict him perceiving hidden knowledge or seeing what others can't.
Khal-Hasidim_0243	supernatural:perception	propagated	Maase-Zadikim_0018	high	The rebbe investigates by ordinary observation and questioning, not supernatural perception; the innkeeper's power comes from bitachon, not from seeing/knowing supernaturally.
Khal-Hasidim_0157	times:death	propagated	Shivhei-Habesht_0210	medium	The child appears to die but revives; no actual death occurs—only a near-death/soul-journey episode.
Khal-Hasidim_0009	times:shabbat	propagated	Shivhei-Habesht_0005B	medium	Shabbat is mentioned only incidentally (he came home on erev Shabbat); the story centers on the Besht's revelation, not Shabbat.
