tag	story_url	story_id	edition	signals	sim	matched_terms	claude_applies	claude_confidence	claude_reasoning	excerpt
times:death	https://www.hasidic-stories.org/Story/Mifalot-HaZadikim/Mifalot-HaZadikim_0021	Mifalot-HaZadikim_0021	Mifalot-HaZadikim	embedding	0.961		False	high	The story discusses mesirat nefesh (self-sacrifice) as a theological concept and depicts public humiliation as an act of devotion, but no actual death, dying person, or mortal event occurs in the narrative.	ררותו בתשובה נכונה ויעזוב את העגלות עם היי״ג הנ״ל ביד ערלים הנ״ל המובילים אותו וינס ויצא לרבו הנ״ל מ מעזיבוז . והגם שהיה דבר זה סכנה שיפסוד ח״ו כל היין הן אפשר שיכחישו לו הערלים ויאמרו להד״ם או לפחות יפסיד אותו מחמת ניסו
times:death	https://www.hasidic-stories.org/Story/Shivhei-Habesht/Shivhei-Habesht_0193	Shivhei-Habesht_0193	Shivhei-Habesht	embedding	0.96		True	high	"The story explicitly ends with the man dying before the year is out ('לא הוציא שנתו ר""ל') as a direct consequence of abandoning his penance, making death a central narrative outcome."	"Shivhei-Habesht_0193 תיוגים* פ""א הי' הבעש״ט באיזה קהילה והי׳ אכסניאותו על העלי' : פעם א׳ ראה איש א׳ עובר על הרחוב מיד צוה להמשרת שלו רוץ מהר וקרא לי את האיש הזה וירץ הנער ויקרא לו ומתחילה נתפעם לבו ולא רצה לילך ועכ״ז לא "
times:death	https://www.hasidic-stories.org/Story/Khal-Hasidim/Khal-Hasidim_0017	Khal-Hasidim_0017	Khal-Hasidim	embedding	0.96		False	high	Death is mentioned only as background information (the wicked man died ~60 years ago), not depicted as an event in the story; the narrative centers on poverty, faith, and reincarnation/repentance.	"ספרו לו גנות ורעות האיש אשר שואל עליו כי היה רשע שאין דומה לו ר""ל : וישא הת""ח ההוא את רגליו וישב לביתו בפחי נפש בלי שום תשוע' כי אם ברפיון כח מרוב הדרך והיגונות אשר מצאתהו עדי בואו לביתו העיר הגדולה אשר שם היה הבעש""ט זלל"
times:death	https://www.hasidic-stories.org/Story/Khal-Hasidim/Khal-Hasidim_0202	Khal-Hasidim_0202	Khal-Hasidim	embedding	0.96		False	high	The story centers on childlessness, conflicting rabbinic oaths, a heavenly tribunal, and Passover hospitality — death is neither depicted nor meaningfully present.	 הקדוש הסבא קדישא כי יתפלל בעדו להשם ית' שיושיעהו בפרי בטן והצדיק הנזכר היה מדחה אותו בלך ושוב בכל יום פעם אמר לו כ כי יעשה סעודת מרעים להחסידים והמה יברכו אותו אולי יעלה בידם וכן עשה ולא הועילו לו מאומה ובכל פעם בואו לר
times:death	https://www.hasidic-stories.org/Story/Adat-Zadikim/Adat-Zadikim_0023	Adat-Zadikim_0023	Adat-Zadikim	embedding	0.959		True	high	"The death of R. Chaim's wife ('מתה אשתו של הרר""ח') is the inciting event that drives the entire plot, and a deadly plague ('דבר גדול') later strikes Kraków — both are central to the narrative, not incidental."	"פחתיך ואתה יקר בעיני מעשרה בנים ומה אתה חסר עמדי על כן תניח מלדבר דברים כאלו ולעגם את נפשי כי כל ימי חיי לא אניחך להפרד מאתי ויבך גם הר""ח ויחשה ולא ענהו מאומה. ובמשך זמן מועט אמר לו אדוני חבירי אל נא תרבה תדבר אלי עוד בד"
times:death	https://www.hasidic-stories.org/Story/Mifalot-HaZadikim/Mifalot-HaZadikim_0027	Mifalot-HaZadikim_0027	Mifalot-HaZadikim	embedding	0.959		True	medium	"A deceased woman (Sarah) appears as a spirit from sealed ruined rooms to reveal the supernatural plot, and the central stakes involve the loss of the Besht's portion in the World to Come (עוה""ב/ג""ע) — making death and afterlife structurally present, though not the story's primary dramatic focus."	 להרוג אותם הוא רוצה והנה בתוך כך נפתחה דלת אחת מן החדרים המוסגרים החרבים ויצא משם אשם אחת עשירה ומקושטת ויגש לפני רום פני הבעש״ט זי״ע ואמר לו רבי אני מבקש מכם לשבות אצלי בשבת קודש ענה הבעש״ט ואמר שתי פליאות לי אחת האיך 
times:death	https://www.hasidic-stories.org/Story/Khal-Hasidim/Khal-Hasidim_0004	Khal-Hasidim_0004	Khal-Hasidim	embedding	0.959		False	high	The story depicts the Besht's hidden spiritual life and public revelation, with only an incidental halakhic mention of 'חייב מיתה' (liable to death) regarding tefillin on Chol HaMoed — no actual death is depicted.	"י לפלא בעיניו ויהי בבוקר וילך לבית התבודדות להתפלל שם כדרכו ובבואו לביתו בא שמח וטוב לב בנשיאת ראש והלך בביתו אנה ואנה לומר אסדר לסעודתא ועשה קדושא רבא כדרכו בדביקות נפלא ובתוך הסעודה ביקש את האורח שיאמר ד""ת. ולא היה יוד"
times:death	https://www.hasidic-stories.org/Story/Khal-Hasidim/Khal-Hasidim_0086	Khal-Hasidim_0086	Khal-Hasidim	embedding	0.959		True	high	Death is central to the story: the Besht predicts the ill man will die, he does die, and the narrative continues with his soul's post-mortem experiences in Gan Eden.	"Khal-Hasidim_0086 תיוגים מעשה כשבא הבעש״ט לק""ק מעזיבוז לא היה חשוב בעיני החסידים היינו הרה""ק ר' זאב קיצעס והרה""ק ר' דוד פורקעס מחמת השם שקראו אותו בעש״ט כי שם זה אינו נאה לצדיק והיה להם תלמיד הגון וחלה והוא והיא היה איש "
times:death	https://www.hasidic-stories.org/Story/Shivhei-Habesht/Shivhei-Habesht_0197	Shivhei-Habesht_0197	Shivhei-Habesht	embedding	0.959		False	high	The story concerns a preacher's quest to learn the mystical language of animals and birds from the Besht, who ultimately teaches and then erases this knowledge — death is never depicted or mentioned.	"Shivhei-Habesht_0197 תיוגים* מעשה הי' שהרב המוכיח מוה' ארי׳ ליב מפולנאה חשקה נפשו מאוד ללמוד חכמת שיחת בהמות ועופות ושיחת דקלים מצד שנצרך לו זה לתוכחה ומאחר שהיה כוונתו לש""ש נגמר בדעתו ליסע ל הבעש״ט ולבקש ממנו שילמד אותו"
times:death	https://www.hasidic-stories.org/Story/Shivhei-Habesht/Shivhei-Habesht_0021	Shivhei-Habesht_0021	Shivhei-Habesht	embedding	0.958		False	high	Death is mentioned only in passing — the preacher announces a heavenly proclamation that certain enemies will be killed/die, but this is immediately rebuked by the Besht and no actual death is depicted in the story.	"Shivhei-Habesht_0021 תיוגים* שמעתי מהרב המפורסם החסיד וחכים דק""ק פולנאה 20 21 שהי' שבחי הבעש״ט 22 שהיה אב""ד בק""ק שאריגראד שמע ש הבעש״ט בא לק""ק מאהליב אמר בלבו אסע גם אני כי לא היה עדיין חסיד ונסע ובא בעש""ק אליו קודם תפיל"
times:death	https://www.hasidic-stories.org/Story/Khal-Hasidim/Khal-Hasidim_0111	Khal-Hasidim_0111	Khal-Hasidim	embedding	0.958		True	high	"The story explicitly ends with the man's death ('שלא הוציא שנתו ר""ל') as a direct consequence of abandoning his repentance regimen — death is a central narrative outcome, not a peripheral mention."	"Khal-Hasidim_0111 תיוגים פ""א היה הבעש""ט באיזה קהילה והי' אכסניתו על העלי' פעם א' ראה איש א' עובר על הרחוב מיד צוה להמשרת שלו רוץ מהר וקרא לי את האיש הזה וירץ הנער ויקרא לו ומתחילה נתפעם לבו ולא רצה לילך ועכ""ז לא יכול להע"
times:death	https://www.hasidic-stories.org/Story/Khal-Hasidim/Khal-Hasidim_0253	Khal-Hasidim_0253	Khal-Hasidim	embedding	0.958		False	medium	"The death of R. Chaim's first wife is mentioned briefly as a plot-triggering backstory ('ומתה אשתו של הרר""ח'), but death is not depicted, dwelt upon, or thematically central — the story is about humility, secret marriage, and Elijah's visitation."	"חשה ולא ענהו מאומה ובמשך זמן מועט אמר לו אדוני חבירי אל נא תרבה לדבר אלי עוד בדבר זה כי לא אשנה דברי אשר דברתי כי הומה לבי אל משפחתי כי לא מאבן נולדתי וגם אנכי רוצה לקיים כיבוד אחי הגדול אשר הוא דאורייתא וע""כ אל תתרעם על"
times:death	https://www.hasidic-stories.org/Story/Shivhei-Habesht/Shivhei-Habesht_0034	Shivhei-Habesht_0034	Shivhei-Habesht	embedding	0.958		False	high	The story centers on the Maggid's illness and miraculous healing by the Besht, along with a mystical Kabbalistic transmission — death is neither depicted nor thematically present.	"Shivhei-Habesht_0034 תיוגים* שמעתי מהרב דק""ק דראזניץ שהיה אב""ד בק""ק פאוולויץ המעשה איך נתקרב הרב המגיד הגדול ל הבעש״ט המגיד צום ז' או ח' פעמים משבת לשבת רצופים, וחלה מאוד פ""א בא ר' מענדל מק""ק באר לק' טארטשין ונתאכסן אצל "
times:death	https://www.hasidic-stories.org/Story/Khal-Hasidim/Khal-Hasidim_0218	Khal-Hasidim_0218	Khal-Hasidim	embedding	0.958		False	high	The story is entirely about spiritual journeys, Torah study, and spreading Hasidism — no character dies, no death scene occurs, and death is not mentioned even incidentally.	"תמהמהו יתמהמו פה על המשתה אשר יעשה להם ואח״כ יתן להם מסת נדבת ידו כי חשב כי המה נוסעים לקבץ כסף ונתרצה לו הרר""י וימתינו עד הסעודה והאנשים הקרואים על המנין ג""כ היו שם ויתבוננו כולם אודות האנשים ההם כי המה ראו חדשות אשר לא"
times:death	https://www.hasidic-stories.org/Story/Shivhei-Habesht/Shivhei-Habesht_0160	Shivhei-Habesht_0160	Shivhei-Habesht	embedding	0.958		False	high	The story concerns a communal dispute between a rabbi and a townsman, the Besht's intercession, and the Mokhiach secretly nullifying legal judgments — no death occurs or is mentioned.	"Shivhei-Habesht_0160 תיוגים* מעשה שהיה אב""ד בק""ק באר ואחד מבני העיר חלק עליו ונסע אל השר להקביל עליו ואינו ידוע לי לו אם מעסק הרבנות או מעסק אחר והטה מן הדרך אל הבעש״ט שיתפלל בעדו שיפיק רצונו מן השר והבטיח לו הבעש״ט ונסע"
times:death	https://www.hasidic-stories.org/Story/Shivhei-Habesht/Shivhei-Habesht_0020	Shivhei-Habesht_0020	Shivhei-Habesht	embedding	0.958		True	high	The story centrally depicts the Baal Shem Tov communing with and elevating the souls of the dead (נשמות מתים) during prayer, with thousands of souls of the deceased arriving and requiring rectification — death and the souls of the dead are the core subject matter.	"ושה לו תיקון ומתפלל בעדו ומעלהו והחשוב חשוב קודם והם רבים כ״כ שאם רציתי להעלות כולם הייתי צריך לעמוד ש״ע שלש שנים אך כשאני שומע הכרוז שמכריז תקודש מקודש וא""א עוד להעלות הנשמות אני פוסע מן הש""ע ואמר אליו רבי גרשון בדרך שח"
times:death	https://www.hasidic-stories.org/Story/Shivhei-Habesht/Shivhei-Habesht_0138	Shivhei-Habesht_0138	Shivhei-Habesht	embedding	0.958		False	high	The story depicts a journey with the Baal Shem Tov, his charitable distribution of money, and people seeking remedies — there is no death, dying, or mourning depicted.	"ט נסע לדרכו ובאו וכשראו ששהה נסיעתם אמרו אנחנו נלך לבהמ""ד וכשיהי' מוכן לנסוע יתן לנו ר' מאיר ידיעה ונבוא וכן הי' שהודיע להם ובאו ונתן הנגיד ל הבעש״ט בפעם ראשונה א׳ אד""ז וכשבאו וכשבאי פ""ש לקח הבעש״ט אותו א""ז ונתן להנגיד ה"
times:death	https://www.hasidic-stories.org/Story/Khal-Hasidim/Khal-Hasidim_0031	Khal-Hasidim_0031	Khal-Hasidim	embedding	0.957		True	high	Death is central to the story: the Besht describes souls of the dead (נשמות מתים) arriving in the thousands during prayer, conversing with each to determine why they were excluded from their heavenly place, performing rectifications and elevating them — and R. Gershon faints when he witnesses the dead arriving like a great flock.	"ל בעדו ומעלהו והחשוב חשוב קודם והם רבים ג""כ שאם רצותי להעלות כולם הייתי צריך לעמוד ש״ע שלש שנים אך כשאני שומע הכרוז שמכריז מקודש מקודש וא""א עוד להעלות הנשמות אני פוסע מן הש""ע. ואמר אליו רבי גרשון בדרך שחוק למה אין באים א"
times:death	https://www.hasidic-stories.org/Story/Sipurei-Zadikim/Sipurei-Zadikim_0006	Sipurei-Zadikim_0006	Sipurei-Zadikim	embedding	0.957		False	high	The story depicts a falling-out between Rabbi Leib and his adopted ward over mockery of other rabbis, with no death, dying, or mortal event occurring in the narrative.	". אבל מחמת כי הוא נתגדל אצל רבם כבנו שתקו ממנו ולא אמר לו דבר : ויהי כי נתיחמה לבב האיש הנ""ל ויכנוס להר״ר ר׳ ליב ויאמר לו אבי השמעת כי ברוך ו אפרים מתכנים עצמם בשם הגדול רבי ומפרסמים ומפרסים שמם בעולם ולא ענהו הרב דבר. א"
times:death	https://www.hasidic-stories.org/Story/Khal-Hasidim/Khal-Hasidim_0099	Khal-Hasidim_0099	Khal-Hasidim	embedding	0.957		False	high	The story depicts a rabbinic assembly testing the Besht's ruach ha-kodesh through a halakhic question and a scene at an inn revealing hidden sins — death is neither depicted nor referenced.	"Khal-Hasidim_0099 תיוגים פ״א בעת אסיפת ד׳ ארצות היה הפרנס הראשון הרב הנגיד המפורסים מ' אברהם אבא הציע הדבר לפני כולם כי הנה נשמע שמע הבעש״ט ולפי הנשמע הוא ע״ה ואיך יכול להיות שיהיה לו רוה""ק כי אין ע""ה חסיד ושלחו מהאסיפה "
times:death	https://www.hasidic-stories.org/Story/Maase-Zadikim/Maase-Zadikim_0016	Maase-Zadikim_0016	maase-zadikim	embedding	0.957		False	high	The story centers on a childless Hasid seeking a blessing for a son and the resolution of competing rabbinic oaths via a heavenly court — death is never depicted or central to the narrative.	קדוש הסבא קדישא כי יתפלל בעדו השם ית' שיושיעהו בפרי בטן והצדיק הנזכר היה מדחה אותו בלך ושוב בכל יום פעם אמר לו כי יעשה סעודת מרעים להחסידים והמה יברכו אותו אולי יעלה בידם וכן עשה ולא הועילו לו מאומה ובכל פעם בואו לרבו הק
times:death	https://www.hasidic-stories.org/Story/Khal-Hasidim/Khal-Hasidim_0082	Khal-Hasidim_0082	Khal-Hasidim	embedding	0.957		True	high	"The story explicitly depicts the martyrdom and killing of Jews (נהרגו, עינוים קשים ומרים, קידוש השם/עקה""ש), with the souls of the martyrs appearing to the Besht and describing their experience of Gehenna and the afterlife."	"ה על מטתה ו הבעש״ט עדיין שוכב על הארץ בפישוט ידים ורגלים ועמד ר' דוד הנ""ל אצל הפתח לראות מה יהי' הסוף ונתיגע לעמוד ולקח ספסל וישב אצל הפתח וכמו חצי לילה שמע שאמר לאשתו תכסה פניך וברגע האיר בחדר והיה מאיר דרך סדקים ואמר ב"
times:death	https://www.hasidic-stories.org/Story/Khal-Hasidim/Khal-Hasidim_0169	Khal-Hasidim_0169	Khal-Hasidim	embedding	0.957		False	high	The story depicts a rebbe severing ties with his adopted son for mocking holy figures, with no death, dying, or mortal themes present.	"ם כבנו שתקו ממנו ולא אמרו לו דבר : ויהי כי נתיחמה לבב האיש הנ""ל ויכנוס להר""ר ר׳ ליב ויאמר לו לי אבי השמעת כי ברוך ואפרים מתכנים עצמם בשם הגדול רבי ומפרסמים שמם בעולם ולא ענהו הרב דבר אולם לעת תפילת ערבית קרא הרב לאיש אחר"
times:death	https://www.hasidic-stories.org/Story/Shivhei-Habesht/Shivhei-Habesht_0161	Shivhei-Habesht_0161	Shivhei-Habesht	embedding	0.957		False	high	"The story depicts an ecstatic/unconscious prayer episode on Rosh Hashanah with no death event; the ע""ה after R' Yakil's name is a conventional honorific, not a depiction of death."	"Shivhei-Habesht_0161 תיוגים* שמעתי מר' יעקיל דק""ק מעזיבוז ע""ה שהי׳ בק""ק הנ""ל ש""ץ דבה""מד ושמו ר' משה והי׳ צדיק נפלא פ""א נתנו תפילה בר""ה בבהמ""ד ואינו יודע אם שחרית או מוסף של יום שני והי׳ בעל תפילה א' שהי' לו זו התפילה ביו"
times:death	https://www.hasidic-stories.org/Story/Shivhei-Habesht/Shivhei-Habesht_0035	Shivhei-Habesht_0035	Shivhei-Habesht	embedding	0.957		True	high	Death is a central and explicit theme: the Besht supernaturally perceives and reports the death of Rabbi Eliezer of Amsterdam, discusses its cause, and the story further describes enemies dying by plague and sword.	"זו רעדה ונחפז ושלח לעורר כל המנין ורא׳ שכולם ת""ל שלימים ושאל אותם שמא א׳ מכם עבר עבירה בסתר ח""ו וסיפר להם החלום ענה צדיק אחד ר׳ אליעזר מ טאמאשפאלי לא ידעתי מאומה כי אם אותו הלילה לפני השינה עיינתי בספר חמדת הימים ועוד סי"
times:death	https://www.hasidic-stories.org/Story/Mifalot-HaZadikim/Mifalot-HaZadikim_0009	Mifalot-HaZadikim_0009	Mifalot-HaZadikim	embedding	0.957		False	medium	The story depicts midnight spiritual intercession to nullify harsh heavenly decrees (dinim) against fellow Jews, with an implicit threat of collective punishment, but death is never explicitly depicted or central — the focus is on the ritual act of sweetening the decree, not on dying or the dead.	Mifalot-HaZadikim_0009 תיוגים פ״א באישון לילה ואפילה בשעה ב׳ אחר חצות לילה בא הרב הצדיק והקדוש הנ״ל עם משמשו לבית מדרשו והעיר לכל האנשים הישיני׳ שם (והם ממקורבי׳ המסתופפי׳ בצלו ויושבי׳ שם בבית מדרשו ללמוד תורת ד׳ ועבודתו
times:death	https://www.hasidic-stories.org/Story/Shivhei-Habesht/Shivhei-Habesht_0056	Shivhei-Habesht_0056	Shivhei-Habesht	embedding	0.957		True	high	Death is a central, explicit element: the Angel of Death (מלאך המוות) physically appears at R' Leibish's bedside, the Besht rebukes and drives him away, and the narrative turns entirely on preventing imminent death.	"Shivhei-Habesht_0056 תיוגים* שמעתי מהרב דקהלתינו שהיה ר׳ ליבש דק""ק מעזיריטש אצל הבעש״ט בימים נוראים וחלה קודם ר""ה ועסק הבעש״ט ברפואתו כל הלילה של ער""ה וגם הלילה של ר""ה ולא ראה סימן מיתה ח""ו כלל וכשהלך לבה״מ בעת התפילה נת"
times:death	https://www.hasidic-stories.org/Story/Mifalot-HaZadikim/Mifalot-HaZadikim_0045	Mifalot-HaZadikim_0045	Mifalot-HaZadikim	embedding	0.956		False	high	The story depicts a scholar's visit to Rabbi Elimelech of Lizhensk and a lesson about humility; no death, dying, or mortal event appears anywhere in the narrative.	רב ר׳ אלימלך ונתן שלום לחותנו הכפרי הנ״ל ולחתנו לא נתן לו שלום ופנה עורף כנגדו רק שאל לו תיכף בזה״ל אברך (בל״א יונגר מאן) מה יאמר ד׳ ונזדעזע החתן הנ״ל ברוב פחד ובהלה. ותסמר שערת בשרו כי לא ידע מה להשיב לו וגם לא הבין פי׳
times:death	https://www.hasidic-stories.org/Story/Khal-Hasidim/Khal-Hasidim_0050	Khal-Hasidim_0050	Khal-Hasidim	embedding	0.956		True	high	The story explicitly depicts the woman knocking on her deceased husband's grave and addressing him, and she speaks of the afterlife ('עלמא דקשוט') versus this world, making death a direct and substantive narrative element.	"זעקסער א׳ ולא דיברה מאומה רק שעשתה תנועות כאילו אינה רוצה לקבלה ונתן לפניה עוד זעקסער ולא קיבלה אמר לה מי שמך לגבאי צדקה ולגנוב מקופת צדקה ולא השיבה כלו' ולא הקפידה ע""ז ולא עשו בה הדברים הלז שום רושם מחמת שהיתה מחזקת במי"
times:death	https://www.hasidic-stories.org/Story/Sipurei-Zadikim/Sipurei-Zadikim_0013	Sipurei-Zadikim_0013	Sipurei-Zadikim	embedding	0.956		True	high	Death is central and recurrent: the rabbi dies giving deathbed instructions, the tailor dies after delivering his own deathbed directive, and both deaths drive the entire plot.	" אצליכם לרב ולמורה כאשר גזר עלי זה הצדיק החייט נ""ע. ויעשו כן ויהי כאשר באו סמוך ל לובלין ויצאו לקראתו לקרתו המון רב ויקבלו אותו בשמחה רבה ובכבוד גדול ויהי ביום השבת אחר הדרשה בסעודה שלישית ויבואו אליו כל אנשים מכובדי העי"
times:death	https://www.hasidic-stories.org/Story/Shivhei-Habesht/Shivhei-Habesht_0060	Shivhei-Habesht_0060	Shivhei-Habesht	embedding	0.956		True	high	The story explicitly depicts the woman visiting and speaking to her deceased husband at his grave, asking him to intercede in the heavenly court for their sons — death is a substantive narrative element, not incidental.	ער א׳ ולא דיברה מאומה רק שעשתה תנועות כאילו אינו רוצה לקבלה ונתן לפניה עוד זעקסער ולא קיבלה אמר לה מי שמך לגבאי צדקה ולגנוב מקופת צדקה ולא השיבה כלום ולא הקפידה ע״ז ולא עשו בה הדברים הלז שום רושם מחמת שהיתה מחזקת במידות 
times:death	https://www.hasidic-stories.org/Story/Khal-Hasidim/Khal-Hasidim_0120	Khal-Hasidim_0120	Khal-Hasidim	embedding	0.956		False	high	The story depicts the Besht removing a spiritual impediment (קטרוג) before Kol Nidre by causing an elderly priest to experience a seminal emission; no death, dying, or deceased persons appear anywhere in the narrative.	"Khal-Hasidim_0120 תיוגים פ""א בע""כ קודם כל נדרי נתאספו כל הקהל לבה""מד ועמד הבעש״ט ולא התחיל להתפלל והי' ניכר ממנו שהוא במבוכה רבה ונתעכבו עד בוש וגעו כל העם בבכיה כי הבינו הכל שלא דבר רק הוא אח״ז הביט הרב מהחלון איך שכומר"
times:death	https://www.hasidic-stories.org/Story/Khal-Hasidim/Khal-Hasidim_0140	Khal-Hasidim_0140	Khal-Hasidim	embedding	0.956		False	high	The story centers on the Maggid's illness and miraculous healing by the Besht, along with a mystical Merkavah experience — no death is depicted or described.	" אותו וגער בו הבעש״ט ואמר אין סוסים שלי אוכלות מצות ונפל עליו זיעה מחמת חולשה ויצא לחוץ וישב על האצטבא שלפני הבית לנוח וראה איש אחד רך בשנים וקרא אותו אליו ואמר לו לי בבקשה ממך לך אל הבעש""ט ואמור למה אינו מקיים הפסוק ואה"
times:death	https://www.hasidic-stories.org/Story/Khal-Hasidim/Khal-Hasidim_0193	Khal-Hasidim_0193	Khal-Hasidim	embedding	0.956		True	high	The story explicitly depicts a man who collapses, is presumed dead, is laid out and eulogized with burial shrouds prepared, and only revives after 24 hours — death (apparent) is a central narrative event.	השתטח על ציון רבינו. ואמר הרר״מ אליו מה חפץ לאיש כמותכם להשתט׳ על קברו האם הכרתם אותו. ויען להם האיש עלי אין תימא מרצוני לנסוע כי הוא החייני וממות הצילני והוציאנו ממעמקי הקליפות. אבל אתם אשר אני רוא׳ אתכם עולי ימים וזה ש
