tag	story_url	story_id	edition	signals	sim	matched_terms	claude_applies	claude_confidence	claude_reasoning	excerpt
times:historical_event	https://www.hasidic-stories.org/Story/Sipurei-Zadikim/Sipurei-Zadikim_0001	Sipurei-Zadikim_0001	Sipurei-Zadikim	embedding	0.954		False	high	The story depicts Rabbi Leib Sarahs' miraculous travels to Vienna and his secret support of hidden tzadikim, but no named or specific historical event (war, decree, pogrom, coronation, etc.) is depicted — the cryptic visit to the Duke is left deliberately vague and serves a spiritual/legendary function, not a historical one.	"יה פורע בזמנו. וכמה מעשיות יודע אני הכותב מזה ואם יגזור הש""י אוציאם כולם לאור ועל כן השערתי כי זאת היה עסקו גם ב בוניטש ): ויהי ביום ערב שבת קודש אחר חצות אחר שהלך הרב למקוה קרא את הנגיד הנ""ל ואמר לו שאלה אחת קטנה אשאל מ"
times:historical_event	https://www.hasidic-stories.org/Story/Shivhei-Habesht/Shivhei-Habesht_0035	Shivhei-Habesht_0035	Shivhei-Habesht	embedding	0.954		True	medium	The story explicitly depicts concrete historical events — the death of R. Eliezer of Amsterdam with named circumstances (humiliation on Simchat Torah), the publication of the Sabbatean book Chemdas Hayamim, and the fate of the rabbi's opponents — even though these events are framed through the Besht's visionary/prophetic perception.	"זו רעדה ונחפז ושלח לעורר כל המנין ורא׳ שכולם ת""ל שלימים ושאל אותם שמא א׳ מכם עבר עבירה בסתר ח""ו וסיפר להם החלום ענה צדיק אחד ר׳ אליעזר מ טאמאשפאלי לא ידעתי מאומה כי אם אותו הלילה לפני השינה עיינתי בספר חמדת הימים ועוד סי"
times:historical_event	https://www.hasidic-stories.org/Story/Khal-Hasidim/Khal-Hasidim_0188	Khal-Hasidim_0188	Khal-Hasidim	embedding	0.954		False	medium	The story depicts a personal religious dispute (מחלוקת) between two Hasidic leaders and incidental events (a fire, a death) arising from it — a named interpersonal conflict, not a broader historical event such as a war, pogrom, expulsion, or political upheaval.	"Khal-Hasidim_0188 תיוגים ויהי כאשר נתעכבה המחלוקות בין הרב ובין הר""ר ברוך ז""ל עד אשר קבע הרב רבי ברוך דירתו בק""ק מעזיבוז והרב נסע אז להשתטח על קבר הבעש״ט הקדוש ז״ל וכאש׳ הגיע השמועה כי הרב לא רחוק הוא מהעיר ירד הר""ר ברוך"
times:historical_event	https://www.hasidic-stories.org/Story/Khal-Hasidim/Khal-Hasidim_0174	Khal-Hasidim_0174	Khal-Hasidim	embedding	0.954		True	high	The story explicitly depicts the historical arrest and imprisonment of Rabbi Shneur Zalman of Liadi by Tsar Paul I (Emperor Pavel) in St. Petersburg — a well-documented event of 1798 — including named actors (Avigdor the informer, the Vilna Gaon), the journey to the Peter and Paul Fortress, and the imperial interrogations.	"ונתרצה לשלוח אחריו סדריוט מיוחד ויצו עליו לאסרו בזיקים ו אביגדור הנ""ל שיחד להסרדיוט הנשלח אחרי הרב כי יקחהו פתאום מביתו ולא יתעכב עמו בשום עיר מעיירות ישראל למען לא יודע הדבר לאנשי שלומיו אבל מה המה תחבולות אנוש ובפרט נב"
times:historical_event	https://www.hasidic-stories.org/Story/Shivhei-Habesht/Shivhei-Habesht_0185	Shivhei-Habesht_0185	Shivhei-Habesht	embedding	0.954		False	high	The story depicts a personal healing miracle performed by the Besht on a sick mitnaged during a Shabbat visit — no historical event (war, decree, pogrom, plague, etc.) is depicted or referenced.	"Shivhei-Habesht_0185 תיוגים* בק""ק אחת היו ג' אחים לומדים מופלגים ויראי ה' שנים מהם היו סרים למשמעתו של הבעש""ט והג' הי' מתנגד נגדו ובכל פעם שהי׳ הבעש״ט בק""ק הנ' הי' אכסניא שלו אצל שני האחים ובכל פעם הי׳ שואל ודורש לשלום א"
times:historical_event	https://www.hasidic-stories.org/Story/Khal-Hasidim/Khal-Hasidim_0056	Khal-Hasidim_0056	Khal-Hasidim	embedding	0.954		False	high	The story depicts a personal spiritual episode involving the Besht and Rabbi Shimshon of Anepolia — a mystical vision and interpersonal exchange — with no historical event (war, pogrom, decree, etc.) depicted or referenced.	"Khal-Hasidim_0056 תיוגים שמעתי מהרב דקהלתינו ש הבעש״ט לא רצה להיות בק""ק אנעפאליע כי אמר אין לי שום עסק כי כבר תיקן שם הר' שמשון דק""ק הנ""ל כל מה שהיה צריך. פ""א שבת בק""ק הנ""ל ר' גרשון גיסו ובא משם ואמר ל הבעש״ט השגתי שם או"
times:historical_event	https://www.hasidic-stories.org/Story/Khal-Hasidim/Khal-Hasidim_0009	Khal-Hasidim_0009	Khal-Hasidim	embedding	0.954		False	high	The story is a hagiographic account of the Besht's early ascetic life and spiritual revelation, containing no reference to any named or datable historical event (war, pogrom, decree, epidemic, etc.).	"עדיין רך בשנים אמרה לו אתה סבור שאני מפחד ממך לא כי אני ידעתי שהזהירו אותך מן השמים שלא לעסוק בשמות הקדושים עד שישתלמו לך שלש ושלשים שנה והוא היה נחב׳ אל הכלים והאנשים הנ""ל שאלו אותה מה אתה אומרת והיא כפלה בדבריה לפניהם "
times:birth	https://www.hasidic-stories.org/Story/Mifalot-HaZadikim/Mifalot-HaZadikim_0026	Mifalot-HaZadikim_0026	Mifalot-HaZadikim	embedding	0.962		False	high	The story deals entirely with discipleship, hidden tzaddikim, and spiritual succession after death — no birth event or imagery appears anywhere in the text.	וא נסתר ובאתי לפניו ואמרתי לו רבי למדיני אורחות חיים וכששמע זאת אז מילא פיו בצחוק והיתול ואמר להעומדים עליו השמעתם איש שוטה הזה קורא לי רבי ורוצה להיות בחברתינו הצריכים אנחנו לשוטים כאלו אז ענו כולם בצחוק והיתול ובאמת לא
times:birth	https://www.hasidic-stories.org/Story/Shivhei-Habesht/Shivhei-Habesht_0193	Shivhei-Habesht_0193	Shivhei-Habesht	embedding	0.961		False	high	The story concerns a man who struck his father, received a repentance regimen from the Besht, abandoned it at his mother's urging, and died before the year ended — no birth event appears anywhere in the narrative.	"Shivhei-Habesht_0193 תיוגים* פ""א הי' הבעש״ט באיזה קהילה והי׳ אכסניאותו על העלי' : פעם א׳ ראה איש א׳ עובר על הרחוב מיד צוה להמשרת שלו רוץ מהר וקרא לי את האיש הזה וירץ הנער ויקרא לו ומתחילה נתפעם לבו ולא רצה לילך ועכ״ז לא "
times:birth	https://www.hasidic-stories.org/Story/Khal-Hasidim/Khal-Hasidim_0120	Khal-Hasidim_0120	Khal-Hasidim	embedding	0.96		False	high	"The story depicts the Besht resolving a heavenly accusation before Kol Nidre by provoking a seminal emission in an old priest; procreation (פו""ר) is mentioned only as a rhetorical argument, and no birth event occurs."	"Khal-Hasidim_0120 תיוגים פ""א בע""כ קודם כל נדרי נתאספו כל הקהל לבה""מד ועמד הבעש״ט ולא התחיל להתפלל והי' ניכר ממנו שהוא במבוכה רבה ונתעכבו עד בוש וגעו כל העם בבכיה כי הבינו הכל שלא דבר רק הוא אח״ז הביט הרב מהחלון איך שכומר"
times:birth	https://www.hasidic-stories.org/Story/Khal-Hasidim/Khal-Hasidim_0202	Khal-Hasidim_0202	Khal-Hasidim	embedding	0.96		True	high	The birth of a male child is the central resolution of the entire story: Rabbi Pinchas swears the Hasid's wife will bear a son that year, and the narrative confirms this came to pass ('וכן היה כי בשנה ההיא היה לו בן זכר').	 הקדוש הסבא קדישא כי יתפלל בעדו להשם ית' שיושיעהו בפרי בטן והצדיק הנזכר היה מדחה אותו בלך ושוב בכל יום פעם אמר לו כ כי יעשה סעודת מרעים להחסידים והמה יברכו אותו אולי יעלה בידם וכן עשה ולא הועילו לו מאומה ובכל פעם בואו לר
times:birth	https://www.hasidic-stories.org/Story/Mifalot-HaZadikim/Mifalot-HaZadikim_0027	Mifalot-HaZadikim_0027	Mifalot-HaZadikim	embedding	0.96		False	high	The story depicts the Baal Shem Tov and disciples getting lost, enduring a degrading Shabbat with a boorish host, and receiving a divine verdict related to mistreating an orphaned servant girl — no birth event appears anywhere in the narrative.	 להרוג אותם הוא רוצה והנה בתוך כך נפתחה דלת אחת מן החדרים המוסגרים החרבים ויצא משם אשם אחת עשירה ומקושטת ויגש לפני רום פני הבעש״ט זי״ע ואמר לו רבי אני מבקש מכם לשבות אצלי בשבת קודש ענה הבעש״ט ואמר שתי פליאות לי אחת האיך 
times:birth	https://www.hasidic-stories.org/Story/Shivhei-Habesht/Shivhei-Habesht_0002	Shivhei-Habesht_0002	Shivhei-Habesht	embedding	0.96		False	high	The story contains no depiction of a birth event; it focuses on magical feats, the transmission of kabbalistic manuscripts from Rabbi Adam to the Besht, the Besht's marriage, and his ascetic seclusion in the mountains.	"ץ ממון. וישב לו הנה אבי המנוח ז""ל הי' צדיק מפורסם וצוה עלו לפני הסתלקותו לישא אשה פה ק""ק אקום . ומוכרח אני לקיים כל דבריו. ומיד ותהום כל העיר שהיו לפניו כמה שידוכים ונשתדך עם נגיד א׳, כי נשא חן בעיני כל רואיו. ויהי אחרי "
times:birth	https://www.hasidic-stories.org/Story/Khal-Hasidim/Khal-Hasidim_0004	Khal-Hasidim_0004	Khal-Hasidim	embedding	0.96		False	high	The story describes the Besht's pre-revelation life, a stranded traveler's Shabbat encounter, and the Besht's public emergence — no birth event appears anywhere in the narrative.	"י לפלא בעיניו ויהי בבוקר וילך לבית התבודדות להתפלל שם כדרכו ובבואו לביתו בא שמח וטוב לב בנשיאת ראש והלך בביתו אנה ואנה לומר אסדר לסעודתא ועשה קדושא רבא כדרכו בדביקות נפלא ובתוך הסעודה ביקש את האורח שיאמר ד""ת. ולא היה יוד"
times:birth	https://www.hasidic-stories.org/Story/Khal-Hasidim/Khal-Hasidim_0002	Khal-Hasidim_0002	Khal-Hasidim	embedding	0.96		False	high	The story contains no depiction of a birth event; the single passing reference to 'זרעא מעליא' (noble offspring) is merely a hope expressed about the prospective marriage, not an actual birth scene.	"ו והודיעו הדבר לק""ק בראד לבנו הרב הגדול והק׳ מו""ה גרשון קיטעבר ויבא אל אביו להספידו כד״ת וקיבל כל הכתבים שמצא ת״י ובתוך כך מצא התנאים איך ששידך את בתו שהוא אחותו של הרב מוהר""ג עם איזה איש ששמו ישראל ויהי לפלא בעיניו כי א"
times:birth	https://www.hasidic-stories.org/Story/Khal-Hasidim/Khal-Hasidim_0111	Khal-Hasidim_0111	Khal-Hasidim	embedding	0.96		False	high	The story centers on a man who struck his father and was given a penance by the Baal Shem Tov; birth is not depicted or mentioned.	"Khal-Hasidim_0111 תיוגים פ""א היה הבעש""ט באיזה קהילה והי' אכסניתו על העלי' פעם א' ראה איש א' עובר על הרחוב מיד צוה להמשרת שלו רוץ מהר וקרא לי את האיש הזה וירץ הנער ויקרא לו ומתחילה נתפעם לבו ולא רצה לילך ועכ""ז לא יכול להע"
times:birth	https://www.hasidic-stories.org/Story/Khal-Hasidim/Khal-Hasidim_0017	Khal-Hasidim_0017	Khal-Hasidim	embedding	0.959		False	high	The story deals with reincarnation (gilgul), poverty, and the Baal Shem Tov's spiritual guidance — birth is not depicted or thematically present.	"ספרו לו גנות ורעות האיש אשר שואל עליו כי היה רשע שאין דומה לו ר""ל : וישא הת""ח ההוא את רגליו וישב לביתו בפחי נפש בלי שום תשוע' כי אם ברפיון כח מרוב הדרך והיגונות אשר מצאתהו עדי בואו לביתו העיר הגדולה אשר שם היה הבעש""ט זלל"
times:birth	https://www.hasidic-stories.org/Story/Mifalot-HaZadikim/Mifalot-HaZadikim_0006	Mifalot-HaZadikim_0006	Mifalot-HaZadikim	embedding	0.959		True	high	The story explicitly depicts a miraculous birth — an elderly woman (age 90) conceives and bears a son ('ותהר אשתו ותלד לו בן זכר') after the narrator blesses the innkeeper, and the birth celebrations (circumcision feast, naming) are described in detail as a central narrative event.	ך בשום פעם שברון לב לכן לא היה ביכולתי לעשות לך שום טובה ועתה כי נשבר לבך בקרבך אגלה לך סתרי וסודי התורה בפרד״ס ולימד לו בפעם הזאת כל התורה נגלה ונסתר. ויגבה לבו בהתנשאות מוחו בדרכי ד׳ רק התנה עמו שלא יגלה הדבר לשום ב״א 
times:birth	https://www.hasidic-stories.org/Story/Adat-Zadikim/Adat-Zadikim_0023	Adat-Zadikim_0023	Adat-Zadikim	embedding	0.959		False	high	The story depicts a secret marriage, communal intrigue, and a revelation involving Elijah the Prophet, but contains no depiction of or reference to birth.	"פחתיך ואתה יקר בעיני מעשרה בנים ומה אתה חסר עמדי על כן תניח מלדבר דברים כאלו ולעגם את נפשי כי כל ימי חיי לא אניחך להפרד מאתי ויבך גם הר""ח ויחשה ולא ענהו מאומה. ובמשך זמן מועט אמר לו אדוני חבירי אל נא תרבה תדבר אלי עוד בד"
times:birth	https://www.hasidic-stories.org/Story/Khal-Hasidim/Khal-Hasidim_0102	Khal-Hasidim_0102	Khal-Hasidim	embedding	0.959		True	high	The birth of a son to a previously childless man is a central plot element: the Besht explicitly promises 'תלד אשתך בן זכר' and the wife indeed gives birth ('ילדה אשתו בן זכר'), driving the entire narrative.	"ימים שלח השר בעצמו אחריו ונתן לו האורנדע כדבר הבעש״ט והי' סבור אולי השר נצרך כהיום למעות מאד והציקתו לעבור ע""ד ובתוך שנה ילדה אשתו ב""ז אבל לא עלה ע""ד להודיע ל הבעש״ט כי אמר מקרה הוא ויגדל הילד הלוך וגדול ונעשה פרא אדם ממ"
times:birth	https://www.hasidic-stories.org/Story/Khal-Hasidim/Khal-Hasidim_0253	Khal-Hasidim_0253	Khal-Hasidim	embedding	0.959		False	high	The story concerns secret marriage, humility, and Elijah the Prophet's visits — birth is neither depicted nor a meaningful theme; the phrase 'לא מאבן נולדתי' is merely a figure of speech meaning 'I am not heartless.'	"לחה עשירית מזה כי תוכל ליקח את הרב הגדול ר""ח לחתן לך כי כן וכן הגיד לי ואנכי ידעתי כי יש לך בת בתולה הגונה וגם בית מיוחדת בחצר אך ספרים שאין לך לכ ע""כ ראה מה תעשה והזהר לא לגלות הדבר והי' זריז בזה כי יבא יום אשר יבא רבינ"
times:birth	https://www.hasidic-stories.org/Story/Shivhei-Habesht/Shivhei-Habesht_0014	Shivhei-Habesht_0014	Shivhei-Habesht	embedding	0.958		False	high	The story concerns a merchant's missing adult son and the Besht's clairvoyant knowledge of his whereabouts; no birth event is depicted or referenced.	"Shivhei-Habesht_0014 תיוגים* בק""ק הנ""ל הי' סוחר א' גדול והוא הי' מאותן אנשים שהיו עדיין נגד הבעש״ט והי׳ להסוחר הנ""ל בן יחיד חכם ומופלג בלמוד ובשארי מעלות, פ""א נסע הבן יחיד לברעסל' אחר סחורה ודרכו היה להתעכב לתעכב בנסיע׳ "
times:birth	https://www.hasidic-stories.org/Story/Shivhei-Habesht/Shivhei-Habesht_0135	Shivhei-Habesht_0135	Shivhei-Habesht	embedding	0.958		False	high	A brit milah is mentioned only as a travel destination ('נסע על ברית לכפר'), but no birth is depicted or narratively present in the story, whose focus is entirely on the Shabbat journey, the Torah debate, and the Besht's rebuke of R. Mikhel.	"וף השולחן וגער בו הבעש״ט בזה""ל אני שונא ענוותן בא ושב בכאן והתחיל הרב להחזיר הדרשה ורבי מיכל מקשה ורבי זאב מפלפל עמו עד שנצחו והיה רבי מיכל בוש בדבר ועמד על זה אע""פ שהי׳ עקום ולא רצה להודות על האמת התחיל הבעש״ט לבקש ואמ׳"
times:birth	https://www.hasidic-stories.org/Story/Shivhei-Habesht/Shivhei-Habesht_0096A	Shivhei-Habesht_0096A	Shivhei-Habesht	embedding	0.958		False	high	The story depicts a preacher's journey, sermons, and interactions with the Besht; the sole near-birth reference — 'ישראל בן המילדת' (Israel son of the midwife) — is a brief prophetic identification formula, not a depiction of a birth event.	ה וראיתי הבעש״ט ואמר תניחו את תלמידי לדרוש בבה״כ הגדול ואמר שהיה דודו גדול הדור וכמדומה לי ששמו רבי אברהם דעם רבית כי שכחתי שמו ואני הייתי אצלו בשעת מיתתו ושמעתי שציוה לבנו ואמר יעמוד איש ויקרא שמו ישראל בן המילדת תדע שה
times:birth	https://www.hasidic-stories.org/Story/Maase-Zadikim/Maase-Zadikim_0016	Maase-Zadikim_0016	maase-zadikim	embedding	0.958		True	high	The birth of a son (בן זכר) is the central outcome of the entire narrative — the childless follower's plea, the Shpoler Zeyde's oath, Rabbi Pinchas's counter-oath, and the heavenly court's verdict all culminate in the explicit statement that the man's wife bore him a son that year.	קדוש הסבא קדישא כי יתפלל בעדו השם ית' שיושיעהו בפרי בטן והצדיק הנזכר היה מדחה אותו בלך ושוב בכל יום פעם אמר לו כי יעשה סעודת מרעים להחסידים והמה יברכו אותו אולי יעלה בידם וכן עשה ולא הועילו לו מאומה ובכל פעם בואו לרבו הק
times:birth	https://www.hasidic-stories.org/Story/Khal-Hasidim/Khal-Hasidim_0009	Khal-Hasidim_0009	Khal-Hasidim	embedding	0.958		False	high	The story describes the Besht's early ascetic life, his concealment, and his gradual public revelation — including a reference to him reaching age 36 — but no birth event is depicted or mentioned.	"עדיין רך בשנים אמרה לו אתה סבור שאני מפחד ממך לא כי אני ידעתי שהזהירו אותך מן השמים שלא לעסוק בשמות הקדושים עד שישתלמו לך שלש ושלשים שנה והוא היה נחב׳ אל הכלים והאנשים הנ""ל שאלו אותה מה אתה אומרת והיא כפלה בדבריה לפניהם "
times:birth	https://www.hasidic-stories.org/Story/Shivhei-Habesht/Shivhei-Habesht_0199	Shivhei-Habesht_0199	Shivhei-Habesht	embedding	0.958		False	high	"The story concerns a Yom Kippur spiritual accusation (קטרוג) and the Besht's intervention via an old priest; procreation (פו""ר) is mentioned only as a rhetorical argument in passing, not as an actual depicted event."	"Shivhei-Habesht_0199 תיוגים* פ""א בעי״כ קודם כל נדרי נתאספו כל הקהל לבמ""ד 199 ועמד שבחי הבעש״ט לה ועמד הבעש״ט ולא התחיל להתפלל והי' ניכר ממנו שהוא במבוכה רבה ונתעכבו עד בוש וגעו כל העם בבכי' כי הבינו הכל שלא דבר רק הוא אח"
times:birth	https://www.hasidic-stories.org/Story/Shivhei-Harav/Shivhei-Harav_0016	Shivhei-Harav_0016	Shivhei-Harav	embedding	0.957		False	high	The story depicts the miraculous rescue of a Jewish boy from forced conversion, with no birth event depicted or referenced.	"Shivhei-Harav_0016 ,תיוגים עתה נספר אשר סיפר הרב בעצמו ביום י""ט כסליו שהיה דרכו תמיד לעשות סעודה בליל י""ט והיה שמח ומשמח והיה אומר תורה הרבה אך פעם א׳ נשתהה לבוא והמתינו עליו כל החסידי' עד שעה ג׳ אחר חצות לילה וכאשר בא ר"
times:birth	https://www.hasidic-stories.org/Story/Mifalot-HaZadikim/Mifalot-HaZadikim_0021	Mifalot-HaZadikim_0021	Mifalot-HaZadikim	embedding	0.957		False	high	The story concerns self-sacrifice (mesirat nefesh) and public humiliation as spiritual protection — birth is neither depicted nor mentioned.	ררותו בתשובה נכונה ויעזוב את העגלות עם היי״ג הנ״ל ביד ערלים הנ״ל המובילים אותו וינס ויצא לרבו הנ״ל מ מעזיבוז . והגם שהיה דבר זה סכנה שיפסוד ח״ו כל היין הן אפשר שיכחישו לו הערלים ויאמרו להד״ם או לפחות יפסיד אותו מחמת ניסו
times:birth	https://www.hasidic-stories.org/Story/Mifalot-HaZadikim/Mifalot-HaZadikim_0007	Mifalot-HaZadikim_0007	Mifalot-HaZadikim	embedding	0.957		False	high	The story concerns a ritual slaughterer seeking certification and two rabbis debating the kashrut of his slaughtering — birth is neither depicted nor mentioned.	 זמן מה עד שתוכל לאמן ידך בלטישות הסכין היטב היטב. כי לפי דעתי עדיין לא הורגלת בזה כמצטרך ולא עלתה עדיין לימודך כראוי וכאשר שמע השו״ב הנ״ל מדברי הרב ר׳ יהושע תומ״י ציית לדבריו ונסע עוד הפעם להשוחט הנ״ל ללמוד א״ע היטב ללט
times:birth	https://www.hasidic-stories.org/Story/Shivhei-Habesht/Shivhei-Habesht_0005B	Shivhei-Habesht_0005B	Shivhei-Habesht	embedding	0.957		False	high	The story depicts the Besht's hidden period, his exorcism of a dybbuk, prayer for rain, and self-revelation at age 36 — no birth event is mentioned or depicted.	"כא""וא כפי מעלתו ו הבעש״ט נכנס באחרונה וכשראתה אותו ואמרה ב""ה ר׳ ישראל כ' עדיין רך בשנים אמרה לו אתה סבור שאני מפחד ממך לא כי אני ידעתי שהזהירו אותך מן השמי' שלא לעסוק בשמות הקדושים עד שישתלמו לך ששה ושלשים שנה והוא הי׳ נ"
times:birth	https://www.hasidic-stories.org/Story/Shivhei-Habesht/Shivhei-Habesht_0197	Shivhei-Habesht_0197	Shivhei-Habesht	embedding	0.957		False	high	The story concerns a preacher seeking to learn the mystical language of animals from the Besht, who teaches and then erases the knowledge; no birth event appears anywhere in the narrative.	"Shivhei-Habesht_0197 תיוגים* מעשה הי' שהרב המוכיח מוה' ארי׳ ליב מפולנאה חשקה נפשו מאוד ללמוד חכמת שיחת בהמות ועופות ושיחת דקלים מצד שנצרך לו זה לתוכחה ומאחר שהיה כוונתו לש""ש נגמר בדעתו ליסע ל הבעש״ט ולבקש ממנו שילמד אותו"
times:birth	https://www.hasidic-stories.org/Story/Shivhei-Habesht/Shivhei-Habesht_0160	Shivhei-Habesht_0160	Shivhei-Habesht	embedding	0.957		False	high	The story concerns a rabbinical dispute, intercession with a nobleman, and a secret minyan convened to nullify legal decrees — birth is neither depicted nor mentioned.	"Shivhei-Habesht_0160 תיוגים* מעשה שהיה אב""ד בק""ק באר ואחד מבני העיר חלק עליו ונסע אל השר להקביל עליו ואינו ידוע לי לו אם מעסק הרבנות או מעסק אחר והטה מן הדרך אל הבעש״ט שיתפלל בעדו שיפיק רצונו מן השר והבטיח לו הבעש״ט ונסע"
times:birth	https://www.hasidic-stories.org/Story/Shivhei-Habesht/Shivhei-Habesht_0138	Shivhei-Habesht_0138	Shivhei-Habesht	embedding	0.957		False	high	The story recounts a travel episode with the Besht involving money, charity, and healing — no birth event appears anywhere in the narrative.	"ט נסע לדרכו ובאו וכשראו ששהה נסיעתם אמרו אנחנו נלך לבהמ""ד וכשיהי' מוכן לנסוע יתן לנו ר' מאיר ידיעה ונבוא וכן הי' שהודיע להם ובאו ונתן הנגיד ל הבעש״ט בפעם ראשונה א׳ אד""ז וכשבאו וכשבאי פ""ש לקח הבעש״ט אותו א""ז ונתן להנגיד ה"
