tag	story_url	story_id	edition	signals	sim	matched_terms	claude_applies	claude_confidence	claude_reasoning	excerpt
times:holidays	https://www.hasidic-stories.org/Story/Mifalot-HaZadikim/Mifalot-HaZadikim_0009	Mifalot-HaZadikim_0009	Mifalot-HaZadikim	embedding	0.958		False	high	The story takes place at an ordinary midnight hour with no mention of any holiday, festival, or Shabbat — the nocturnal gathering is prompted by a spiritual emergency (heavenly accusation against Israel), not a calendrical occasion.	Mifalot-HaZadikim_0009 תיוגים פ״א באישון לילה ואפילה בשעה ב׳ אחר חצות לילה בא הרב הצדיק והקדוש הנ״ל עם משמשו לבית מדרשו והעיר לכל האנשים הישיני׳ שם (והם ממקורבי׳ המסתופפי׳ בצלו ויושבי׳ שם בבית מדרשו ללמוד תורת ד׳ ועבודתו
times:holidays	https://www.hasidic-stories.org/Story/Shivhei-Habesht/Shivhei-Habesht_0207	Shivhei-Habesht_0207	Shivhei-Habesht	embedding	0.958		True	high	Holidays are central to the narrative: the Besht's death occurs on the first day of Shavuot (explicitly stated), Passover events (erev Yom Tov, 7th day) are depicted as leading up to it, and the Shavuot night vigil (tikkun) is described in detail.	"סגולתו לנעור כל הלילה כתקון האר""י ז""ל ואמר לפניהם ד״ת על ענין הסדר וענין מ״ת בבקר שלח לאנשי סגולתו שיתאספו כולם וצוה לר׳ ליב קעסלר ועוד א׳ שכחתי שמו שיתעסקו בקבורתו ולימד ולמד אותם על גופו על כל אבר הראה להם סימנים איך נ"
times:holidays	https://www.hasidic-stories.org/Story/Shivhei-Habesht/Shivhei-Habesht_0135	Shivhei-Habesht_0135	Shivhei-Habesht	embedding	0.958		True	medium	Shabbat is central to the story — the Besht weeps over potential Shabbat desecration, the rabbi preaches on Shabbat, and the third Shabbat meal (סעודה שלישית) is the scene of the main dispute — though Shabbat is a weekly observance rather than a festival holiday, making the fit dependent on whether the taxonomy includes Shabbat under 'times:holidays'.	"וף השולחן וגער בו הבעש״ט בזה""ל אני שונא ענוותן בא ושב בכאן והתחיל הרב להחזיר הדרשה ורבי מיכל מקשה ורבי זאב מפלפל עמו עד שנצחו והיה רבי מיכל בוש בדבר ועמד על זה אע""פ שהי׳ עקום ולא רצה להודות על האמת התחיל הבעש״ט לבקש ואמ׳"
times:holidays	https://www.hasidic-stories.org/Story/Shivhei-Habesht/Shivhei-Habesht_0060	Shivhei-Habesht_0060	Shivhei-Habesht	embedding	0.958		False	high	Shabbat is mentioned only as incidental background context (the sons arrive on Thursday to spend Shabbat, but are sent away before it begins); the story's focus is entirely on the Besht's encounter with the pious woman and her virtuous qualities, not on any holiday.	ער א׳ ולא דיברה מאומה רק שעשתה תנועות כאילו אינו רוצה לקבלה ונתן לפניה עוד זעקסער ולא קיבלה אמר לה מי שמך לגבאי צדקה ולגנוב מקופת צדקה ולא השיבה כלום ולא הקפידה ע״ז ולא עשו בה הדברים הלז שום רושם מחמת שהיתה מחזקת במידות 
times:holidays	https://www.hasidic-stories.org/Story/Shivhei-Habesht/Shivhei-Habesht_0096A	Shivhei-Habesht_0096A	Shivhei-Habesht	embedding	0.958		False	high	The story centers on a preacher's journey to Hamburg and his relationship with the Besht; while Shabbat is briefly mentioned (white Shabbat clothes, Havdalah, 'Shalom Aleichem'), no Jewish holiday (yom tov) is depicted or plays any role in the narrative.	ה וראיתי הבעש״ט ואמר תניחו את תלמידי לדרוש בבה״כ הגדול ואמר שהיה דודו גדול הדור וכמדומה לי ששמו רבי אברהם דעם רבית כי שכחתי שמו ואני הייתי אצלו בשעת מיתתו ושמעתי שציוה לבנו ואמר יעמוד איש ויקרא שמו ישראל בן המילדת תדע שה
times:holidays	https://www.hasidic-stories.org/Story/Khal-Hasidim/Khal-Hasidim_0032	Khal-Hasidim_0032	Khal-Hasidim	embedding	0.958		False	high	The story takes place on Shabbat (erev Shabbat arrivals, morning prayer, Mussaf, Shalosh Seudos), but no Jewish holiday (Yom Tov) is mentioned or depicted.	"Khal-Hasidim_0032 תיוגים שמעתי מ הרב הגאון הקדוש המפורסם דק""ק פולנאי שהיה אב""ד בק""ק שאריגאד ששמע ש הבעש״ט בא לק""ק מאהליב אמר בלבו אסע גם אני כי לא הי׳ עדיין חסיד ונסע ובא בעש""ק אליו קודם תפלות בוקר וראה ש הבעש״ט עשן לולק"
times:holidays	https://www.hasidic-stories.org/Story/Shivhei-Habesht/Shivhei-Habesht_0034	Shivhei-Habesht_0034	Shivhei-Habesht	embedding	0.957		False	high	The story centers on the Maggid's illness and his spiritual encounter with the Besht; the passing mention of 'Shabbat to Shabbat' visits and the incidental matzot remark are circumstantial references, not depictions of a holiday.	"Shivhei-Habesht_0034 תיוגים* שמעתי מהרב דק""ק דראזניץ שהיה אב""ד בק""ק פאוולויץ המעשה איך נתקרב הרב המגיד הגדול ל הבעש״ט המגיד צום ז' או ח' פעמים משבת לשבת רצופים, וחלה מאוד פ""א בא ר' מענדל מק""ק באר לק' טארטשין ונתאכסן אצל "
times:holidays	https://www.hasidic-stories.org/Story/Khal-Hasidim/Khal-Hasidim_0128	Khal-Hasidim_0128	Khal-Hasidim	embedding	0.957		True	high	The story is explicitly and extensively set across the holidays of Passover (פסח) and Shavuot (שבועות) — including erev Yom Tov, the 7th day of Passover, the night of Shavuot with the Lurianic Tikun, and the Besht's death on the first day of Shavuot — making holidays central to the narrative's entire temporal framework.	"Khal-Hasidim_0128 תיוגים עתה נכתוב קצת מפטירתו שהיה הסתלקותו ביום א׳ דשבועות בפסח שקודם זה הי' הרה""ק מו' פנחס מ קאריץ אצל הבעש״ט ונחלש מעט ומפני זה בעי״ט האחרון של פסח היה כשקל' וטריא אצלו אם לילך למקוה או לא והסכימה דעת"
times:holidays	https://www.hasidic-stories.org/Story/Khal-Hasidim/Khal-Hasidim_0111	Khal-Hasidim_0111	Khal-Hasidim	embedding	0.957		False	high	The story depicts the Besht in a community confronting a man who struck his father and prescribing repentance, with no mention of any holiday or festival.	"Khal-Hasidim_0111 תיוגים פ""א היה הבעש""ט באיזה קהילה והי' אכסניתו על העלי' פעם א' ראה איש א' עובר על הרחוב מיד צוה להמשרת שלו רוץ מהר וקרא לי את האיש הזה וירץ הנער ויקרא לו ומתחילה נתפעם לבו ולא רצה לילך ועכ""ז לא יכול להע"
times:holidays	https://www.hasidic-stories.org/Story/Khal-Hasidim/Khal-Hasidim_0050	Khal-Hasidim_0050	Khal-Hasidim	embedding	0.957		True	medium	Shabbat is an explicit and plot-relevant element — the sons travel specifically to spend Shabbat with their mother (כיבוד אם), the Friday eve meal is set, and the mother's request that they leave before Shabbat drives the climax — but whether Shabbat qualifies as 'holidays' versus a separate 'times:shabbat' category depends on the taxonomy's scope.	"זעקסער א׳ ולא דיברה מאומה רק שעשתה תנועות כאילו אינה רוצה לקבלה ונתן לפניה עוד זעקסער ולא קיבלה אמר לה מי שמך לגבאי צדקה ולגנוב מקופת צדקה ולא השיבה כלו' ולא הקפידה ע""ז ולא עשו בה הדברים הלז שום רושם מחמת שהיתה מחזקת במי"
times:holidays	https://www.hasidic-stories.org/Story/Khal-Hasidim/Khal-Hasidim_0002	Khal-Hasidim_0002	Khal-Hasidim	embedding	0.957		False	high	The story's Shabbat references ('הפסקה משבת לשבת', 'מוצאי ש״ק') are incidental time markers for a fasting/mystical ritual, not depictions of holiday observance or celebration.	"בן הרב אמרו שבודאי זכות אביו גרמה לו שיבא בן הרב לכאן ויקרבהו כי נראה להם שכהיום הוא הולך בדרך טובים ויתנו לו אשה אבל לא ארכו לה הימים ומתה אשתו הנ״ל. וכאשר נכנסו לבית התבודדותם שם למדו כל הצורך בגפ""ת ופוסקים וגם כל כתבי"
times:holidays	https://www.hasidic-stories.org/Story/Khal-Hasidim/Khal-Hasidim_0086	Khal-Hasidim_0086	Khal-Hasidim	embedding	0.957		True	medium	The story explicitly depicts a Shabbat scene — the Besht delivers a Torah teaching at Seudah Shlishit (the third Shabbat meal) — making Shabbat an actual narrative setting, though it is not the story's central theme.	"Khal-Hasidim_0086 תיוגים מעשה כשבא הבעש״ט לק""ק מעזיבוז לא היה חשוב בעיני החסידים היינו הרה""ק ר' זאב קיצעס והרה""ק ר' דוד פורקעס מחמת השם שקראו אותו בעש״ט כי שם זה אינו נאה לצדיק והיה להם תלמיד הגון וחלה והוא והיא היה איש "
times:holidays	https://www.hasidic-stories.org/Story/Maase-Zadikim/Maase-Zadikim_0018	Maase-Zadikim_0018	maase-zadikim	embedding	0.957		False	high	The story contains no reference to any holiday — it centers on an innkeeper's trust in God (bitachon) and his 'partnership' with the Divine, with no holiday setting or occasion mentioned.	דאר על מעשהו מאין לו כח הזה לפעול ישועות. ויכחד הרינדאר ויאמר לא ידעתי דבר וכו' אז הודיעו הרה״ק כי הוא הרב מ אפטא וכי הוא גוזר עליו לגלות א״ע ויען הרינדאר ויאמר מצוה לשמוע דברי חכמים והנני לגלות אזניך ולספר לך כי אך מגוד
times:holidays	https://www.hasidic-stories.org/Story/Khal-Hasidim/Khal-Hasidim_0174	Khal-Hasidim_0174	Khal-Hasidim	embedding	0.957		False	high	The story focuses on the political conflict between Hasidim and the Vilna Gaon and Rabbi Shneur Zalman's arrest and imprisonment; Shabbat is mentioned only incidentally (dancing on Friday night, travel forced on Shabbat), and no holiday is depicted or central to the narrative.	"רי : פעם אחד בא אליו הר""ש הנ""ל בחג השבועות וירא והנה קאחיל אחת מהתנור רועדת וגם הכסא אשר ישב עליה הרב רועדת וישאל הר""ש את הרב מה זאת ויאמר לו הרב כי היום היה אצלי הבעש״ט הקדוש ומורי הרב המגיד הק' ואנכי לא הכרתי את הבעש״ט"
times:holidays	https://www.hasidic-stories.org/Story/Shivhei-Habesht/Shivhei-Habesht_0160	Shivhei-Habesht_0160	Shivhei-Habesht	embedding	0.957		False	high	"Rosh Chodesh is mentioned only once as an uncertain incidental time marker ('כמדומה לי שר""ח היה'), not as a holiday being depicted or celebrated in the story."	"Shivhei-Habesht_0160 תיוגים* מעשה שהיה אב""ד בק""ק באר ואחד מבני העיר חלק עליו ונסע אל השר להקביל עליו ואינו ידוע לי לו אם מעסק הרבנות או מעסק אחר והטה מן הדרך אל הבעש״ט שיתפלל בעדו שיפיק רצונו מן השר והבטיח לו הבעש״ט ונסע"
times:holidays	https://www.hasidic-stories.org/Story/Adat-Zadikim/Adat-Zadikim_0023	Adat-Zadikim_0023	Adat-Zadikim	embedding	0.957		False	high	The story contains no mention of any Jewish holiday; the feast described is a farewell banquet, not a holiday celebration.	" וגם בעת ההתקשרות היו רק שלשתם ולא ידע שום אדם מזה ויצוה הר""ח שילכו לביתם ויחכו עד עת מועד אחרי ביאת רבינו מדרכו ויראה איך יפול דבר : ויהי כבוא רבינו מדרכו וישאל לשלום חבירו וינשק לו ויראה אס את פניו זועפות ויאמר לו ידיד"
times:holidays	https://www.hasidic-stories.org/Story/Khal-Hasidim/Khal-Hasidim_0173	Khal-Hasidim_0173	Khal-Hasidim	embedding	0.957		False	high	The only holiday reference is 'שמחת פורים' used as a simile for the townspeople's rejoicing at the informer's death — a metaphorical comparison, not a depiction of Purim or any holiday actually taking place in the story.	ל אשר עשה עד כה וכאשר נתייגע בזה מעט אז כמו נד נצבו לפניו כל העבירות שעשה מעודו. ויתמהמה מאוד ויעמוד הרבה ולא היה יכול לומר סלח לנו. עד כי נתחרט מאוד על כל מה שעשה וקבל עליו לעזוב חטאיו על להבא ועתה ישוב לביתו תיכף ולא י
times:holidays	https://www.hasidic-stories.org/Story/Khal-Hasidim/Khal-Hasidim_0140	Khal-Hasidim_0140	Khal-Hasidim	embedding	0.957		False	high	The story depicts the Maggid's journey to the Besht, his illness and healing, and a mystical Torah-reception experience; 'משבת לשבת' appears only as a fasting-interval measure, and no holiday is depicted or foregrounded.	י עמוד ואמר הבעש״ט לא כן הוא אני אומר לפניך ואמר לפניו ובתוך כך נזדעזע וקם ואמר אנחנו עוסקים במעשה מרכבה ואני יושב ואמר בעמידה ובתוך הדבורים שכב אותי במטה כמו עיגול ושוב לא ראיתי אותו רק שמעתי קולות וראיתי ברקים ולפידים 
times:holidays	https://www.hasidic-stories.org/Story/Shivhei-Habesht/Shivhei-Habesht_0185	Shivhei-Habesht_0185	Shivhei-Habesht	embedding	0.957		True	high	The story is explicitly set over Shabbat — the Besht arrives on Thursday, stays through Friday (erev Shabbat), prays Mincha, Maariv, Shacharit, and Mussaf, with the Shabbat framework central to the healing narrative.	"Shivhei-Habesht_0185 תיוגים* בק""ק אחת היו ג' אחים לומדים מופלגים ויראי ה' שנים מהם היו סרים למשמעתו של הבעש""ט והג' הי' מתנגד נגדו ובכל פעם שהי׳ הבעש״ט בק""ק הנ' הי' אכסניא שלו אצל שני האחים ובכל פעם הי׳ שואל ודורש לשלום א"
times:holidays	https://www.hasidic-stories.org/Story/Khal-Hasidim/Khal-Hasidim_0099	Khal-Hasidim_0099	Khal-Hasidim	embedding	0.957		False	high	"Rosh Chodesh (ר""ח) is mentioned only incidentally as the occasion that frames a halakhic test question about יעלה ויבא; the story itself centers on the Council of Four Lands summoning the Besht and his demonstration of supernatural knowledge, not on any holiday observance or setting."	"Khal-Hasidim_0099 תיוגים פ״א בעת אסיפת ד׳ ארצות היה הפרנס הראשון הרב הנגיד המפורסים מ' אברהם אבא הציע הדבר לפני כולם כי הנה נשמע שמע הבעש״ט ולפי הנשמע הוא ע״ה ואיך יכול להיות שיהיה לו רוה""ק כי אין ע""ה חסיד ושלחו מהאסיפה "
times:holidays	https://www.hasidic-stories.org/Story/Khal-Hasidim/Khal-Hasidim_0036	Khal-Hasidim_0036	Khal-Hasidim	embedding	0.957		True	medium	The story is explicitly set during Easter ('לפני אידיהם פסח של הנוצרים'), and the holiday is central to the plot — the danger to Jews, the bishop's sermon, and the Besht's intervention all hinge on it, though it is a Christian rather than a Jewish holiday.	"מעשה תדע כי אנכי הבישוף אשר קראת אז. ואנכי הייתי קודם יהודי ואח""כ נפלתי לעמקי הקליפות כי חכם גדול הייתי ונשמה קדושה היתה לי ו הבעש""ט בחסדו הוציאני ממעמיקי הקליפות כי יש לי זכות אבות כי אבותי קדושי׳ היו והם בקשו את הבעש""ט"
times:holidays	https://www.hasidic-stories.org/Story/Shivhei-Harav/Shivhei-Harav_0017	Shivhei-Harav_0017	Shivhei-Harav	embedding	0.957		False	high	The story centers on a dispute between two Hasidic leaders, a healing miracle, and a visit to the Baal Shem Tov's grave; the one mention of Megillah/Purim is a fleeting rhetorical point in an argument, not a depiction of a holiday.	קבר הבעש״ט הקדוש ז״ל וכאשר הגיע השמועה כי הרב לא רחוק הוא מהעיר ירד הר״ר ברוך מעלייתו מקים אשר הי׳ משכן קדשו תמיד והתיצב בבית הגדול אצל השולחן וכה עמד על רגלי' לא מש ממקומו עד אחר שהלך הרב מביתו כאשר נספר : פתא ו ם שלח ה
times:holidays	https://www.hasidic-stories.org/Story/Shivhei-Habesht/Shivhei-Habesht_0077	Shivhei-Habesht_0077	Shivhei-Habesht	embedding	0.957		False	high	The story depicts the Besht ill before his death, a visit from Rabbi David Furkes, and an interruption by his daughter Adel — no holiday is mentioned or implied.	Shivhei-Habesht_0077 תיוגים* שמעתי מהרב דקהילתינו בהיות הבעש״ט חולה קודם פטירתו לא שכב במשכב רק שנעש' כחוש וקולו נלקה והי יושב בבית התבודדותו התבדדותו ולא הי׳ בו כח לקרוא להמשרת שלו כשהיה צריך לו ותלה פעמן בבית גדול וחוט
times:holidays	https://www.hasidic-stories.org/Story/Khal-Hasidim/Khal-Hasidim_0116	Khal-Hasidim_0116	Khal-Hasidim	embedding	0.956		False	high	The story depicts a journey and mystical teaching session between Rabbi Aryeh Leib and the Besht concerning the wisdom of animal speech and Merkavah; no holiday is mentioned or implied.	"Khal-Hasidim_0116 תיוגים מעשה הי' שהרב הק' המוכיח מו""ה ארי' ליב מ פולנאי חשקה נפשו מאוד ללמוד חכמת שיחת בהמות ועופות ושיחת דקלים מפני שנצרך לו זה לתוכחה ומאחר שהי' כוונתו לש""ש נגמר בדעתו ליסע ל הבעש״ט ולבקש ממנו שילמוד א"
times:holidays	https://www.hasidic-stories.org/Story/Shivhei-Habesht/Shivhei-Habesht_0210	Shivhei-Habesht_0210	Shivhei-Habesht	embedding	0.956		False	high	The story depicts a near-death/soul journey, a heavenly court judgment, and intercession by the Besht — no holiday or festival is mentioned or depicted.	"ין עוזר ואין תומך לו ומיד נשמע קול רעש גדול אשר ממש רעשו כל העולמות והכריזו פנו מקום כי הבעש״ט בעצמו בא אל ההיכל וראה אותו שהוא עומד אצל הפתח שאל אותו יוסף מה עסקך בכאן והשיב לו כנ""ל וגם בקשתי את אדוני אבי והרב דק""ק פולנ"
times:holidays	https://www.hasidic-stories.org/Story/Shivhei-Habesht/Shivhei-Habesht_0035	Shivhei-Habesht_0035	Shivhei-Habesht	embedding	0.956		True	high	שמחת תורה (Simchat Torah) is explicitly named as the occasion on which R. Eliezer was humiliated, making it a causally central element of the narrative, not incidental.	"זו רעדה ונחפז ושלח לעורר כל המנין ורא׳ שכולם ת""ל שלימים ושאל אותם שמא א׳ מכם עבר עבירה בסתר ח""ו וסיפר להם החלום ענה צדיק אחד ר׳ אליעזר מ טאמאשפאלי לא ידעתי מאומה כי אם אותו הלילה לפני השינה עיינתי בספר חמדת הימים ועוד סי"
times:holidays	https://www.hasidic-stories.org/Story/Khal-Hasidim/Khal-Hasidim_0017	Khal-Hasidim_0017	Khal-Hasidim	embedding	0.956		False	high	The story concerns poverty, reincarnation (gilgul), and the Besht's spiritual guidance — no holiday is mentioned or depicted.	"ספרו לו גנות ורעות האיש אשר שואל עליו כי היה רשע שאין דומה לו ר""ל : וישא הת""ח ההוא את רגליו וישב לביתו בפחי נפש בלי שום תשוע' כי אם ברפיון כח מרוב הדרך והיגונות אשר מצאתהו עדי בואו לביתו העיר הגדולה אשר שם היה הבעש""ט זלל"
times:holidays	https://www.hasidic-stories.org/Story/Adat-Zadikim/Adat-Zadikim_0020	Adat-Zadikim_0020	Adat-Zadikim	embedding	0.956		True	high	Passover (חג הפסח) is central to the plot: R' Aharon of Karlin travels to be home for Pesach, the disciples try to keep him for the holiday, and he dies on the third day of Chol HaMoed Pesach.	בשם רבינו כי הרב רוצה שאהיה פה חג הפסח ויען לו הרה״מ אנכי איני מעכב אותך אם רצונך ליסע תיסע לשלום ובצאתו ובצחתו אמר עוד הפעם לתלמידיו ראו שלא תניחו אותו לנסוע וירוצו החבירים עוד הפעם ל הר״א והרבו לדבר על לבו כי אין זה דב
times:holidays	https://www.hasidic-stories.org/Story/Khal-Hasidim/Khal-Hasidim_0243	Khal-Hasidim_0243	Khal-Hasidim	embedding	0.956		False	high	The story contains no reference to any Jewish holiday; it centers on a innkeeper's trust in God (bitachon) and his charitable partnership with the Divine, with no holiday setting or occasion mentioned.	"ישועות ויכחד הרינדאר ויאמר לא ידעתי דבר וכו' אז הודיעו הרה""ק כי הוא הרב מ אפטא וכי הוא גוזר עליו לגלות א״ע ויען הרינדאר ויאמר מצוה לשמוע דברי חכמים והנני לגלות אזניך ולספר לך כי אך מגודל בטחוני בטחונו בה' אשר עלתה למעלה "
times:holidays	https://www.hasidic-stories.org/Story/Shivhei-Harav/Shivhei-Harav_0019	Shivhei-Harav_0019	Shivhei-Harav	embedding	0.956		True	high	The story's climactic scene explicitly takes place on Hoshana Rabbah (הושענא רבה), with the rabbi praying, breaking the lulav, performing Hakafot, and dying on that holiday — the holiday is central to the narrative, not incidental.	דובבות אותם גם בעת השינה. ואח״כ דיבר על לבי ונחם אותי והבטיח כי מעתה לא יפחידו אותי חבילי טהירין וכל החסידים והרבנים אשר ישבו בבית הגדול בראותם כי רבינו התאחר מהעת אשר יעד להם קרבו כולם אצל הפתח והפתח הי׳ סגור אבל רבינו 
times:holidays	https://www.hasidic-stories.org/Story/Khal-Hasidim/Khal-Hasidim_0218	Khal-Hasidim_0218	Khal-Hasidim	embedding	0.956		False	high	The story contains only an incidental mention of Shabbat (motzaei Shabbat as a time-marker for Rabbi Isser's departure), but no Jewish holiday features as a meaningful setting, theme, or narrative element.	"תמהמהו יתמהמו פה על המשתה אשר יעשה להם ואח״כ יתן להם מסת נדבת ידו כי חשב כי המה נוסעים לקבץ כסף ונתרצה לו הרר""י וימתינו עד הסעודה והאנשים הקרואים על המנין ג""כ היו שם ויתבוננו כולם אודות האנשים ההם כי המה ראו חדשות אשר לא"
times:holidays	https://www.hasidic-stories.org/Story/Shivhei-Habesht/Shivhei-Habesht_0091	Shivhei-Habesht_0091	Shivhei-Habesht	embedding	0.956		False	high	The story references Shabbat (Kiddush, Shabbat meal, dying on Shabbat/שב״ק) and the month of Tammuz, but no Jewish holiday (Yom Tov/festival) appears; Shabbat is a weekly observance distinct from the 'holidays' category.	"Shivhei-Habesht_0091 תיוגים* שמעתי מהרב דקהלתינו כשרצה ר׳ נחמן לנסוע פ""ש לאה״ק הלך על קבר של הבעש""ט עם ר׳ יוסף מ קאמינקע וכשחזר מב""ע שמח שמחה גדולה ואמר הבעש״ט ציוה לי לנסוע לאה״ק תמה מאוד ר' יוסף ואמר והיכן דיבר עמכם תמ"
times:holidays	https://www.hasidic-stories.org/Story/Shivhei-Habesht/Shivhei-Habesht_0002	Shivhei-Habesht_0002	Shivhei-Habesht	embedding	0.956		False	high	The story focuses on Rabbi Adam's mystical writings, the Besht's early life, marriage, and spiritual exploits, with no depiction of any Jewish holiday; Shabbat is mentioned only incidentally in the context of a fasting period.	"ץ ממון. וישב לו הנה אבי המנוח ז""ל הי' צדיק מפורסם וצוה עלו לפני הסתלקותו לישא אשה פה ק""ק אקום . ומוכרח אני לקיים כל דבריו. ומיד ותהום כל העיר שהיו לפניו כמה שידוכים ונשתדך עם נגיד א׳, כי נשא חן בעיני כל רואיו. ויהי אחרי "
