story_id	edition	signals	sim	matched_terms	claude_applies	claude_confidence	claude_reasoning	excerpt	should_tag	notes
Khal-Hasidim_0115	Khal-Hasidim	embedding	0.95		False	high	The term 'מפזז ומכרכר' (skipping and dancing) is used metaphorically to describe the person's good fortune, not as a literal depiction of dancing.	"שראל אמן : בעיר רישא הי' שמה איש אחד למדן גדול וגביר מופלג נאדר ביחס באושר בעושר ובכל תהלה והנה כל ימיו הקשיב תהלות ותשבחות הבעש״ט זצ""ל ומעולם לא דרכו רגליו על מפתן החסידות וצללו אזניו מאוד לקול הסיפורים מהמופתים אותותיו"		
Shivhei-Habesht_0075	Shivhei-Habesht	embedding	0.95		False	high	The story focuses on a conflict regarding leading the prayer service (Tefilla) and liturgical order (Nusach), but does not mention dancing.	"Shivhei-Habesht_0075 תיוגים שמעתי פ""א הלך ר׳ נחמן ז""ל דרך ק""ק זאלראווע עם סחורה בעת תפילת שחרית ועמד עם עגלה שלו נגד בה""מד ולקח הטו״ת ונכנס לבית המדרש ועטף טו״ת ועמד לפ""הת להתפלל בלי רשות וירע להם איך העיז האיש האורח לעמ"		
Shivhei-Habesht_0043	Shivhei-Habesht	embedding	0.95		False	high	'מחול לך' = forgiven.	"Shivhei-Habesht_0043 תיוגים* שמעתי מהרב מ' מנחם ששמע מפי כלת הרב המ״מ הגדול אשת הרב מ׳ אברהם הנ""ל : כשנתאלמן בנו הק' מ׳ אברהם זצ""ל קרא לשני חשובי העיר ואמר בקשתי שתסעו לק""ק קרעמניץ ותשדכו לבני שי׳ בת הרב מ׳ פייוול בעהמ״ח"		
Khal-Hasidim_0118	Khal-Hasidim	embedding	0.95		False	high	The story describes a festive meal and a spiritual correction between the Baal Shem Tov and a Rabbi, but there is no mention of dancing.	"Khal-Hasidim_0118 תיוגים פ""א נסע הבעש״ט עם תלמידיו והוכרחו ללון ביער אמרו התלמידים בבדיחותא נראה הסעודה שיעשה הרב לנו ויאמר הרב לכן ביום מחר אי""ה אעשה לכם סעודה גדולה בכמה מיני מטעמים ולמחרתו באו לעיר גדולה והתאכסנו בבית"		
Khal-Hasidim_0131	Khal-Hasidim	embedding	0.95		False	high	The story focuses on ritual practices like putting on Tefillin, reciting Tehillim (Psalms), and communal prayers for protection against invaders, with no mention of dancing.	"ד לפני התיבה ואומר תהילים כמו בשינה וידעתי שהרב ירגיז על זה כי הי' אומר ברית המעור וברית הלשון מכוונים ותהלים צוה שהרבה לומר בכל בתי כנסיות אותיות נעמרוב ואותיות קר""ע שט״ן משולב בשם הוי""ה מפסוקי אשרי תמימי דרך ומקודם יאמ"		
Khal-Kdoshim_0011	Khal-Kdoshim	embedding	0.95		False	high	The story focuses on the protagonist's ascetic practices, prayer intentions, and grammatical precision, but contains no mention of dancing.	Khal-Kdoshim_0011 תיוגים אעתיק מעשה נורא מספר קדמון הנקרא שם יעקב איש אחד הי מחסידי עליון ואספר קצת מחסידותיו ומדותיו ושמו ר' עזרא במו' ידידיה והי׳ דר בעיר קטנה ואנשים בה מעט סמוך ל ווינצי והאיש ההוא מיום שעבר לו שבע שני		
Khal-Hasidim_0173	Khal-Hasidim	embedding	0.95		False	high	The story mentions joy and a Purim-like atmosphere upon the informer's death, but does not explicitly depict or mention the act of dancing.	ל אשר עשה עד כה וכאשר נתייגע בזה מעט אז כמו נד נצבו לפניו כל העבירות שעשה מעודו. ויתמהמה מאוד ויעמוד הרבה ולא היה יכול לומר סלח לנו. עד כי נתחרט מאוד על כל מה שעשה וקבל עליו לעזוב חטאיו על להבא ועתה ישוב לביתו תיכף ולא י		
Shivhei-Habesht_0020	Shivhei-Habesht	embedding	0.95		False	high	The story describes physical trembling and mystical movements during prayer (tnuot), but does not depict dancing (rikud).	"ושה לו תיקון ומתפלל בעדו ומעלהו והחשוב חשוב קודם והם רבים כ״כ שאם רציתי להעלות כולם הייתי צריך לעמוד ש״ע שלש שנים אך כשאני שומע הכרוז שמכריז תקודש מקודש וא""א עוד להעלות הנשמות אני פוסע מן הש""ע ואמר אליו רבי גרשון בדרך שח"		
Shivhei-Habesht_0135	Shivhei-Habesht	embedding	0.95		False	high	The story focuses on a scholarly debate (pilpul), the sanctity of the Sabbath, and the Besht's spiritual punishment of an arrogant scholar; it contains no mention of dancing.	"וף השולחן וגער בו הבעש״ט בזה""ל אני שונא ענוותן בא ושב בכאן והתחיל הרב להחזיר הדרשה ורבי מיכל מקשה ורבי זאב מפלפל עמו עד שנצחו והיה רבי מיכל בוש בדבר ועמד על זה אע""פ שהי׳ עקום ולא רצה להודות על האמת התחיל הבעש״ט לבקש ואמ׳"		
Shivhei-Habesht_0197	Shivhei-Habesht	embedding	0.95		False	high	The story focuses on the Besht teaching and then making the Preacher of Polonne forget the mystical language of animals and birds; it contains no mention of dancing.	"Shivhei-Habesht_0197 תיוגים* מעשה הי' שהרב המוכיח מוה' ארי׳ ליב מפולנאה חשקה נפשו מאוד ללמוד חכמת שיחת בהמות ועופות ושיחת דקלים מצד שנצרך לו זה לתוכחה ומאחר שהיה כוונתו לש""ש נגמר בדעתו ליסע ל הבעש״ט ולבקש ממנו שילמד אותו"		
Khal-Hasidim_0012	Khal-Hasidim	embedding	0.95		False	high	The story mentions joy and great religious enthusiasm (hitlahavut) during the recitation of the alphabet and the holiday, but it contains no explicit mention of dancing.	"סח וכבר הכין כל צרכי הפסח כיד הגביר. ותען לו אבי בבהמ""ד ותוכלו להתאכסן פה כי לא יקפיד ע""ז תיכף נשאו המשרתים שלו את כל החפיצים לבית וערכו השלחן בכלים נאים ובמטה מוצעת ומהודרת והכין כל צרכי הסדר עם מצה שמורה הכל על צד המעו"		
Khal-Hasidim_0066	Khal-Hasidim	embedding	0.95		False	high	The story describes a conflict regarding a guest leading the prayer service (Shaliach Tzibbur) without permission, but does not mention dancing.	"Khal-Hasidim_0066 תיוגים שמעתי פ״א הלך ר׳ נחמן ז""ל דרך ק""ק זאלראויע עם סחורה בעת תפלת שחרית ועמד עם עגלה שלו נגד בה""מ ולקח הטו""ת ונכנס לבית המדרש ועטף ט""ות ועמד לפ""הת להתפלל בלי רשות וירע להם איך העיז האיש האורח לעמוד לפ"		
Shivhei-Habesht_0034	Shivhei-Habesht	embedding	0.95		False	high	The story recounts the Maggid of Mezeritch's healing and mystical initiation by the Baal Shem Tov, focusing on study and visions rather than dancing.	"Shivhei-Habesht_0034 תיוגים* שמעתי מהרב דק""ק דראזניץ שהיה אב""ד בק""ק פאוולויץ המעשה איך נתקרב הרב המגיד הגדול ל הבעש״ט המגיד צום ז' או ח' פעמים משבת לשבת רצופים, וחלה מאוד פ""א בא ר' מענדל מק""ק באר לק' טארטשין ונתאכסן אצל "		
Peer-MiKdoshim_0001	PeerMikdoshim	embedding	0.95		False	high	The terms for dancing ('מפזז ומכרכר') are used only as a metaphorical idiom to describe the protagonist's good fortune, not a physical act of dancing.	"פאר מקדושים Peer-MiKdoshim_0001 תיוגים מעשה מ הבעש״ט הקדוש זי""ע אשר סיפר הגאון ר׳ שלם מ קאמינקא זצ״ל כדאתכנשו כל צדיקי הדור על היא""צ ב ראפשיץ . באה אשה אחת לפניהם ובתוכם הי׳ הגאון מ קאמינקא זי״ע וצעקה האשה בבכי יליל תמרו"		
Shivhei-Habesht_0193	Shivhei-Habesht	embedding	0.95		False	high	The story describes a man's sin of hitting his father and the subsequent penance assigned by the Besht; it contains no mention of dancing.	"Shivhei-Habesht_0193 תיוגים* פ""א הי' הבעש״ט באיזה קהילה והי׳ אכסניאותו על העלי' : פעם א׳ ראה איש א׳ עובר על הרחוב מיד צוה להמשרת שלו רוץ מהר וקרא לי את האיש הזה וירץ הנער ויקרא לו ומתחילה נתפעם לבו ולא רצה לילך ועכ״ז לא "		
Shivhei-Habesht_0017	Shivhei-Habesht	embedding	0.95		False	high	The story describes intense physical movements and spiritual ecstasy during prayer (shaking and bowing), but it does not mention or depict actual dancing.	"Shivhei-Habesht_0017 תיוגים* עוד שמעתי מפיו הנ' פ""א עיה״כ ראה בעש״ט קיטרוג גדול על ישראל שיסתלק מהם תורה שבע״פ והיה מתעצב מאוד כל יום עיה״כ ולע״ע כשבאו כל העיר לברכם ברך אחד או שנים ואמר לא יכולתי מחמת צער ולא בירך אותם "		
