story_id	edition	signals	sim	matched_terms	claude_applies	claude_confidence	claude_reasoning	excerpt	should_tag	notes
Shivhei-Habesht_0112	Shivhei-Habesht	embedding	0.96		False	high	The story focuses on a miracle involving a dying student and the Besht's status in the afterlife; there is no mention of fasting as a practice.	ידיעה למעל' את מי יכניסו בג״ע והכריחו את החולה שיתן להם ת״כ שיגלה להם איך יתנהגו עמו אחר מותו וכשמת בא להם וגילה להם שהכניסו אותו לג״ע ולא ראה שם הבעש״ט ולא ידע על ידי מי הכניסו אותו אך לא היה לו מקום בג״ע כי כאשר ישב במ		
Shivhei-Harav_0017	Shivhei-Harav	embedding	0.96		False	high	The story focuses on the dispute between the Baal HaTanya and Rabbi Baruch of Mezhbizh, miracle stories, and a visit to the Baal Shem Tov's grave; it contains no mention of fasting.	קבר הבעש״ט הקדוש ז״ל וכאשר הגיע השמועה כי הרב לא רחוק הוא מהעיר ירד הר״ר ברוך מעלייתו מקים אשר הי׳ משכן קדשו תמיד והתיצב בבית הגדול אצל השולחן וכה עמד על רגלי' לא מש ממקומו עד אחר שהלך הרב מביתו כאשר נספר : פתא ו ם שלח ה		
Shivhei-Habesht_0135	Shivhei-Habesht	embedding	0.96		False	high	The text describes a journey, Sabbath observance, and a scholarly dispute, but contains no mention of fasting or communal fast days.	"וף השולחן וגער בו הבעש״ט בזה""ל אני שונא ענוותן בא ושב בכאן והתחיל הרב להחזיר הדרשה ורבי מיכל מקשה ורבי זאב מפלפל עמו עד שנצחו והיה רבי מיכל בוש בדבר ועמד על זה אע""פ שהי׳ עקום ולא רצה להודות על האמת התחיל הבעש״ט לבקש ואמ׳"		
Maase-Zadikim_0015	maase-zadikim	embedding	0.96		False	high	'עצום' (mighty).	"מרא וכדומה ולא ידעו מאומה ויסכים האברך החסיד בדעתו ללמוד עמהם חומש עם פירש“י ומעט מדיני ש""ע וספרי יראים למען השרש בלבם יראת ד' והיה לומד עמם בכל יום ספר ראשית חכמה הקדוש בהתלהבות גדול. וירא הבעל הבית אשר הוא עושה באמונה "		
Shivhei-Harav_0019	Shivhei-Harav	embedding	0.96		False	high	The story focuses on a man tormented by spirits and the Rabbi's spiritual remedies (segulot) and teachings on divine unity, with no mention of fasting as a practice.	דובבות אותם גם בעת השינה. ואח״כ דיבר על לבי ונחם אותי והבטיח כי מעתה לא יפחידו אותי חבילי טהירין וכל החסידים והרבנים אשר ישבו בבית הגדול בראותם כי רבינו התאחר מהעת אשר יעד להם קרבו כולם אצל הפתח והפתח הי׳ סגור אבל רבינו 		
Maase-Zadikim_0018	maase-zadikim	embedding	0.959		False	high	The story emphasizes trust in God and charity as the source of the man's power; fasting is not mentioned as a religious practice or even as an incidental act.	דאר על מעשהו מאין לו כח הזה לפעול ישועות. ויכחד הרינדאר ויאמר לא ידעתי דבר וכו' אז הודיעו הרה״ק כי הוא הרב מ אפטא וכי הוא גוזר עליו לגלות א״ע ויען הרינדאר ויאמר מצוה לשמוע דברי חכמים והנני לגלות אזניך ולספר לך כי אך מגוד		
Shivhei-Habesht_0160	Shivhei-Habesht	embedding	0.959		False	high	The story describes a festive meal (se'udah) and the annulment of judgments, but contains no mention of fasting.	"Shivhei-Habesht_0160 תיוגים* מעשה שהיה אב""ד בק""ק באר ואחד מבני העיר חלק עליו ונסע אל השר להקביל עליו ואינו ידוע לי לו אם מעסק הרבנות או מעסק אחר והטה מן הדרך אל הבעש״ט שיתפלל בעדו שיפיק רצונו מן השר והבטיח לו הבעש״ט ונסע"		
Khal-Hasidim_0001	Khal-Hasidim	embedding	0.959		True	high	The Besht's father explicitly undertakes an 'Hafsakah' (multi-day) fast as a religious practice to receive divine guidance through a dream inquiry.	"רך ישר שהוא מבוא העיר אשר אנשי העיר הולכים ושבים בה ויורהו הסימנים ויעשו כן והצליח המלך ותפס את החזקת הנ״ל ע״כ] ויגדלהו המלך להרב הנ""ל ויעשהו לשר צבא מלחמתו כי ראה בעינא פקיחא כי ה׳ אתו וכל אשר הוא עושה מצליח ובכ״מ אשר ש"		
Khal-Hasidim_0170	Khal-Hasidim	embedding	0.959		False	high	The story centers on a miracle performed through the decree of a habitual drunkard (as a reward for his past deeds), with no mention of fasting or ritual fasts.	תה מתחלה מעט יין שרף ויאמרו לא נסור נסיר מכאן ולא תוכל לשתות יין שרף עד כי תגזר תגזור הדבר הזה ויאמר אליהם המקום ברחמיו יסיר המחלה מקרבכם והניחו לו וילכו מאתו ויסעו בחזרה ל מעזיביז ויכוונו את השעה ויהי כאשר אמר כן היה בר		
Khal-Hasidim_0242	Khal-Hasidim	embedding	0.959		False	high	The story focuses on a conflict regarding purchasing fish for Shabbat and a supernatural revelation of adultery; it contains no mention of fasting or fast days.	י כן פתח את פיהו האנכי אחשה מי אשר עשה בני ממזרי׳ עוד עד השבת לא תדרוך רגלו על מגרש יאסי ועתה עוצו עצה מה לעשות פן אערה עליו את כל חמתי. כה דבר האיש ושנה ושלש דבריו. האנשים ראשי הקהל אשר היו בבית הגביר גם להם חרה הדבר הז		
Khal-Hasidim_0174	Khal-Hasidim	embedding	0.959		False		[error] Unterminated string starting at: line 4 column 16 (char 61)	"רי : פעם אחד בא אליו הר""ש הנ""ל בחג השבועות וירא והנה קאחיל אחת מהתנור רועדת וגם הכסא אשר ישב עליה הרב רועדת וישאל הר""ש את הרב מה זאת ויאמר לו הרב כי היום היה אצלי הבעש״ט הקדוש ומורי הרב המגיד הק' ואנכי לא הכרתי את הבעש״ט"		
Shivhei-Habesht_0210	Shivhei-Habesht	embedding	0.959		False	high	The story focuses on a near-death experience, heavenly judgment, and the intervention of the Baal Shem Tov, with no mention of fasting.	"ין עוזר ואין תומך לו ומיד נשמע קול רעש גדול אשר ממש רעשו כל העולמות והכריזו פנו מקום כי הבעש״ט בעצמו בא אל ההיכל וראה אותו שהוא עומד אצל הפתח שאל אותו יוסף מה עסקך בכאן והשיב לו כנ""ל וגם בקשתי את אדוני אבי והרב דק""ק פולנ"		
Shivhei-Habesht_0021	Shivhei-Habesht	embedding	0.959		False	high	The story describes repentance (teshuva) through financial restitution and giving away wealth, but does not mention fasting or ascetic food deprivation.	"Shivhei-Habesht_0021 תיוגים* שמעתי מהרב המפורסם החסיד וחכים דק""ק פולנאה 20 21 שהי' שבחי הבעש״ט 22 שהיה אב""ד בק""ק שאריגראד שמע ש הבעש״ט בא לק""ק מאהליב אמר בלבו אסע גם אני כי לא היה עדיין חסיד ונסע ובא בעש""ק אליו קודם תפיל"		
Shivhei-Habesht_0197	Shivhei-Habesht	embedding	0.959		False	high	The story describes the Besht teaching mystical knowledge (the language of animals) to Rabbi Aryeh Leib of Polonne and contains no mention of fasting.	"Shivhei-Habesht_0197 תיוגים* מעשה הי' שהרב המוכיח מוה' ארי׳ ליב מפולנאה חשקה נפשו מאוד ללמוד חכמת שיחת בהמות ועופות ושיחת דקלים מצד שנצרך לו זה לתוכחה ומאחר שהיה כוונתו לש""ש נגמר בדעתו ליסע ל הבעש״ט ולבקש ממנו שילמד אותו"		
Shivhei-Harav_0018	Shivhei-Harav	embedding	0.958		False	high	The text describes suffering during war ('hungry and thirsty') but does not depict fasting as a religious practice or ritual.	דש בחדשו ומידי שבת בשבתו בשבתי שהראה להם באספקלריא המאירה האיר הברקאי ומתחזיא מסיפא עלמא ועד סופיה גדול ה׳ ומהולל מאוד בעירו הר הי קדשו וברכנו בקול רם ונשא ברכת חכם הרזים ברוך שחלק מחכמתו ליריאיו : והן עתה בעו״ה חשך השמש		
Shivhei-Habesht_0004	Shivhei-Habesht	embedding	0.958		False	high	The story describes the Besht's period of seclusion, study, and prayer, but it does not mention fasting or the specific practice of a 'fast' (Ta'anit).	"יתעלף והעירו אותו. ויאמר הבעש""ט לא היה לך להסתכל במה שלא הורשית ויהי לפלא בעיניו ויהי בבקר וילך לבית התבודדותו להתפלל שם כדרכו, ובבואו לביתו בא שמח וטוב לב בנשיאת ראש והלך בביתו אנה ואנה וזמר אסדר לסעודתא ועשה קידושא רבא"		
Maase-Zadikim_0006	maase-zadikim	embedding	0.958		False		[error] Extra data: line 2 column 1 (char 212)	לה מעט יין שרף ויאמרו לא נסור נסיר מכאן ולא תוכל לשתות יין שרף עד כי תגזר הדבר הזה ויאמר אליהם המקום ברחמיו יסיר המחלה מקרבכם והניחו לי וילכו מאתו ויסעו בחזרה ל מעזיביז ויכוונו את השעה ויהי כאשר אמר כן היה ברגע אמר דברו 		
Adat-Zadikim_0013	Adat-Zadikim	embedding	0.958		False	high	The story focuses on a conflict regarding the purchase of fish for Shabbat and the revelation of adultery; it contains no mention of fasting or religious fasts.	 הקהל החשובים אשר באו אז להתיעץ על איזה דבר הכרחי וזלזלה וגדפה מאוד מאוד עד אשר נעוו כל העם משמוע ולא ולא יכול השמש להתאפק ויאמר הנה אדוני אתם כולכם ועלי לסור למשמעת הקהל והם צוו עלי כי אציית את הרב דמתא לכל אשר יאמר לו 		
