story_id	edition	signals	sim	matched_terms	claude_applies	claude_confidence	claude_reasoning	excerpt	should_tag	notes
Khal-Hasidim_0252	Khal-Hasidim	lexical	0.95	שיר	True	high	The text explicitly describes the people of Krakow welcoming the Rema with drums, musical instruments, and flutes (בתופים ובכל כלי שיר, והחליל מכה).	" נשאר אף תינוק בעריסם אשר לא יצאו לקראת הרב בתופים ובכל כלי שיר וכה הובילו אותו העירה בכבוד ההדר לכל חסידיו והחליל מכה לפניהם וכרוז יוצא מלפניהם פנו מקום לכבוד לכביד רבינו משה אב""ד ושר העיר קראקא : אולם הבישוף בראותו תבנ"		
Mifalot-HaZadikim_0007	Mifalot-HaZadikim	lexical	0.95	שיר	False	high	The story focuses entirely on the laws and practices of ritual slaughter (Shechita) and spiritual discernment, with no mention of music, melody, or song.	ות וגם נסע לשאר שוחטים הגונים ולקח גם אצלם קבלה על אומנתו וכשירת זביחתו ורצה לקיים ג״כ ולהראות סכינו לת״ח כדינו ונסע לעיר וואסילקיוב הסמוך לה והראה סכינו להרב הצדיק הגאון מוה״ יהושע המגיד דק׳ הנ״ל (הנקרא ר׳ יהושעלע ) והר		
Shivhei-Habesht_0079	Shivhei-Habesht	lexical	0.949	שיר	False	low	'מזמור שיר' psalm title, not depicted music.	"פני התיבה והלכתי לפני התיבה ואמרתי לכו נרננה וכשבאתי למזמור שיר ליום השבת נעלמו כולם ממני ונשארתי אני לבדי ולא ידעתי להיכן הלכו והיה לי צער גדול מזה כל השבת שלא הי' לי צוותא ע״כ אני מבקש מרומע""ל שיתפללו בעדי שאוכל לעלות "		
Khal-Hasidim_0062	Khal-Hasidim	lexical	0.949	זמר שיר	True	high	The text explicitly mentions singing Shabbat hymns ('וזמרו זמירות') during the meal with the Baal Shem Tov.	"ליל ש״ק באו כל חשובי העיר ואחרי אשר עשה הבעש""ט קידוש כדרכו וזמרו זמירות ואכלו דגים והביאו המרק של שבת ולקח הבעש״ט מעט בכף והריח בו ואמר שמריח ריח של נבילה ויצו ליקח אותה מעל השולחן ולא טעמו טעם בשר כל השבת הוא ואנשיו המא"		
Khal-Hasidim_0011	Khal-Hasidim	lexical	0.949	ניגון	True	high	The story explicitly describes the character reciting the confession (Vidui) on his deathbed with a melody (niggun).	"מר עמו הוידוי ואמר עמו הרב ר׳ יעקב וידוי וענה אחריו הוידוי בניגון ותמה ר' יעקב ע״ז ואח""כ הלכה אשתו ממנו כי אמרה אולי ישן הוא מעט ונוח לו ובזמן מועט השגיחה עליו והוא מת וחזר ר׳ יעקב הנ""ל לביתו להודיע כי באמת סומים אנחנו :"		
Peer-MiKdoshim_0004	PeerMikdoshim	lexical	0.949	שיר	False	high	The text mentions the ringing of sleigh bells (פעמון) as a signal of an approaching carriage, but contains no depiction of music, melody, or song as a practice.	לה כתובתה באמרו המת ההוא יש לו דין מאבד עצמו לדעת כי מצות ואשיריהם תגדעון לא נצטוינו בחוץ לארץ בהיותינו בגולה על אדמת נכר. ונחנו תחת ידם פזורים ובצלם מסתופפים ולא נאמרה אך ב ארץ ישראל ולא נפרעה האשה את כתובתה ויחלום להרב		
Maase-Zadikim_0007	maase-zadikim	lexical	0.948	שיר	False		[error] Unterminated string starting at: line 4 column 16 (char 61)	"ש ז""ל. והנה שמע כי נפלאו' נשמע מהרב הקדוש מ מעזביז בעת אמרו שיר השירים בערב שבת אחר הטבילה כי ממש כמלאך אלקים צבאות הוא והוא בוער כאש וההתלהבות הוא עד למעלה כנודע לכל כי אמרו עליו שהי' לו ניצוץ מנשמת שלמה המלך ע""ה. ע""כ ב"		
Mifalot-HaZadikim_0001	Mifalot-HaZadikim	lexical	0.948	שיר	True	high	The story depicts a public musical performance with instruments ('מאזיקע') used as a plot device for the protagonist to recognize her husband.	כח כל הצער והיסורים שסבלה בעניותה מימים ימימה וישמן ישורון ישירון ויבעט התחילה לדאוג עבור ישיבתה עגונה ואלמנה חיה בלא בעל ובכתה ימים רבים מאין הפוגות ונתיעץ דודה עבורה כי מרוב תענוגה והבטלה מביאה לידי שעמום אשר על כן הטי		
Khal-Hasidim_0116	Khal-Hasidim	lexical	0.948	שיר	False	low	'פרק שירה' referenced as a text, not depicted music.	"ך החיות לכל החיות שלמטה ומפני נשר לעופות שלמטה וזהו סוד פרק שירה כי כפי הדיבור במרכבה העליונה בכל ב""ח וב""ח כן משתלשל למטה מטה בבהמות וחיות ועופות והנה מי שהוא חכם ומבין מדעתו ומסתכל בכל דבר עד שרשו של מעלה במרכבה עליונה "		
Shivhei-Habesht_0007	Shivhei-Habesht	lexical	0.947	ניגון	True	high	The text explicitly describes the dying tax collector reciting the Vidui (confession) with a melody (niggun).	"ר עמו הוידוי ואמר עמו הרב רבי יעקב וידוי וענה אחריו הוידוי בניגון ותמה ר׳ יעקב ע״ז ואח״כ הלכה אשתו ממנו כי אמרה אולי ישן הוא מעט ונוח לו ובזמן מועט השגיחה עליו והוא מת וחזר ר׳ יעקב הנ""ל לביתו להודיע כי באמת סומים אנחנו :"		
Khal-Hasidim_0143	Khal-Hasidim	lexical	0.946	שיר	True	high	Sang zemiros as customary at the third meal (וישירו זמירות כנהוג).	 תנחומין ויהי בסעודה השלישית נתאספו לשם כמעט כל אנשי העיר וישירו זמירות כנהוג. והיא במר נפשה ישבה נעצבה על מטה כבודה עם אשת הבעה״ב ותתנמנם ותחלום והנה טרקלין גדולים נאים ומהודרי׳ ותפתח ותפתת פתח א׳ ויבא בעלה הרב מ׳ אברהם		
Khal-Hasidim_0070	Khal-Hasidim	lexical	0.946	שיר	False	low	'מזמור שיר ליום השבת' = psalm title (overlaps recitation_of_psalms), not depicted music.	"פני התיבה והלכתי לפני התיבה ואמרתי לכו נרננה וכשבאתי למזמור שיר ליום השבת נעלמו כולם ממני ונשארתי אני לבדי ולא ידעתי להיכן הלכו והיה לי צער גדול מזה כל השבת שלא הי' לי צוותא ע""כ אני מבקש מרומע""ל שיתפלל בעדי שאוכל לעלות ע"		
Shivhei-Habesht_0100	Shivhei-Habesht	lexical	0.945	שיר	False	high	The story focuses on ritual slaughter (shechita) and kashrut rulings, with no mention of music, singing, or melodies.	"ו מפני מה נטרפה הבהמה הזאת ואמר לו לי יש דיעות בפוסקים יש מכשירין ויש מטריפין וצוה שיחתכו חתיכה בשר ויעשו ממנ' צלי וראה הבעש״ט שהדבר קשה בעיני אנשיו ואמר שישלחו לק""ק פולנאי לר׳ מ""ץ ויביאו ממנו איגר' קודם שתצלה ותיכף שלחו"		
Khal-Hasidim_0156	Khal-Hasidim	lexical	0.945	שיר	True	medium	Said Torah and hymns/zemiros (תורה ושירות) at the meal.	"רו מיוחד עם איזה מבניו ואח״כ הי׳ הולך לבית מדרשו לומר תורה ושירות עד שגמר הסעודה שם ובעת הזאת לא היה שם עמו שום אדם והי' רץ בחדרו אנה ואנה ואמר כו' כנ""ל עד שראתה בתו ורצתה ואמרה לאחיה הצדיק מו""ה יצחק מ ראדוויל ורץ לחדרו "		
Shivhei-Habesht_0003	Shivhei-Habesht	lexical	0.944	שיר	False	high	The story focuses on the Besht's encounter with robbers, a reincarnated frog soul, and his time as a servant for his brother-in-law, with no mention of music or melodies.	"""א הסוסי' ויצאו תיכף ומיד בנחת ויאמר הרב מוהר""ג הנה גם זאת השירות א""א לקבל ממנו כי לא יצלח לכל מלאכה"		
Shivhei-Habesht_0206	Shivhei-Habesht	lexical	0.944	שיר	False	high	The story focuses on a corrupt ritual slaughterer and an impure prayer leader, with no mention of music, melody, or singing.	"ן תודה והתוודה על חטאו שמעולם לא בדק שום ריאה את אשר ירצה יכשיר ואת אשר ירצה יטריף ונתן לו תשובה ע״ז ואח""ז הלכו לבה״כ העביר הבעש״ט את ידיו ע״פ הרב וראה כמה מחבלים ורוחות יושבים על בה״כ ונתפלא מאד ע״ז והשיב הבעש״ט שהש""ץ ק"		
Khal-Hasidim_0003	Khal-Hasidim	lexical	0.943	שיר	False	high	The story focuses on the Besht's encounter with a reincarnated soul in a frog and his early life as a coachman; it contains no mention of music, singing, or melodies.	"חת הסוסים ויצאו תיכף ומיד בנחת ויאמר הרב מוהר""ג הנה גם זאת השירות א""א לקבל ממנו כי לא יצלח לכל מלאכה :"		
