story_id	edition	signals	sim	matched_terms	claude_applies	claude_confidence	claude_reasoning	excerpt	should_tag	notes
Mifalot-HaZadikim_0026	Mifalot-HaZadikim	embedding+lexical	0.965	ניגון	True	high	The story explicitly describes the protagonist delivering mystical Torah teachings with a 'beautiful melody' (ניגון יפה) and concluding with a 'melody of conclusion' (ניגון הסיום).	 מסכן הנ״ל את פיו הקדוש בדיבורי תורה עמוקים מאוד בהתלהבות ובניגון יפה ונמשך הדיבורים לערך חצי שעה וסיים התורה בניגון הסיום ושניהם היו בעמידה והרב הנ״ל עשן הטיטין עד שנתמלא כל החדר בעשן ענן הקטרת אח״כ פתח עוד הפעם איש מסכ		
Khal-Hasidim_0185	Khal-Hasidim	embedding+lexical	0.962	כינור	True	high	The story explicitly mentions the kidnapped boy playing the violin ('כינור') to soothe his sorrow while imprisoned in the church attic.	וב הדבר אשר הוא עושה ויכנוס הדבר בלבו ויתמרמר ויקח הנער את הכינור כי היה יודע בגן בכינור ויחשוב להפיג צערו בזאת וכן היה הקיצור בפעם הרביעי ובפעם החמיש נתמרמר מאד עד כי לא הי' יכול לסבול ויבך מאוד במר נפשו על אשר קרה לו כ		
Mifalot-HaZadikim_0027	Mifalot-HaZadikim	embedding+lexical	0.961	ניגון זמר	True	high	The story explicitly describes the character whistling a melody and singing the 'Nishmat' prayer using a specific 'gentile melody' as part of the narrative.	״ל הולך יחף בביתו מפה אל פה ומתפלל במהירות כנ״ל ומזמר נשמת בניגון הערלים בעת שיכרותם אז התחילו לזרז א״ע וגמרו תפילתם עמו בשוה ועשה להם יסורים עוד יותר גדולים מן האתמול בליל ש״ק ואח״כ לעת המנחה רצו לאכול סעודה השלשית ולא 		
Khal-Hasidim_0253	Khal-Hasidim	embedding+lexical	0.961	שיר	False		[error] Unterminated string starting at: line 4 column 3 (char 48)	"כל לזכות להצלחה אשר כל ימיך לא האמנת שבני בניך יזכו להצלחה עשירית מזה כי תוכל ליקח את הרב הגדול ר""ח לחתן לך כי כן וכן הגיד לי ואנכי ידעתי כי יש לך בת בתולה הגונה וגם בית מיוחדת בחצר אך ספרים שאין לך לכ ע""כ ראה מה תעשה וה"		
Shivhei-Harav_0011	Shivhei-Harav	embedding+lexical	0.961	ניגון זמר שיר	True	high	The story depicts R' Mordechai of Lechovitch listening to a military band and instructing his followers to learn the melody for use in Sabbath songs.	חלון ופניו לגן ולא הביט אחריו ויאמר לאנשיו שימו לב לקבל את הניגון כי יהיה טוב לזמר בו זמירת שבת ויחרה לכל האנשים כי חרדו מאוד מאימת דינם אבל הוא שנה להם את דברו ויאמר להם אל תיראו מדברי הכלב הזה אשר עומד מאחרי עשו זאת אי		
Sipurei-Zadikim_0011	Sipurei-Zadikim	embedding+lexical	0.96	זמר	True	high	The story depicts Rabbi Azriel leading prayer with a specifically highlighted 'pleasantness of singing voice' (נעים זמרת קולו) and melody (נעימות) that moves the listeners.	"ות כמוהו וכל אוזן שומעו תמאס כל התענוגים ותרצה להתענג בנעים זמרת קולו וישאר המלמד נבוך ברעיוניו ולא ידע מה לדון בזה כי הדרשן עצמו הוא אמר על המהרש""א כי הוא ספר מוסר ובע""ג שלו מתפלל לפני התיבה. ועל כן הבין כי אין זה דבר ר"		
Adat-Zadikim_0023	Adat-Zadikim	embedding+lexical	0.958	שיר	False	high	The mention of 'songs' (שירים) is a formulaic reference to a grand public farewell and does not depict music or melody as a substantive practice within the story.	כל לזכות להצלחה אשר כל ימיך לא האמנת שבני בניך יזכו להצלחה עשירית מזה כי תוכל ליקח את הרב הגדול רבי חיים לחתן לך כי כן וכן הגיד לי ואנכי ידעתי כי יש לך בת בתולה הגונה וגם בית מיוחדת בחצר אך ספרים אין לך ע״כ ראה מה תעשה ו		
Khal-Hasidim_0218	Khal-Hasidim	embedding+lexical	0.958	זמר	True	high	The story explicitly describes R' Azriel's prayer practice as involving a 'pleasant song of his voice' (זמרת קולו) and melody (נעימות) that deeply affected listeners.	"ות כמוהו וכל אוזן שומעו תמאס כל התענוגים ותרצה להתענג בנעים זמרת קולו וישאר המלמד נבוך ברעיוניו ולא ידע מה לדון בזה כי הדרשן עצמו הוא אמר על המהרש""א כי הוא ספר מוסר ובע״ג שלו מתפלל לפני התיבה. וע""כ הבין כי אין זה דבר ריק"		
Khal-Hasidim_0001	Khal-Hasidim	embedding+lexical	0.958	זמר שיר	True	high	Sang with the children in a pleasant voice (מזמר עמהם בקול נעים).	"ק׳ עם תשב""ר שהוא הבל שאין בו חטא ובכל עת הליכת התנוקות היה מזמר עמהם בקול נעים ובחשק רב וישמע למרחוק כי עבודתו עלה מעלה והי׳ נ""ר גדול למעלה כמו מהשיר שהיו הלוים אומרים בבה""מק והיה עת רצון גדול למעלה. ויבא גם השטן בתוכם כ"		
Khal-Hasidim_0169	Khal-Hasidim	embedding	0.962		False	high	While the story mentions leading prayer (shliach tzibbur), it focuses on liturgical status and social consequences rather than the practice of music, melody, or song.	"ם כבנו שתקו ממנו ולא אמרו לו דבר : ויהי כי נתיחמה לבב האיש הנ""ל ויכנוס להר""ר ר׳ ליב ויאמר לו לי אבי השמעת כי ברוך ואפרים מתכנים עצמם בשם הגדול רבי ומפרסמים שמם בעולם ולא ענהו הרב דבר אולם לעת תפילת ערבית קרא הרב לאיש אחר"		
Khal-Hasidim_0158	Khal-Hasidim	embedding	0.962		False	high	'שיר' inside עשיר.	מחריש. וכל יום ויום הלך אליו בבכי ותחנונים והוא לא האזין את דבריו ולא שעה אליו. ואחיו העני הזה עם אנשי ביתו. היו מעוטפין ברעב בעירום ובחוסר כל. וכראותו כי כלתה נפשו מאוד ויבא עוד הפעם אליו בכה ויתחנן לו לאמר הושיעה אדוני		
Peer-MiKdoshim_0001	PeerMikdoshim	embedding	0.962		False	high	'שיר' inside העשיר.	גביר מ רישא לפניו ויען בקול גדול הוי ואבוי אנכי הוא האיש הזה כי טרם בואי הנה אל הצדיק הקדוש בא אלי איש עני ודפק על פתחי וזרקתי אותי מביתי ונפל מת על סף הבית ועתה גם כל יתר דברי קדשו יחדירו כברק תוך סתר לבבי בידעתי כי גרמ		
Sipurei-Zadikim_0006	Sipurei-Zadikim	embedding	0.962		False	high	The story mentions leading prayers (davening before the ark), but it contains no mention of melodies, songs, or musical elements.	". אבל מחמת כי הוא נתגדל אצל רבם כבנו שתקו ממנו ולא אמר לו דבר : ויהי כי נתיחמה לבב האיש הנ""ל ויכנוס להר״ר ר׳ ליב ויאמר לו אבי השמעת כי ברוך ו אפרים מתכנים עצמם בשם הגדול רבי ומפרסמים ומפרסים שמם בעולם ולא ענהו הרב דבר. א"		
Mifalot-HaZadikim_0006	Mifalot-HaZadikim	embedding	0.961		False	high	The story focuses on the mitzvah of hospitality and the fate of a specific family; it contains no mention of singing, melodies, or musical instruments.	 ועתה טוב לי מאז כי הוא הכה אותי תמיד ועתה כשהוא מת ואמי ג״כ מתה וביתו נשרף והונו ורכושו נאבד טוב לי מאוד כי יכול אני לילך בשרירות לבי ואין מוחה בידי ונתחברתי אל העניים המסבבים וסבותי גם אני עליהם לשקוד על פתחי נדיבים לב		
Maase-Zadikim_0006	maase-zadikim	embedding	0.961		False	high	'שיר' inside עשיר.	 לבעל ואתה תהיה שר בין השרים ועוד תהיה גדול מהם בעבור חכמתך הגדולה : ויאמר האיש ההוא הנה אנכי שומע לך בדבר הזה אך בזאת תאות לי לעשות מתחלה משתה גדול להקהיל שרים רבים ונכבדים למען ידעו ויכירו אותי מהיום הזה לשר ולגדול ותא		
Khal-Hasidim_0170	Khal-Hasidim	embedding	0.96		False	high	'שיר' inside עשיר (wealthy).	היה היה נא לי לבעל ואתה תהיה שר בין השרים ועוד תהיה גדול מהם בעבור חכמתך הגדולה : ויאמר האיש ההוא הנה אנכי שומע לך בדבר הזה אך בזאת תאות לי לעשות מתחלה משתה גדול להקהיל שרים רבים ונכבדים למען ידעו ויכירו אותי מהיום הזה ל		
Peer-MiKdoshim_0006	PeerMikdoshim	embedding	0.96		False	high	The story focuses on themes of financial trust in the Tzadik and the fulfillment of charitable vows; it contains no mention of music, melodies, or song.	עד מאוד ויאמר להם חידושי תורה מאשר הולידו עשתונתיו עד כי היה לפלא בשכלו הזך והישר וברוב חריפתו ובקיאותו ויבקש אחד מהאנשים לתקוע כף להתקשר בקישורי חיתון כדת ולא נתנו חבירו באומרו הלא עלינו לשמור מוצא פי הצדיק כי לא דבר רי		
Khal-Hasidim_0202	Khal-Hasidim	embedding	0.96		False	high	The story focuses on oaths, childlessness, and Passover preparations, with no mention of music, melody, or singing.	 הקדוש הסבא קדישא כי יתפלל בעדו להשם ית' שיושיעהו בפרי בטן והצדיק הנזכר היה מדחה אותו בלך ושוב בכל יום פעם אמר לו כ כי יעשה סעודת מרעים להחסידים והמה יברכו אותו אולי יעלה בידם וכן עשה ולא הועילו לו מאומה ובכל פעם בואו לר		
Shivhei-Habesht_0005B	Shivhei-Habesht	embedding	0.96		False	high	The text describes intense prayer (tefillah), weeping, and exorcism, but does not explicitly mention melody, singing, or musical instruments as a practice.	"כא""וא כפי מעלתו ו הבעש״ט נכנס באחרונה וכשראתה אותו ואמרה ב""ה ר׳ ישראל כ' עדיין רך בשנים אמרה לו אתה סבור שאני מפחד ממך לא כי אני ידעתי שהזהירו אותך מן השמי' שלא לעסוק בשמות הקדושים עד שישתלמו לך ששה ושלשים שנה והוא הי׳ נ"		
Khal-Hasidim_0004	Khal-Hasidim	embedding	0.96		False	high	The story focuses on prayer, ritual immersion, and the Besht's hidden holiness, but contains no mention of music, singing, or melodies.	"י לפלא בעיניו ויהי בבוקר וילך לבית התבודדות להתפלל שם כדרכו ובבואו לביתו בא שמח וטוב לב בנשיאת ראש והלך בביתו אנה ואנה לומר אסדר לסעודתא ועשה קדושא רבא כדרכו בדביקות נפלא ובתוך הסעודה ביקש את האורח שיאמר ד""ת. ולא היה יוד"		
Peer-MiKdoshim_0007	PeerMikdoshim	embedding	0.96		False	high	The story centers on a Tzaddik's clairvoyance and a scoffer's repentance, with no depiction of music, singing, or melodies.	ום יום יותר ויותר וכנחל נובע פרצו דברו החסיד בחכמה ועד כי התנשא זה לעומת זה בדבריו' ענהו הגביר אם כן איפוא בא ואראך כי שקר נחלו כל החסידים ומאומה לא ידע הרבי ולאות נאמן התבונן מהר כי אתה הוא ששמעת בעצמך נאצות וגידופים על		
Khal-Hasidim_0173	Khal-Hasidim	embedding	0.96		False	high	The story mentions crying and wailing (יללה, צעקה) during prayer and distress, but no actual music, melodies, or songs as a practice.	ל אשר עשה עד כה וכאשר נתייגע בזה מעט אז כמו נד נצבו לפניו כל העבירות שעשה מעודו. ויתמהמה מאוד ויעמוד הרבה ולא היה יכול לומר סלח לנו. עד כי נתחרט מאוד על כל מה שעשה וקבל עליו לעזוב חטאיו על להבא ועתה ישוב לביתו תיכף ולא י		
Shivhei-Habesht_0060	Shivhei-Habesht	embedding	0.959		False	high	The story focuses on piety, charity, and spiritual intercession; there is no mention of music, singing, or melodies.	ער א׳ ולא דיברה מאומה רק שעשתה תנועות כאילו אינו רוצה לקבלה ונתן לפניה עוד זעקסער ולא קיבלה אמר לה מי שמך לגבאי צדקה ולגנוב מקופת צדקה ולא השיבה כלום ולא הקפידה ע״ז ולא עשו בה הדברים הלז שום רושם מחמת שהיתה מחזקת במידות 		
Peer-MiKdoshim_0008	PeerMikdoshim	embedding	0.958		False	high	'שיר' inside שירגיש (will feel).	דיק וקבל עליו לחטט אחר מדת קמצנות מדה מגונ' הלזו עד תומה כי הצדיק העיד עליו כי יתר כל תכונות נפשו נכונים ושלימים בעבודת השם וכל מדותיו בנוים היו על אדני האמונה היושר והחסידות והנה כל העומדים החרידו לקול הסיפור והאורח סיפ		
Khal-Hasidim_0239	Khal-Hasidim	embedding	0.958		False	high	'שיר' inside עשירים.	תועפת עשרך אל תבעתני כי אמנה אנכי לא לעגלי זהבך אסגוד אך בנפשך אל יהרהוביך עוז העור את עיניך ואל תנקש באמרי פיך ואל תהי חכם בעיניך כי רע ומר גורל כל אנשי רבים המפיחים על הצדיקים כזבים מאורי עולם המה מועדי דור ודור ולפלח 		
Khal-Hasidim_0002	Khal-Hasidim	embedding	0.958		False	high	The story focuses on mystical writings, magical feasts, and solitude in the mountains; it contains no mention of music or melody as a practice, other than an incidental idiomatic phrase.	 כך ישן הבעש״ט ויעמוד בן הרב ולקח קונטרס אחד מהכתבים וינח לפניו ועשה א״ע עוד כאילו הוא ישן וכאשר נעור הבעש״ט וראה את הקונטרס נזדעזע נזדזע מאוד ולמד אותם ויציעם בתוך חיקו. וכן עשה בן הרב עוד בלילה אחרת עד שראה בבירור שזה 		
Shivhei-Harav_0018	Shivhei-Harav	embedding	0.958		False	high	The story focuses on the Napoleonic Wars, a spiritual competition involving Shofar blowing (a ritual, not music per se), and the Rebbe's death; it contains no mention of melodies, songs, or musical practice.	דש בחדשו ומידי שבת בשבתו בשבתי שהראה להם באספקלריא המאירה האיר הברקאי ומתחזיא מסיפא עלמא ועד סופיה גדול ה׳ ומהולל מאוד בעירו הר הי קדשו וברכנו בקול רם ונשא ברכת חכם הרזים ברוך שחלק מחכמתו ליריאיו : והן עתה בעו״ה חשך השמש		
Shivhei-Habesht_0207	Shivhei-Habesht	embedding	0.958		False	high	The story describes the passing of the Baal Shem Tov and his final teachings and prayers, but it contains no mention of music, melodies, or song.	"סגולתו לנעור כל הלילה כתקון האר""י ז""ל ואמר לפניהם ד״ת על ענין הסדר וענין מ״ת בבקר שלח לאנשי סגולתו שיתאספו כולם וצוה לר׳ ליב קעסלר ועוד א׳ שכחתי שמו שיתעסקו בקבורתו ולימד ולמד אותם על גופו על כל אבר הראה להם סימנים איך נ"		
Sipurei-Zadikim_0013	Sipurei-Zadikim	embedding	0.958		False	high	The story focuses on the succession of a rabbi and a hidden tzaddik (a tailor) with no mention of music, singing, or melodies.	" אצליכם לרב ולמורה כאשר גזר עלי זה הצדיק החייט נ""ע. ויעשו כן ויהי כאשר באו סמוך ל לובלין ויצאו לקראתו לקרתו המון רב ויקבלו אותו בשמחה רבה ובכבוד גדול ויהי ביום השבת אחר הדרשה בסעודה שלישית ויבואו אליו כל אנשים מכובדי העי"		
Khal-Hasidim_0013	Khal-Hasidim	lexical	0.956	שיר	False	high	The mention of 'songs and praises' refers to the recitation of Psalms (Tehillim) rather than a depicted practice of music or melody.	"ן הרב הקדוש ר׳ אדם בעש״ט ז""ל. ויהי כל ימי הנסיעה בספינה אמר שירות ותשבחות בספר תהלים כמו אדם פשוט עד בואו ל סטאמבול עם בתו הצדקת המפורסמת מרת אדל אם הבנים האחים הקדושים המפורסמים המפורסמם מוה""רר אפרים מ סדילקב ז""ל בעמה""ח"		
Khal-Kdoshim_0003	Khal-Kdoshim	lexical	0.955	שיר	False	high	The mention of 'songs of David' is a poetic reference to the recitation of Psalms (Tehillim) in prayer and does not depict music or melody as a distinct practice.	י השחיתו התעיבו והם לא ידעו אך ימוצו שפעת העמים ויינקו חלב עשירת הישמעאלים וינצלו את כל אשר איננו יהודי אשר דתו שונה מדתיהם הדברים יצאו מפי הבישאף והשמועה פרשה לה כנפיים עד מעבר לנהרי כוש ותהי משטמה גדולה על כל היהודים ע		
Maase-Zadikim_0015	maase-zadikim	lexical	0.955	שיר	False	high	'שיר' inside עשיר.	דוש אינם לבטלה והוא היה חתן גביר מפורסם והוא בעצמו היה ג״כ עשיר גדול ויחשוב דברים שונים ורוחו נהפך לו לעצב ודאגה. אך הוא נסע עם חברת חברה חסידים וכאשר באו לאכסניא אחר איזה פרסאות נחו מעט וישתו משקה למען ישמחו את האברך הנ		
Khal-Hasidim_0222	Khal-Hasidim	lexical	0.954	שיר	False	high	'שיר' inside עשיר.	"דוש אינם לבטלה והוא היה חתן גביר מפורסם והוא בעצמו היה ג""כ עשיר גדול ויחשוב דברים שונים ורוחו נהפך לו לעצב ודאגה. אך הוא נסע עם חברה חסידים וכאשר באו לאכסניא אחר איזה פרסאות נחו מעט וישתו משקה למען ישמחו את האברך הנ""ל וש"		
Shivhei-Habesht_0001	Shivhei-Habesht	lexical	0.953	זמר שיר	True	high	The story explicitly describes the young Besht leading children in song ('מזמר עמהם') and relates the spiritual quality of this singing to the music of the Levites in the Temple.	ק' עם תשב״ר שהוא הבל שאין בו חטא. ובכל עת הליכת התנוקת הי' מזמר עמהם בקול נעים ובחשק רב וישמע למרחוק כי עבודתו עלה למעלה למעלה, כי הי' הנחת גדול למעלה כמו מהשיר שהיו הלוים אומרים בבהמ״ק והיה עת רצון גדול למעלה. ויבא גם ה		
Shivhei-Harav_0016	Shivhei-Harav	lexical	0.953	נגן כינור	True	high	The story explicitly describes the boy playing the violin ('כינור') as a way to soothe his sorrow while being held in the church attic.	ה ויכנוס הדבר בלבו. ויתמרמר ויקח הנער את הכינור כי היה יודע נגן בכינור ויחשוב להפיס צערו בזאת וכן היה הקיצור בפעם הרביעי ובפעם החמישי נתמרמר מאד עד כי לא היה יכול לסבול ויבך מאוד במר נפשו על אשר קרה לו כאלה וירצה לצאת לח		
Adat-Zadikim_0022	Adat-Zadikim	lexical	0.952	שיר	True	high	The story describes the community welcoming the Rema into the city with drums, various musical instruments, and the playing of flutes.	" נשאר אף תינוק בעריסה אשר לא יצאו לקראת הרב בתופים ובכל כלי שיר וכה הובילו אותו העירה בכבוד ההדר לכל חסידיו והחליל מכה לפניהם וכרוז יוצא מלפניהם פנו מקום לכבוד רבינו משה אב""ד ושר העיר קראקא : אולם הבישוף בראותו תבנית ודמ"		
Khal-Hasidim_0174	Khal-Hasidim	lexical	0.952	שיר	False		[error] Unterminated string starting at: line 1 column 55 (char 54)	פר שארית יהודא על הלכ' מליחה) ולאשר כי האיש ר' ברוך לא היה עשיר ואחרי פטירתו נשארו בניו הקטנים עניים ומחמת כי התמידו מאוד בלימוד לא הסתכלו כלל על צרכי הגשמיות וכאשר נתפרסם בעולם גדולת הרב המגיד הגדול מ מעזריטש ונשמע בעול		
Khal-Hasidim_0171	Khal-Hasidim	lexical	0.952	שיר	False		[error] Expecting value: line 4 column 15 (char 60)	"ז""ל. והנה שמע כי נפלאות נשמע מ הרב הקדוש מ מעזיבוז בעת אמרו שיר השירים בערב שבת אחר הטבילה כי ממש כמלאך אלקים צבאות הוא והוא בוער כאש וההתלהבות הוא עד למעלה. כנודע לכל כי אמרו עליו שהי' לו ניצץ ניצוץ מנשמת שלמה המלך ע""ה."		
Maase-Zadikim_0005	maase-zadikim	lexical	0.952	שיר	False	high	The mention of 'songs and praises' refers to the recitation of Psalms (Tehillim) rather than a musical practice, melody, or the use of instruments.	"ן הרב הקדוש ר' אדם בעש״ט ז""ל. ויהי כל ימי הנסיעה בספינה אמר שירות ותשבחות ב ספר תהלים כמו אדם פשוט עד בואו ל סטאמבול עם בתו הצדקת המפורסמת מרת אדל אם הבנים האחים הקדושים המפורסמים מוהרר מוהרר אפרים מ סדילקב ז""ל בעהמ""ח ספ"		
Shivhei-Habesht_0004	Shivhei-Habesht	lexical	0.951	זמר	True	high	The story explicitly describes the Baal Shem Tov singing the liturgical song 'Asader Lise'udata' (וזמר אסדר לסעודתא) as part of his devotional Shabbat practice.	ובבואו לביתו בא שמח וטוב לב בנשיאת ראש והלך בביתו אנה ואנה וזמר אסדר לסעודתא ועשה קידושא רבא כדרכו בדביקות נפלא, ובתוך הסעודה ביקש את האורח שיאמר ד״ת. ולא היה יודע מה שיאמר לפניו כי הי' כמעט כמבולבל. ואמר לפניו מאמר עם פ		
Shivhei-Habesht_0050A	Shivhei-Habesht	lexical	0.951	ניגון זמר	True	high	The story explicitly describes the Baal Shem Tov singing 'Lecha Dodi' and attributes the creation of spirits to a cantor and bass singer's performance in the synagogue.	" פחדו ואמרו מה איכפת לך והתחילו פ""ש להתלוצץ ולזמר לכה דודי בניגון של הבעש״ט ועשה מה שעשה ונפלו השני מזיקים לארץ ולא יכלו לקום והתחילו להתחנן לפניו ואמר תיכף תראו שהילדים יבריאו אמרו האחד מה שעבר אין כי הזיקו אברים פנימים"		
Adat-Zadikim_0010	Adat-Zadikim	lexical	0.951	זמר שיר	False		[error] Unterminated string starting at: line 4 column 16 (char 61)	" ליל ש""ק באו כל חשובי העיר ואחרי אשר עשה בעש״ט קידוש כדרכו וזמרו זמירות ואכלו דגים והביאו המרק של שבת ולקח הבעש״ט מעט בכף והריח בו ואמר מריח ריח של נבילה. ויצו ליקח אותה מעל השולחן ולא טעמו טעם בשר כל השבת הוא ואנשיו המא"		
Shivhei-Habesht_0197	Shivhei-Habesht	lexical	0.95	שיר	False	high	The story focuses on the mystical understanding of the language of animals and birds (sichat chiyot ve-ofot) and mentions Perek Shira, but it does not depict music, melody, or singing as a practice.	"ך החיות לכל החיות שלמטה ומפני נשר לעופות שלמטה וזהו סוד פרק שירה כי כפי הדיבור במרכבה העליונה בכל ב""ח וב""ח כן משתלשל למטה מטה בבהמות חיות ועופות והנה מי שהו' חכם ומבין מדעתו ומסתכל בכל דבר על שרשו של מעל' במרכבה העליונה "		
